assignment_number,comments,participant_id,batch,processed_text,Dominant_Topic,Perc_Contribution,Topic_Keywords,All_Topics
254.0,The simulation has 4 kinds of species but the core tasks need at least 5 species. And it finished the challenge task by adding plants and virus.,13,2,"['task', 'challenge', 'task', 'virus']",Core Tasks,0.33333334,"core, standard, implementation, program, compile, submission, code, extension, function, error","[('Core Tasks', 0.33333334), ('Extension Tasks', 0.33333334), ('Code/Compilation', 0.33333334)]"
67.0,The simulation has 6 kinds of species and it finished the challenge task by adding plants.,13,2,"['kind', 'challenge', 'task']",Core Tasks,0.33333334,"core, standard, implementation, program, compile, submission, code, extension, function, error","[('Core Tasks', 0.33333334), ('Extension Tasks', 0.33333334), ('Code/Compilation', 0.33333334)]"
135.0,"The simulation has 5 kinds of species: cheeta, lion, giraffe, gazelle and zebra. It introduces grass as challenge task.",13,2,"['introduce', 'task']",Core Tasks,0.33333334,"core, standard, implementation, program, compile, submission, code, extension, function, error","[('Core Tasks', 0.33333334), ('Extension Tasks', 0.33333334), ('Code/Compilation', 0.33333334)]"
63.0,"The simulation models multiple species: dory, blueWhale, dophin, shark, nemo and orca. This work introduced the plants for the challenge works.",13,2,"['bluewhale', 'challenge']",Core Tasks,0.33333334,"core, standard, implementation, program, compile, submission, code, extension, function, error","[('Core Tasks', 0.33333334), ('Extension Tasks', 0.33333334), ('Code/Compilation', 0.33333334)]"
133.0,The simulation has 5 kinds of species and it finished the challenge task by adding weather.,13,2,"['kind', 'challenge', 'task']",Core Tasks,0.33333334,"core, standard, implementation, program, compile, submission, code, extension, function, error","[('Core Tasks', 0.33333334), ('Extension Tasks', 0.33333334), ('Code/Compilation', 0.33333334)]"
11.0,The simulation has 5 kinds of species and it finished the challenge task by adding human factor,13,2,"['kind', 'challenge', 'task', 'factor']",Core Tasks,0.33333334,"core, standard, implementation, program, compile, submission, code, extension, function, error","[('Core Tasks', 0.33333334), ('Extension Tasks', 0.33333334), ('Code/Compilation', 0.33333334)]"
576.0,"The simulation has 5 kinds of species and it finished the challenge task by adding grass, weather and disease",13,2,"['kind', 'challenge', 'task']",Core Tasks,0.33333334,"core, standard, implementation, program, compile, submission, code, extension, function, error","[('Core Tasks', 0.33333334), ('Extension Tasks', 0.33333334), ('Code/Compilation', 0.33333334)]"
683.0,The simulation finished the core and challenge task well.,13,2,"['core', 'challenge', 'task']",Core Tasks,0.6666237,"core, standard, implementation, program, compile, submission, code, extension, function, error","[('Core Tasks', 0.6666237), ('Extension Tasks', 0.16669631), ('Code/Compilation', 0.16667996)]"
217.0,"Stable simulation, but only completes minimal objectives",26,2,['objective'],Core Tasks,0.33333334,"core, standard, implementation, program, compile, submission, code, extension, function, error","[('Core Tasks', 0.33333334), ('Extension Tasks', 0.33333334), ('Code/Compilation', 0.33333334)]"
623.0,"Most objectives completed, stable simulation",26,2,['objective'],Core Tasks,0.33333334,"core, standard, implementation, program, compile, submission, code, extension, function, error","[('Core Tasks', 0.33333334), ('Extension Tasks', 0.33333334), ('Code/Compilation', 0.33333334)]"
315.0,"Stable, most objectives complete",26,2,['objective'],Core Tasks,0.33333334,"core, standard, implementation, program, compile, submission, code, extension, function, error","[('Core Tasks', 0.33333334), ('Extension Tasks', 0.33333334), ('Code/Compilation', 0.33333334)]"
167.0,No disease,6,2,[],Core Tasks,0.33333334,"core, standard, implementation, program, compile, submission, code, extension, function, error","[('Core Tasks', 0.33333334), ('Extension Tasks', 0.33333334), ('Code/Compilation', 0.33333334)]"
681.0,Both genders can breed around males,6,2,[],Core Tasks,0.33333334,"core, standard, implementation, program, compile, submission, code, extension, function, error","[('Core Tasks', 0.33333334), ('Extension Tasks', 0.33333334), ('Code/Compilation', 0.33333334)]"
520.0,No disease,6,2,[],Core Tasks,0.33333334,"core, standard, implementation, program, compile, submission, code, extension, function, error","[('Core Tasks', 0.33333334), ('Extension Tasks', 0.33333334), ('Code/Compilation', 0.33333334)]"
415.0,No disease,6,2,[],Core Tasks,0.33333334,"core, standard, implementation, program, compile, submission, code, extension, function, error","[('Core Tasks', 0.33333334), ('Extension Tasks', 0.33333334), ('Code/Compilation', 0.33333334)]"
265.0,No day night cycle,6,2,['cycle'],Core Tasks,0.33333334,"core, standard, implementation, program, compile, submission, code, extension, function, error","[('Core Tasks', 0.33333334), ('Extension Tasks', 0.33333334), ('Code/Compilation', 0.33333334)]"
182.0,The weather implemented as part of time rather than separate functionality,6,2,"['part', 'functionality']",Core Tasks,0.33333334,"core, standard, implementation, program, compile, submission, code, extension, function, error","[('Core Tasks', 0.33333334), ('Extension Tasks', 0.33333334), ('Code/Compilation', 0.33333334)]"
639.0,No weather or disease interaction,6,2,['interaction'],Core Tasks,0.33333334,"core, standard, implementation, program, compile, submission, code, extension, function, error","[('Core Tasks', 0.33333334), ('Extension Tasks', 0.33333334), ('Code/Compilation', 0.33333334)]"
582.0,"Core task is good. It includes at least 5 different species (Zebra, Lion, Antelope, Hyena, Cheetah), with Lions, Hyenas and Cheetahs as predators and Zebras and Antelopes as non-predators. The Hyenas and Cheetahs compete for Antelopes as prey. Male/female genders are distinguished for breeding in some species like the Antelope and Cheetah classes. Time of day is tracked, with animals exhibiting different sleeping behavior at night. ",15,2,"['core', 'task', 'lion', 'antelope', 'sleeping']",Core Tasks,0.6666237,"core, standard, implementation, program, compile, submission, code, extension, function, error","[('Core Tasks', 0.6666237), ('Extension Tasks', 0.16669631), ('Code/Compilation', 0.16667996)]"
148.0,"The simulation appears to be working as described in the assignment. All core tasks are completed - there are 5 acting species (Wolf, Lion, Leopard, Sheep, Horse), with Wolves, Lions and Leopards as predators and Sheep and Horses as non-predators. Wolves and Leopards compete for Sheep and Horses as shared food sources. Males and females are distinguished and must meet to breed. Time of day is tracked and affects behavior. Some challenge tasks like weather and plants are also implemented. However, it seems the disease challenge task was not attempted.",15,2,"['core', 'task', 'horse', 'wolf', 'lion', 'leopard', 'horse', 'wolf', 'leopard', 'horse', 'affect', 'challenge', 'task', 'task']",Core Tasks,0.6666234,"core, standard, implementation, program, compile, submission, code, extension, function, error","[('Core Tasks', 0.6666234), ('Extension Tasks', 0.16669656), ('Code/Compilation', 0.16668001)]"
201.0,"The provided code does not compile successfully due to a missing Rabbit class. The code references a Rabbit class, but only a Rat class is present in the provided files. This is a significant correctness issue that prevents the program from running.",15,2,"['code', 'compile', 'code', 'reference', 'file', 'prevent', 'program']",Code/Compilation,0.7524029,"code, program, compile, error, standard, function, submission, implementation, extension, core","[('Code/Compilation', 0.7524029), ('Extension Tasks', 0.12380487), ('Core Tasks', 0.12379226)]"
229.0,"All core tasks seem to be completed, including having at least 5 different acting species (Rabbit, Fox, Wolf, Goat, Rat), at least 2 predators (Fox, Wolf) and 2 non-predators (Rabbit, Goat, Rat), predators competing for the same food source (e.g. Foxes eat both Rabbits and Rats), and species distinguishing male/female individuals that must meet to breed. Time of day is tracked and impacts behaviors like sleeping. All challenge tasks are completed. The question is no Replace the rabbit class and fox class of the template with other animals.",15,2,"['core', 'task', 'acting', 'fox', 'rat', 'individual', 'impact', 'challenge', 'task', 'question', 'replace', 'template']",Core Tasks,0.6666237,"core, standard, implementation, program, compile, submission, code, extension, function, error","[('Core Tasks', 0.6666237), ('Extension Tasks', 0.16669631), ('Code/Compilation', 0.16667996)]"
544.0,"Excellent work on completing all the core and challenge tasks! The simulation includes at least 5 acting species (Hyena, Lion, Gazelle, Mouse, Fennec Fox), with at least 2 predators (Hyena, Lion) and 2 non-predators (Gazelle, Mouse). The Hyena and Lion compete for Gazelles as a shared food source. The species distinguish males and females, requiring them to meet to propagate. Time of day is tracked, with some behaviors differing between day and night (nocturnal animals like Hyenas and Fennec Foxes only act at night). Plants (Grass) are simulated and eaten by some creatures. Weather effects like rain, fog, and heatwaves are implemented and influence behaviors. Diseases (Covid, Leptospirosis) spread between animals and through water sources.",15,2,"['core', 'challenge', 'task', 'gazelle', 'creature', 'rain', 'fog', 'heatwave', 'influence', 'leptospirosis', 'water']",Core Tasks,0.6666233,"core, standard, implementation, program, compile, submission, code, extension, function, error","[('Core Tasks', 0.6666233), ('Extension Tasks', 0.16669662), ('Code/Compilation', 0.16668005)]"
273.0,"The simulation is working as described in the assignment, with all core tasks completed. The challenge tasks of adding plants and weather have been implemented successfully. Plants grow and are eaten by some animals, and weather changes over time, influencing animal behavior and plant growth.",15,2,"['core', 'task', 'challenge', 'task']",Core Tasks,0.66662335,"core, standard, implementation, program, compile, submission, code, extension, function, error","[('Core Tasks', 0.66662335), ('Extension Tasks', 0.1666966), ('Code/Compilation', 0.16668004)]"
306.0,"The spawnGrass() method in the Grass class allows grass to grow in any adjacent gap, even if there is already grass there. This causes the grass to grow indefinitely. Completed all basic requirements and some challenge tasks. However, due to parameter settings and some logical problems, the system was unable to maintain balance for a long time and eventually evolved into a single species ecosystem.",15,2,"['spawngrass', 'method', 'gap', 'task', 'parameter', 'setting', 'problem', 'balance', 'ecosystem']",Core Tasks,0.33333334,"core, standard, implementation, program, compile, submission, code, extension, function, error","[('Core Tasks', 0.33333334), ('Extension Tasks', 0.33333334), ('Code/Compilation', 0.33333334)]"
92.0,"The simulation appears to be working as intended based on the description in the assignment. All core tasks have been completed - there are at least 5 acting species (Rat, Fox, Rabbit, Human, Cat), with rats and foxes as predators and rabbits as non-predators. The fox and cat compete for rabbits as a shared food source. The species distinguish males and females that need to meet to propagate. Time of day is tracked, with some creatures like cats and foxes only acting at night.

Several challenge tasks have also been implemented, demonstrating originality and technical excellence. This includes the addition of plants (grass, bushes, trees), weather that influences grass growth, and diseases like cold, cat flu and black death that spread between animals.",15,2,"['description', 'core', 'task', 'cat', 'fox', 'creature', 'cat', 'challenge', 'task', 'demonstrating', 'originality', 'bush', 'tree', 'influence', 'death', 'spread']",Core Tasks,0.6666238,"core, standard, implementation, program, compile, submission, code, extension, function, error","[('Core Tasks', 0.6666238), ('Extension Tasks', 0.16669631), ('Code/Compilation', 0.16667996)]"
487.0,"The code appears to implement the core requirements including at least 5 species (Hyena, Warthog, Lion, Meerkat, Insect), with predators (Hyena, Lion) and non-predators (Warthog, Meerkat). Lions and Hyenas compete for Warthogs as prey. Animals have genders and can only breed when male and female meet. Time of day is tracked and some creatures like Lions have different sleeping behaviors. However, I was unable to fully verify the program's execution as no window appeared when running the simulation.",15,2,"['core', 'warthog', 'creature', 'lion', 'program', 'execution', 'window']",Code/Compilation,0.49475074,"code, program, compile, error, standard, function, submission, implementation, extension, core","[('Code/Compilation', 0.49475074), ('Core Tasks', 0.36514458), ('Extension Tasks', 0.14010467)]"
417.0,"Excellent work on completing all the core tasks and most of the challenge tasks. The simulation includes at least 5 acting species (Lion, Hyena, Wildebeest, WaterBuffalo, Grass), with predators (Lion, Hyena) and non-predators (Wildebeest, WaterBuffalo). Lions and Hyenas compete for shared food sources like Wildebeest. Species distinguish males and females, requiring them to meet to propagate. Time of day is tracked, with some behaviors differing between day and night, such as Lions and Hyenas only moving at night. Plants (Grass) and disease mechanics are implemented, but weather is not included. ",15,2,"['core', 'task', 'challenge', 'task', 'waterbuffalo', 'lion', 'hyena', 'lion', 'hyena', 'mechanic']",Core Tasks,0.6666237,"core, standard, implementation, program, compile, submission, code, extension, function, error","[('Core Tasks', 0.6666237), ('Extension Tasks', 0.16669631), ('Code/Compilation', 0.16667996)]"
241.0,"Excellent work on completing all the core and challenge tasks! The simulation includes at least 5 acting species (Hyena, Snake, Wildebeest, Antelope, Lion), with 3 predators (Hyena, Snake, Lion) and 2 non-predators (Wildebeest, Antelope). The Hyena and Lion compete for Wildebeest as a shared food source. The species distinguish males and females, requiring them to meet to propagate. Time of day is tracked, with behaviors differing between day and night.

The challenge tasks of adding plants (grass), weather (clear skies, heavy rain, heavy fog), and disease (infected animal count displayed) were all implemented successfully. ",15,2,"['core', 'challenge', 'task', 'lion', 'challenge', 'task', 'sky', 'rain', 'count']",Core Tasks,0.66662335,"core, standard, implementation, program, compile, submission, code, extension, function, error","[('Core Tasks', 0.66662335), ('Extension Tasks', 0.16669662), ('Code/Compilation', 0.16668002)]"
355.0,"All core tasks are completed, including at least 5 acting species (Fjallrav, Lodjur, Ren, Varg, Brunbjorn), with at least 2 predators (Varg, Brunbjorn) and 2 non-predators (Fjallrav, Ren). The Varg and Brunbjorn compete for shared prey species. Males and females are distinguished and must meet to propagate. Time of day is tracked and some behaviors differ based on time.

Multiple challenge tasks were implemented demonstrating originality and technical excellence. Plants (Druvflader, Maskros) are simulated and eaten by some animals. Weather effects like fog and rain impact animal visibility and plant growth. A disease mechanic was added where eating Druvflader has a chance to infect animals. ",15,2,"['core', 'task', 'varg', 'varg', 'ren', 'varg', 'challenge', 'task', 'demonstrating', 'originality', 'druvflader', 'fog', 'rain', 'impact', 'visibility', 'mechanic', 'druvflader', 'chance']",Core Tasks,0.6666237,"core, standard, implementation, program, compile, submission, code, extension, function, error","[('Core Tasks', 0.6666237), ('Extension Tasks', 0.16669631), ('Code/Compilation', 0.16667996)]"
254.0,"While the simulation includes all the required species and behaviors from the core tasks, and implements some challenge tasks, there appear to be issues with balancing the populations. The sheep reproduce and survive at a much higher rate than the other species, leading to them overtaking the entire simulation. This suggests some of the breeding, feeding, and survival parameters may need adjustment to create a more stable ecosystem.",15,2,"['core', 'task', 'challenge', 'task', 'population', 'sheep', 'reproduce', 'rate', 'suggest', 'survival', 'parameter', 'adjustment', 'ecosystem']",Core Tasks,0.6666237,"core, standard, implementation, program, compile, submission, code, extension, function, error","[('Core Tasks', 0.6666237), ('Extension Tasks', 0.16669631), ('Code/Compilation', 0.16667996)]"
67.0,"The simulation appears to be working as described in the assignment. All core tasks are completed, including at least 5 acting species (Shark, SeaLion, Penguin, Salmon, Krill), with at least 2 predators (Shark, SeaLion) and 2 non-predators (Penguin, Salmon). The Shark and SeaLion compete for Penguins as a shared food source. The species distinguish males and females, requiring them to meet to propagate. Time of day is tracked, with animal behavior differing between day (active) and night (sleeping). Several challenge tasks are also implemented, such as plants, weather affecting temperature and animal behavior, and disease transmission between animals of the same species. ",15,2,"['core', 'task', 'shark', 'sealion', 'krill', 'shark', 'sealion', 'shark', 'sealion', 'penguin', 'challenge', 'task', 'temperature', 'transmission']",Core Tasks,0.6666237,"core, standard, implementation, program, compile, submission, code, extension, function, error","[('Core Tasks', 0.6666237), ('Extension Tasks', 0.16669631), ('Code/Compilation', 0.16667996)]"
135.0,"The simulation works as described in the assignment and all core and challenge tasks are completed. There are at least 5 acting species including Cheeta, Lion, Giraffe, Gazelle and Zebra. The Cheeta and Lion are predators that compete for the same food source of Gazelles and Zebras. Genders are distinguished for the species and they can only breed when a male and female meet. The time of day is tracked, likely influencing some creature behaviors. Plants are simulated and eaten by the prey animals. Weather effects like rain and storms impact plant growth. Disease can infect and spread between animals. ",15,2,"['core', 'challenge', 'task', 'cheeta', 'gazelle', 'creature', 'rain', 'storm', 'impact', 'spread']",Core Tasks,0.6666238,"core, standard, implementation, program, compile, submission, code, extension, function, error","[('Core Tasks', 0.6666238), ('Extension Tasks', 0.16669631), ('Code/Compilation', 0.16667996)]"
63.0,"The application works as described in the assignment and all core tasks are completed. The simulation includes at least 5 acting species (Nemo, Dory, Dolphin, BlueWhale, Orca, Shark, Plant), with Orca and Shark as predators competing for food sources like Nemo and Dory. Male and female individuals are distinguished for breeding in some species. Creature behavior differs based on time of day. ",15,2,"['core', 'task', 'bluewhale', 'orca', 'shark', 'orca', 'shark', 'individual', 'species', 'creature']",Core Tasks,0.6666237,"core, standard, implementation, program, compile, submission, code, extension, function, error","[('Core Tasks', 0.6666237), ('Extension Tasks', 0.16669631), ('Code/Compilation', 0.16667996)]"
133.0,"The simulation appears to be working as described in the assignment. All core tasks are completed - there are 5 different acting species (Antelope, Crocodile, Elephant, Lion, Giraffe), with Lions and Crocodiles as predators competing for Antelopes, and Elephants, Giraffes and Antelopes as non-predators. Males and females are distinguished and creatures only propagate when a male and female meet. Time of day is tracked and some creatures exhibit different behavior at certain times, like sleeping at night.

In addition, several impressive challenge tasks have been implemented, demonstrating technical excellence and creativity. This includes simulating plants that grow and are eaten, changing weather that influences behavior, and diseases that can infect and spread between animals. ",15,2,"['core', 'task', 'crocodile', 'elephant', 'lion', 'lion', 'crocodile', 'antelope', 'non', 'creature', 'creature', 'challenge', 'task', 'influence', 'spread']",Core Tasks,0.6666237,"core, standard, implementation, program, compile, submission, code, extension, function, error","[('Core Tasks', 0.6666237), ('Extension Tasks', 0.16669631), ('Code/Compilation', 0.16667996)]"
11.0,"All core tasks are completed, including at least 5 acting species (Snake, Lion, Human, Sheep, Bird, Moose), with at least 2 predators (Snake, Lion, Human) and 2 non-predators (Sheep, Bird, Moose). The Lion and Snake compete for the same food sources. Some species distinguish male and female individuals, requiring them to meet to propagate. Time of day is tracked, with some creatures exhibiting different behavior at certain times. The challenge tasks of adding plants, weather, and disease have also been implemented successfully.",15,2,"['core', 'task', 'bird', 'moose', 'moose', 'individual', 'creature', 'task']",Core Tasks,0.6666237,"core, standard, implementation, program, compile, submission, code, extension, function, error","[('Core Tasks', 0.6666237), ('Extension Tasks', 0.16669631), ('Code/Compilation', 0.16667996)]"
576.0,"The simulation appears to be working as described in the assignment. All core tasks have been completed, including at least 5 acting species (Tiger, Zebra, Mouse, Lion, Hare), with at least 2 predators (Tiger, Lion) and 2 non-predators (Zebra, Mouse, Hare). The Lion and Tiger compete for Zebras as a shared food source. Males and females are distinguished and must meet to propagate. Time of day is tracked and impacts behaviors. Several challenge tasks were also implemented, like adding plants (Grass), weather that impacts grass growth, and disease that can spread between animals. ",15,2,"['core', 'task', 'tiger', 'tiger', 'tiger', 'impact', 'challenge', 'task', 'impact']",Core Tasks,0.6666233,"core, standard, implementation, program, compile, submission, code, extension, function, error","[('Core Tasks', 0.6666233), ('Extension Tasks', 0.16669667), ('Code/Compilation', 0.16668004)]"
683.0,"The simulation includes at least 5 acting species (Fox, Rabbit, Plants, Vulture, Nuts, Squirrel, Mouse), with foxes and vultures as predators, and rabbits, squirrels and mice as non-predators that eat plants/nuts. Foxes and vultures compete for rabbits and squirrels as shared food sources. The species distinguish males and females which must meet to propagate. Time of day is tracked, with some creatures like rabbits and squirrels not moving at night. One of the challenge tasks, adding plants, was also implemented successfully. However, one flaw is that the Fox and Rabbit classes from the original template were retained instead of being fully replaced by new species.",15,2,"['fox', 'vulture', 'fox', 'creature', 'challenge', 'task', 'flaw', 'template']",Core Tasks,0.33333334,"core, standard, implementation, program, compile, submission, code, extension, function, error","[('Core Tasks', 0.33333334), ('Extension Tasks', 0.33333334), ('Code/Compilation', 0.33333334)]"
464.0,some challenges not implemented,20,2,['challenge'],Core Tasks,0.33333334,"core, standard, implementation, program, compile, submission, code, extension, function, error","[('Core Tasks', 0.33333334), ('Extension Tasks', 0.33333334), ('Code/Compilation', 0.33333334)]"
568.0,"implemented all the challenges, extra marks for good looking UI.",20,2,"['challenge', 'mark', 'ui']",Core Tasks,0.33333334,"core, standard, implementation, program, compile, submission, code, extension, function, error","[('Core Tasks', 0.33333334), ('Extension Tasks', 0.33333334), ('Code/Compilation', 0.33333334)]"
216.0,"no genders for animals, no weather, no diseases",20,2,[],Core Tasks,0.33333334,"core, standard, implementation, program, compile, submission, code, extension, function, error","[('Core Tasks', 0.33333334), ('Extension Tasks', 0.33333334), ('Code/Compilation', 0.33333334)]"
35.0,all basic tasks and most challenges completed,20,2,"['task', 'challenge']",Core Tasks,0.33333334,"core, standard, implementation, program, compile, submission, code, extension, function, error","[('Core Tasks', 0.33333334), ('Extension Tasks', 0.33333334), ('Code/Compilation', 0.33333334)]"
463.0,all basic tasks and most challenges completed,20,2,"['task', 'challenge']",Core Tasks,0.33333334,"core, standard, implementation, program, compile, submission, code, extension, function, error","[('Core Tasks', 0.33333334), ('Extension Tasks', 0.33333334), ('Code/Compilation', 0.33333334)]"
546.0,"male fox and female fox don't count as different animals.
Student has not implemented at least five different kinds of acting species.
Challenge tasks have been completed.",20,2,"['kind', 'species', 'challenge', 'task']",Core Tasks,0.33333334,"core, standard, implementation, program, compile, submission, code, extension, function, error","[('Core Tasks', 0.33333334), ('Extension Tasks', 0.33333334), ('Code/Compilation', 0.33333334)]"
