assignment_number,comments,participant_id,batch,processed_text,Dominant_Topic,Perc_Contribution,Topic_Keywords,All_Topics
18.0,"The code is exceptionally well documented. Each class and method has clear, detailed comments describing its purpose and parameters. In-line comments explain complex logic. Files contain header comments.",15,1,"['class', 'method', 'comment', 'purpose', 'parameter', 'line', 'comment', 'file', 'header', 'comment']",Subject,0.45927396,"method, class, annotation, header, output, parameter, value, return, role, type","[('Subject', 0.45927396), ('Quality', 0.3347055), ('Description', 0.20602053)]"
620.0,"The code is exceptionally well documented. Each class and method has clear, detailed comments describing its purpose and parameters. In-line comments explain complex logic. Files contain header comments.",15,1,"['class', 'method', 'comment', 'purpose', 'parameter', 'line', 'comment', 'file', 'header', 'comment']",Subject,0.459274,"method, class, annotation, header, output, parameter, value, return, role, type","[('Subject', 0.459274), ('Quality', 0.3347055), ('Description', 0.20602053)]"
466.0,"The code is very well documented. Nearly every class, method and complex code block has clear, useful comments explaining the purpose and functionality. Header comments provide good high-level documentation for each file. Javadoc style is used effectively.",15,1,"['class', 'method', 'block', 'comment', 'purpose', 'functionality', 'header', 'comment', 'file', 'style']",Quality,0.45832145,"use, line, display, functionality, purpose, type, block, argument, structure, annotation","[('Quality', 0.45832145), ('Subject', 0.33861214), ('Description', 0.20306638)]"
591.0,"The code is exceptionally well documented. Each class and method has clear, detailed comments describing its purpose and parameters. In-line comments explain complex logic. Files contain header comments.",15,1,"['class', 'method', 'comment', 'purpose', 'parameter', 'line', 'comment', 'file', 'header', 'comment']",Subject,0.45927307,"method, class, annotation, header, output, parameter, value, return, role, type","[('Subject', 0.45927307), ('Quality', 0.33470565), ('Description', 0.20602132)]"
587.0,"The code is exceptionally well documented. Each class and method has clear, detailed comments describing its purpose and parameters. In-line comments explain complex logic. Files contain header comments.",15,1,"['class', 'method', 'comment', 'purpose', 'parameter', 'line', 'comment', 'file', 'header', 'comment']",Subject,0.45927343,"method, class, annotation, header, output, parameter, value, return, role, type","[('Subject', 0.45927343), ('Quality', 0.33470562), ('Description', 0.206021)]"
50.0,"Your documentation is thorough and well-organized, significantly aiding in the understanding of the code's functionality. Each class and method is accompanied by clear comments explaining its purpose, parameters, and return values. Including header information in every file further demonstrates your attention to professional coding standards.",15,1,"['functionality', 'class', 'method', 'comment', 'purpose', 'parameter', 'value', 'header', 'information', 'file', 'attention']",Subject,0.51983696,"method, class, annotation, header, output, parameter, value, return, role, type","[('Subject', 0.51983696), ('Quality', 0.2973449), ('Description', 0.18281813)]"
655.0,"Most classes and methods have clear commenting explaining their purpose. Some methods and code blocks could use additional commenting, especially when performing complex operations. ",15,1,"['class', 'method', 'purpose', 'method', 'block', 'operation']",Quality,0.47759,"use, line, display, functionality, purpose, type, block, argument, structure, annotation","[('Quality', 0.47759), ('Subject', 0.40957868), ('Description', 0.11283132)]"
47.0,"Most classes, fields and methods have clear and useful documentation comments. The code itself is quite self-explanatory. Header comments are present. The documentation could be slightly more thorough in a few places, but overall it is quite good.",15,1,"['class', 'field', 'method', 'comment', 'self', 'header', 'comment', 'place']",Subject,0.74845356,"method, class, annotation, header, output, parameter, value, return, role, type","[('Subject', 0.74845356), ('Description', 0.1258466), ('Quality', 0.12569982)]"
262.0,"The code is very well documented. Nearly every class, method and complex code block has clear, useful comments explaining the purpose and functionality. Header comments provide good high-level documentation for each file. ",15,1,"['class', 'method', 'block', 'comment', 'purpose', 'functionality', 'header', 'comment', 'file']",Quality,0.45832172,"use, line, display, functionality, purpose, type, block, argument, structure, annotation","[('Quality', 0.45832172), ('Subject', 0.33861166), ('Description', 0.2030666)]"
2.0,"Your documentation is thorough and well-organized, significantly aiding in the understanding of the code's functionality. Each class and method is accompanied by clear comments explaining its purpose, parameters, and return values. Including header information in every file further demonstrates your attention to professional coding standards.",15,1,"['functionality', 'class', 'method', 'comment', 'purpose', 'parameter', 'value', 'header', 'information', 'file', 'attention']",Subject,0.5198373,"method, class, annotation, header, output, parameter, value, return, role, type","[('Subject', 0.5198373), ('Quality', 0.2973446), ('Description', 0.18281804)]"
400.0,Each class and method is clearly documented with its purpose and parameters. In-line comments explain complex logic. Files have header comments. Documentation is concise and useful without being overly verbose.,15,1,"['class', 'method', 'purpose', 'parameter', 'line', 'comment', 'file', 'header', 'comment']",Subject,0.4592731,"method, class, annotation, header, output, parameter, value, return, role, type","[('Subject', 0.4592731), ('Quality', 0.33470553), ('Description', 0.20602137)]"
525.0,"Classes and methods have some comments explaining their purpose. Some important methods have descriptive comments. However, documentation is a bit inconsistent - some methods and logical blocks lack comments where they would be helpful to understand the code.",15,1,"['class', 'method', 'comment', 'purpose', 'method', 'comment', 'bit', 'method', 'block', 'lack', 'comment']",Subject,0.45451188,"method, class, annotation, header, output, parameter, value, return, role, type","[('Subject', 0.45451188), ('Quality', 0.43023223), ('Description', 0.11525591)]"
358.0,"Most classes and functions have clear, useful comments explaining their purpose. A few more inline comments explaining complex logic would be helpful.",15,1,"['class', 'comment', 'purpose', 'inline', 'comment', 'logic']",Quality,0.49964947,"use, line, display, functionality, purpose, type, block, argument, structure, annotation","[('Quality', 0.49964947), ('Subject', 0.35987204), ('Description', 0.14047849)]"
137.0,"Each class and method has clear, well-written documentation. Class documentation summarizes the overall purpose. Method docs clearly explain the parameters, return values and what the method does. Some key sections have inline comments explaining complex logic. The documentation is quite thorough and helpful for understanding the code.",15,1,"['class', 'method', 'class', 'summarize', 'purpose', 'method', 'doc', 'parameter', 'value', 'section', 'comment', 'logic']",Subject,0.6727507,"method, class, annotation, header, output, parameter, value, return, role, type","[('Subject', 0.6727507), ('Quality', 0.22369866), ('Description', 0.103550665)]"
125.0,"Most classes and methods have clear, descriptive comments explaining their purpose. Some parameters and return values could use additional documentation. In-line comments are used effectively to explain complex logic. Class-level comments are present but could be more detailed in some cases.",15,1,"['class', 'comment', 'purpose', 'parameter', 'value', 'line', 'comment', 'logic', 'class', 'comment', 'case']",Subject,0.5338387,"method, class, annotation, header, output, parameter, value, return, role, type","[('Subject', 0.5338387), ('Quality', 0.36262357), ('Description', 0.1035377)]"
58.0,There are class-level and method-level comments explaining the purpose of each class and method. Some key variables are also commented. This makes the overall structure and intent of the code much clearer.,15,1,"['class', 'method', 'comment', 'purpose', 'class', 'method', 'variable', 'structure']",Quality,0.45430654,"use, line, display, functionality, purpose, type, block, argument, structure, annotation","[('Quality', 0.45430654), ('Subject', 0.4336295), ('Description', 0.11206394)]"
353.0,"Most classes and methods have clear comments explaining their purpose. Some key methods like act() and breed() have detailed descriptions of the behavior. However, some comments are a bit sparse - adding a few more, especially for complex logic, would help code comprehension. Class-level and file-level comments could also be more detailed in places.",15,1,"['class', 'comment', 'purpose', 'method', 'comment', 'logic', 'class', 'file', 'comment', 'place']",Subject,0.42491475,"method, class, annotation, header, output, parameter, value, return, role, type","[('Subject', 0.42491475), ('Description', 0.28755915), ('Quality', 0.28752607)]"
422.0,"Most classes and methods have some level of documentation, providing a basic overview of their purpose. However, the documentation is not always comprehensive - some parameters and return values lack descriptions, and some complex logic could use more in-depth explanations. ",15,1,"['class', 'method', 'overview', 'purpose', 'parameter', 'value', 'lack', 'logic', 'depth', 'explanation']",Subject,0.63658977,"method, class, annotation, header, output, parameter, value, return, role, type","[('Subject', 0.63658977), ('Quality', 0.2568465), ('Description', 0.106563784)]"
480.0,Class and method comments are present but fairly minimal. They state the obvious in many cases rather than providing insights into the code. ,15,1,"['class', 'method', 'comment', 'state', 'case', 'insight']",Subject,0.72358584,"method, class, annotation, header, output, parameter, value, return, role, type","[('Subject', 0.72358584), ('Description', 0.1382075), ('Quality', 0.1382067)]"
334.0,"The documentation is excellent. Each class and method has a clear, well-written comment explaining its purpose, parameters and return values. Key variables are documented. Header comments provide a class overview. The documentation allows the code to be easily understood and maintained.",15,1,"['class', 'method', 'comment', 'purpose', 'parameter', 'value', 'variable', 'header', 'comment', 'class', 'overview']",Subject,0.6907373,"method, class, annotation, header, output, parameter, value, return, role, type","[('Subject', 0.6907373), ('Quality', 0.21059994), ('Description', 0.09866276)]"
160.0,The documentation consists od comments that are some-what useful in understanding the code.,24,1,['comment'],Description,0.33333334,"concise, function, name, number, file, challenge, representation, type, elaboration, header","[('Description', 0.33333334), ('Subject', 0.33333334), ('Quality', 0.33333334)]"
473.0,The documentation consists od comments that are some-what useful in understanding the code.,24,1,['comment'],Description,0.33333334,"concise, function, name, number, file, challenge, representation, type, elaboration, header","[('Description', 0.33333334), ('Subject', 0.33333334), ('Quality', 0.33333334)]"
624.0,The documentation consists of comments that are some-what useful in understanding the code.,24,1,['comment'],Description,0.33333334,"concise, function, name, number, file, challenge, representation, type, elaboration, header","[('Description', 0.33333334), ('Subject', 0.33333334), ('Quality', 0.33333334)]"
311.0,The documentation is simply comments embedded in the code but does not help the reader understand the code.,24,1,"['comment', 'reader']",Description,0.33333334,"concise, function, name, number, file, challenge, representation, type, elaboration, header","[('Description', 0.33333334), ('Subject', 0.33333334), ('Quality', 0.33333334)]"
105.0,The documentation is simply comments embedded in the code but does not help the reader understand the code.,24,1,"['comment', 'reader']",Description,0.33333334,"concise, function, name, number, file, challenge, representation, type, elaboration, header","[('Description', 0.33333334), ('Subject', 0.33333334), ('Quality', 0.33333334)]"
654.0,The comments are somewhat useful in understanding the code.,24,1,[],Description,0.33333334,"concise, function, name, number, file, challenge, representation, type, elaboration, header","[('Description', 0.33333334), ('Subject', 0.33333334), ('Quality', 0.33333334)]"
79.0,Meets all the objectives of the rubric.,24,1,['objective'],Description,0.33333334,"concise, function, name, number, file, challenge, representation, type, elaboration, header","[('Description', 0.33333334), ('Subject', 0.33333334), ('Quality', 0.33333334)]"
45.0,Correct,24,1,[],Description,0.33333334,"concise, function, name, number, file, challenge, representation, type, elaboration, header","[('Description', 0.33333334), ('Subject', 0.33333334), ('Quality', 0.33333334)]"
51.0,"the comments are useful in understanding the code, however, the code is incomplete",24,1,['comment'],Description,0.33333334,"concise, function, name, number, file, challenge, representation, type, elaboration, header","[('Description', 0.33333334), ('Subject', 0.33333334), ('Quality', 0.33333334)]"
523.0,Missing documentation which causes variables not to be clear.,24,1,['variable'],Description,0.33333334,"concise, function, name, number, file, challenge, representation, type, elaboration, header","[('Description', 0.33333334), ('Subject', 0.33333334), ('Quality', 0.33333334)]"
410.0,The documentation consists of comments that are useful in understanding the code/structure of the program.,24,1,"['comment', 'structure', 'program']",Quality,0.6663274,"use, line, display, functionality, purpose, type, block, argument, structure, annotation","[('Quality', 0.6663274), ('Description', 0.16683666), ('Subject', 0.16683589)]"
490.0,The comments are somewhat useful in understanding the code.,24,1,[],Description,0.33333334,"concise, function, name, number, file, challenge, representation, type, elaboration, header","[('Description', 0.33333334), ('Subject', 0.33333334), ('Quality', 0.33333334)]"
124.0,The documentation of comments is useful in understanding the code or structure of the program.,24,1,"['structure', 'program']",Quality,0.66632736,"use, line, display, functionality, purpose, type, block, argument, structure, annotation","[('Quality', 0.66632736), ('Description', 0.1668367), ('Subject', 0.16683589)]"
77.0,The documentation consists of comments that are useful in understanding the code.,24,1,['comment'],Description,0.33333334,"concise, function, name, number, file, challenge, representation, type, elaboration, header","[('Description', 0.33333334), ('Subject', 0.33333334), ('Quality', 0.33333334)]"
252.0,The documentation is well-written and organised and clearly explains what the code is accomplishing and how.,24,1,[],Description,0.33333334,"concise, function, name, number, file, challenge, representation, type, elaboration, header","[('Description', 0.33333334), ('Subject', 0.33333334), ('Quality', 0.33333334)]"
236.0,"The code is clean, understandable and organised",24,1,[],Description,0.33333334,"concise, function, name, number, file, challenge, representation, type, elaboration, header","[('Description', 0.33333334), ('Subject', 0.33333334), ('Quality', 0.33333334)]"
549.0,The documentation consists of comments that are useful in understanding the code and structure of the program,24,1,"['comment', 'structure', 'program']",Quality,0.66632736,"use, line, display, functionality, purpose, type, block, argument, structure, annotation","[('Quality', 0.66632736), ('Description', 0.1668367), ('Subject', 0.1668359)]"
10.0,The documentation is well-written and organised and clearly explains what the code is accomplishing and how.,24,1,[],Description,0.33333334,"concise, function, name, number, file, challenge, representation, type, elaboration, header","[('Description', 0.33333334), ('Subject', 0.33333334), ('Quality', 0.33333334)]"
292.0,"The documentation is well-written, organised and clearly explains what the code is accomplishing and how",24,1,[],Description,0.33333334,"concise, function, name, number, file, challenge, representation, type, elaboration, header","[('Description', 0.33333334), ('Subject', 0.33333334), ('Quality', 0.33333334)]"
451.0,The comments are somewhat useful in understanding the code.,24,1,[],Description,0.33333334,"concise, function, name, number, file, challenge, representation, type, elaboration, header","[('Description', 0.33333334), ('Subject', 0.33333334), ('Quality', 0.33333334)]"
217.0,The code is very well documented with each class and method described well. Inputs and outputs are also described well with JavaDoc annotations,28,2,"['class', 'method', 'output', 'annotation']",Subject,0.76938313,"method, class, annotation, header, output, parameter, value, return, role, type","[('Subject', 0.76938313), ('Quality', 0.11536668), ('Description', 0.11525018)]"
623.0,The code is very well documented with appropriate use of JavaDoc annotations for method input and outputs,28,2,"['use', 'annotation', 'method', 'input', 'output']",Subject,0.60839933,"method, class, annotation, header, output, parameter, value, return, role, type","[('Subject', 0.60839933), ('Quality', 0.27772483), ('Description', 0.11387585)]"
315.0,The code is documented to a high standard throughout. Parameter and output annotations are used well.,28,2,"['parameter', 'output', 'annotation']",Subject,0.7545778,"method, class, annotation, header, output, parameter, value, return, role, type","[('Subject', 0.7545778), ('Quality', 0.122782536), ('Description', 0.12263967)]"
21.0,The code is documented to a high level throughout all classes and methods. The method inputs and outputs are described well,28,2,"['class', 'method', 'method', 'output']",Subject,0.75184554,"method, class, annotation, header, output, parameter, value, return, role, type","[('Subject', 0.75184554), ('Description', 0.12408023), ('Quality', 0.12407429)]"
212.0,The code is documented well overall with good descriptions for each class and method. Input and outputs for methods are annotated well. Some class descriptions are copy-pasted without modification and so are incorrect in some instances,28,2,"['class', 'method', 'input', 'output', 'method', 'class', 'copy', 'modification', 'instance']",Subject,0.755305,"method, class, annotation, header, output, parameter, value, return, role, type","[('Subject', 0.755305), ('Description', 0.12234986), ('Quality', 0.12234513)]"
550.0,The code is documented to a very high standard throughout. All classes and methods are described well and annotations are used to describe inputs and outputs of methods. ,28,2,"['class', 'method', 'annotation', 'output', 'method']",Subject,0.7733262,"method, class, annotation, header, output, parameter, value, return, role, type","[('Subject', 0.7733262), ('Quality', 0.11338594), ('Description', 0.11328787)]"
407.0,The code is documented to a very high standard throughout. All classes and methods are described in detail with good use of annotations. Good conventions are used for method descriptions,28,2,"['class', 'method', 'detail', 'use', 'annotation', 'convention', 'method']",Subject,0.61685187,"method, class, annotation, header, output, parameter, value, return, role, type","[('Subject', 0.61685187), ('Quality', 0.26974848), ('Description', 0.11339965)]"
497.0,The code is documented to an exceptional standard throughout. All classes and methods are described very well and javadoc annotations are used appropriately,28,2,"['class', 'method', 'annotation']",Subject,0.74412185,"method, class, annotation, header, output, parameter, value, return, role, type","[('Subject', 0.74412185), ('Quality', 0.12803414), ('Description', 0.12784405)]"
271.0,"The code is very well documented. The classes and methods are described to an excellent standard , inputs and outputs are described in detail.",28,2,"['class', 'method', 'input', 'output', 'detail']",Subject,0.7505622,"method, class, annotation, header, output, parameter, value, return, role, type","[('Subject', 0.7505622), ('Description', 0.12472243), ('Quality', 0.12471535)]"
686.0,"The code documentation is good overall, however, is inconsistent in places. In particular some methods are not annotated with inputs and output descriptions whilst others are",28,2,"['place', 'method', 'input', 'output']",Subject,0.71756357,"method, class, annotation, header, output, parameter, value, return, role, type","[('Subject', 0.71756357), ('Description', 0.14122395), ('Quality', 0.14121248)]"
539.0,"The code is documented very well throughout and shows a good understanding of javadoc. Good, consistent, annotations are used for method inputs and outputs.",28,2,"['annotation', 'method', 'output']",Subject,0.74833894,"method, class, annotation, header, output, parameter, value, return, role, type","[('Subject', 0.74833894), ('Quality', 0.12590884), ('Description', 0.12575223)]"
434.0,The student has submitted the original task code unmodified with no extensions,28,2,['extension'],Description,0.33333334,"concise, function, name, number, file, challenge, representation, type, elaboration, header","[('Description', 0.33333334), ('Subject', 0.33333334), ('Quality', 0.33333334)]"
510.0,"The code is documented to a good standard with good descriptions of methods, inputs, and outputs. However, some descriptions are copy-pasted between classes and so are incorrect (e.g. the bear class references the fox class in the variable descriptions)",28,2,"['method', 'output', 'class', 'bear', 'class', 'reference', 'class']",Subject,0.7399479,"method, class, annotation, header, output, parameter, value, return, role, type","[('Subject', 0.7399479), ('Description', 0.13002838), ('Quality', 0.13002372)]"
74.0,"The code is documented well with most methods being annotated and described well. Getters and setters are not described, however, this is reasonable in most cases",28,2,"['method', 'getter', 'setter', 'case']",Subject,0.66661596,"method, class, annotation, header, output, parameter, value, return, role, type","[('Subject', 0.66661596), ('Description', 0.16669317), ('Quality', 0.16669081)]"
183.0,The code is documented to a reasonable standard with all methods at least annotated. Many methods are only annotated with their return values rather than also including a description. Because of the good naming conventions this is largely acceptable,28,2,"['method', 'method', 'return', 'value', 'naming', 'convention']",Subject,0.75539625,"method, class, annotation, header, output, parameter, value, return, role, type","[('Subject', 0.75539625), ('Quality', 0.12230219), ('Description', 0.12230159)]"
563.0,The code is documented very thoroughly and to a high standard. All classes and methods are described well and include annotations describing their inputs and outptuts. Some of the methods could benefit from additional in-line comments to add clarification.,28,2,"['class', 'method', 'annotation', 'input', 'outptut', 'method', 'line', 'comment', 'clarification']",Subject,0.5904598,"method, class, annotation, header, output, parameter, value, return, role, type","[('Subject', 0.5904598), ('Quality', 0.29625484), ('Description', 0.113285385)]"
286.0,"The code is documented well for the most part with each class and method described well. However, some method inputs/outputs are not described at all.",28,2,"['part', 'class', 'method', 'method', 'output']",Subject,0.75184554,"method, class, annotation, header, output, parameter, value, return, role, type","[('Subject', 0.75184554), ('Description', 0.12408023), ('Quality', 0.12407429)]"
287.0,The code is documented very well with good descriptions across all classes and methods. Appropriate annotations are used for method inputs and outputs. More complex methods are annotated with inline comments too.,28,2,"['class', 'method', 'annotation', 'method', 'output', 'method', 'inline', 'comment']",Subject,0.7695214,"method, class, annotation, header, output, parameter, value, return, role, type","[('Subject', 0.7695214), ('Quality', 0.11528301), ('Description', 0.115195595)]"
454.0,The code is documented very well overall all classes and methods annotated and described well. Some method descriptions do not use the correct annotations to describe parameters,28,2,"['class', 'method', 'method', 'annotation', 'parameter']",Subject,0.77333784,"method, class, annotation, header, output, parameter, value, return, role, type","[('Subject', 0.77333784), ('Quality', 0.11338581), ('Description', 0.11327636)]"
462.0,No java source files were included in the submission - only Java files and so the code cannot be compiled,28,2,"['source', 'file', 'submission', 'file']",Description,0.6665952,"concise, function, name, number, file, challenge, representation, type, elaboration, header","[('Description', 0.6665952), ('Subject', 0.16670692), ('Quality', 0.16669784)]"
585.0,"missing/confusing documentation for classes.
most of the explanatory comments are clear.",8,2,"['class', 'comment']",Subject,0.66659755,"method, class, annotation, header, output, parameter, value, return, role, type","[('Subject', 0.66659755), ('Quality', 0.16670135), ('Description', 0.1667011)]"
40.0,explanatory comments could be added,8,2,['comment'],Description,0.33333334,"concise, function, name, number, file, challenge, representation, type, elaboration, header","[('Description', 0.33333334), ('Subject', 0.33333334), ('Quality', 0.33333334)]"
