assignment_number,comments,participant_id,batch,processed_text,Dominant_Topic,Perc_Contribution,Topic_Keywords,All_Topics
306.0,The code follows good naming conventions and is formatted consistently. Meaningful variable and method names are used everywhere. Whitespace and indentation are applied well to separate logical parts of the code. Methods are focused and not overly complex. The code is easy to read and follow.,15,2,"['good', 'naming', 'convention', 'name', 'use', 'whitespace', 'indentation', 'apply', 'separate', 'part', 'code', 'focus', 'complex', 'code']",Naming and Whitespace,0.5540625,"structure, clear, readable, comment, understand, modifier, whitespace, inconsistent, space, convention","[('Naming and Whitespace', 0.5540625), ('Structure', 0.44593754)]"
92.0,The code is very well organized and easy to follow. Class and method names are meaningful making the purpose of each code block clear. Indentation and white space is used consistently.,15,2,"['code', 'name', 'purpose', 'code', 'clear', 'indentation', 'white', 'space', 'use']",Naming and Whitespace,0.68165153,"structure, clear, readable, comment, understand, modifier, whitespace, inconsistent, space, convention","[('Naming and Whitespace', 0.68165153), ('Structure', 0.31834844)]"
487.0,"The code is generally well organized, with clear naming of variables and methods. Indentation and spacing is mostly consistent which aids readability. ",15,2,"['clear', 'name', 'indentation', 'space', 'consistent', 'aid']",Naming and Whitespace,0.5780733,"structure, clear, readable, comment, understand, modifier, whitespace, inconsistent, space, convention","[('Naming and Whitespace', 0.5780733), ('Structure', 0.42192665)]"
417.0,"The code is well-structured and easy to understand. Meaningful class, method, and variable names are used throughout the project. Indentation and whitespace are used consistently to improve readability. However, some methods, like the move() method in the animal classes, could benefit from additional comments or refactoring to enhance clarity.",15,2,"['code', 'structured', 'understand', 'name', 'use', 'project', 'indentation', 'whitespace', 'use', 'improve', 'move', 'animal', 'benefit', 'additional', 'comment', 'refactore', 'enhance', 'clarity']",Naming and Whitespace,0.5668182,"structure, clear, readable, comment, understand, modifier, whitespace, inconsistent, space, convention","[('Naming and Whitespace', 0.5668182), ('Structure', 0.4331818)]"
241.0,"The code is clean, understandable, and well-organized. Meaningful identifier names are used for functions and variables. White space is utilized to separate logical code blocks. Indentation is consistent.",15,2,"['code', 'understandable', 'identifier', 'name', 'use', 'white', 'space', 'utilize', 'separate', 'code', 'indentation', 'consistent']",Structure,0.6686761,"naming, improve, indentation, consistent, organise, long, identifier, understandable, demonstrate, inconsistent","[('Structure', 0.6686761), ('Naming and Whitespace', 0.33132392)]"
355.0,"The code makes excellent use of inheritance with base Animal, Plant and Species classes. Behavior is customized through polymorphism and constants defined in species-specific data classes. This allows new species to be added easily. The Simulator is well structured, encapsulating field and simulation state. The code is quite efficient, using enums for weather and time calculations. Readability is not sacrificed.",15,2,"['code', 'excellent', 'use', 'inheritance', 'base', 'animal', 'plant', 'specie', 'behavior', 'customize', 'polymorphism', 'constant', 'define', 'specie', 'specific', 'data', 'allow', 'new', 'specie', 'add', 'simulator', 'structure', 'encapsulate', 'field', 'simulation', 'state', 'code', 'efficient', 'use', 'enum', 'weather', 'time', 'calculation', 'sacrifice']",Naming and Whitespace,0.7497173,"structure, clear, readable, comment, understand, modifier, whitespace, inconsistent, space, convention","[('Naming and Whitespace', 0.7497173), ('Structure', 0.25028268)]"
254.0,The code is well-organized into separate files for each class. Indentation and whitespace are used consistently and appropriately. Method and variable names are clear and meaningful. Logical blocks of code are spaced out with comments for readability.,15,2,"['code', 'separate', 'file', 'indentation', 'whitespace', 'use', 'name', 'clear', 'space', 'comment']",Naming and Whitespace,0.7652287,"structure, clear, readable, comment, understand, modifier, whitespace, inconsistent, space, convention","[('Naming and Whitespace', 0.7652287), ('Structure', 0.23477131)]"
67.0,"The code is exceptionally well-organized and easy to understand. Consistent indentation, meaningful variable and method names, and appropriate use of whitespace greatly improve readability. Each class and method has a clear purpose, and the logic is easy to follow. The code adheres to good programming practices, making it highly readable and maintainable.",15,2,"['code', 'organized', 'understand', 'consistent', 'indentation', 'name', 'use', 'whitespace', 'improve', 'clear', 'purpose', 'logic', 'code', 'adhere', 'good', 'programming', 'practice', 'readable', 'maintainable']",Naming and Whitespace,0.55750656,"structure, clear, readable, comment, understand, modifier, whitespace, inconsistent, space, convention","[('Naming and Whitespace', 0.55750656), ('Structure', 0.44249344)]"
135.0,"The code is very well documented. Each class and method has clear, concise comments describing its purpose, parameters and return values. Important fields and blocks of code are documented. ",15,2,"['code', 'document', 'clear', 'concise', 'comment', 'describe', 'purpose', 'parameter', 'return', 'value', 'important', 'field', 'code', 'document']",Naming and Whitespace,0.7919986,"structure, clear, readable, comment, understand, modifier, whitespace, inconsistent, space, convention","[('Naming and Whitespace', 0.7919986), ('Structure', 0.20800136)]"
63.0,The code is exceptionally well organized and easy to follow. Consistent indentation and spacing is used. Method and variable names are meaningful. Vertical whitespace separates logical blocks of code. Access modifiers appropriately hide class internals. ,15,2,"['code', 'consistent', 'indentation', 'space', 'use', 'name', 'vertical', 'whitespace', 'separate', 'code', 'modifier', 'hide', 'internal']",Naming and Whitespace,0.6563281,"structure, clear, readable, comment, understand, modifier, whitespace, inconsistent, space, convention","[('Naming and Whitespace', 0.6563281), ('Structure', 0.34367192)]"
133.0,The code is exceptionally well organized and very easy to follow. Indentation and whitespace is used consistently. Method and variable names are clear and meaningful. Classes are focused and self-contained. The code follows Java best practices and naming conventions.,15,2,"['code', 'indentation', 'whitespace', 'use', 'name', 'clear', 'focus', 'code', 'java', 'good', 'practice', 'name', 'convention']",Naming and Whitespace,0.72972643,"structure, clear, readable, comment, understand, modifier, whitespace, inconsistent, space, convention","[('Naming and Whitespace', 0.72972643), ('Structure', 0.27027354)]"
11.0,"The code is exceptionally well-organized and easy to understand. Consistent indentation, meaningful identifier names, and appropriate use of whitespace enhance readability. Each class and function serves a clear purpose, and the code follows good practices such as encapsulation and information hiding.",15,2,"['code', 'organized', 'understand', 'consistent', 'indentation', 'identifier', 'name', 'use', 'whitespace', 'enhance', 'serve', 'clear', 'purpose', 'code', 'good', 'practice', 'encapsulation', 'information', 'hide']",Naming and Whitespace,0.55861783,"structure, clear, readable, comment, understand, modifier, whitespace, inconsistent, space, convention","[('Naming and Whitespace', 0.55861783), ('Structure', 0.4413822)]"
576.0,The code is well-organized and easy to follow. Indentation and whitespace are used consistently. ,15,2,"['code', 'indentation', 'whitespace', 'use']",Naming and Whitespace,0.58452976,"structure, clear, readable, comment, understand, modifier, whitespace, inconsistent, space, convention","[('Naming and Whitespace', 0.58452976), ('Structure', 0.4154702)]"
683.0,"The code is well-organized and easy to follow. Class and variable names are meaningful (e.g. incrementHunger, giveBirth). Indentation and whitespace is used consistently. Methods are focused on single responsibilities. Access modifiers are appropriately applied to fields.",15,2,"['code', 'name', 'incrementhunger', 'use', 'focus', 'modifier', 'apply', 'field']",Naming and Whitespace,0.74818885,"structure, clear, readable, comment, understand, modifier, whitespace, inconsistent, space, convention","[('Naming and Whitespace', 0.74818885), ('Structure', 0.25181112)]"
464.0,good choice of variable and function names.,20,2,"['good', 'choice', 'name']",Structure,0.5,"naming, improve, indentation, consistent, organise, long, identifier, understandable, demonstrate, inconsistent","[('Structure', 0.5), ('Naming and Whitespace', 0.5)]"
568.0,Good function and variable names,20,2,"['good', 'name']",Structure,0.5,"naming, improve, indentation, consistent, organise, long, identifier, understandable, demonstrate, inconsistent","[('Structure', 0.5), ('Naming and Whitespace', 0.5)]"
216.0,"Good variable and functions names, missing some comments",20,2,"['good', 'name', 'comment']",Naming and Whitespace,0.74970317,"structure, clear, readable, comment, understand, modifier, whitespace, inconsistent, space, convention","[('Naming and Whitespace', 0.74970317), ('Structure', 0.2502968)]"
35.0,Good function and variable names,20,2,"['good', 'name']",Structure,0.5,"naming, improve, indentation, consistent, organise, long, identifier, understandable, demonstrate, inconsistent","[('Structure', 0.5), ('Naming and Whitespace', 0.5)]"
463.0,"Good variable and functions names, missing some comments",20,2,"['good', 'name', 'comment']",Naming and Whitespace,0.74970317,"structure, clear, readable, comment, understand, modifier, whitespace, inconsistent, space, convention","[('Naming and Whitespace', 0.74970317), ('Structure', 0.25029683)]"
546.0,"Good variable and functions names, missing some comments",20,2,"['good', 'name', 'comment']",Naming and Whitespace,0.7497032,"structure, clear, readable, comment, understand, modifier, whitespace, inconsistent, space, convention","[('Naming and Whitespace', 0.7497032), ('Structure', 0.25029677)]"
536.0,"Good variable and functions names, missing some comments",20,2,"['good', 'name', 'comment']",Naming and Whitespace,0.74970317,"structure, clear, readable, comment, understand, modifier, whitespace, inconsistent, space, convention","[('Naming and Whitespace', 0.74970317), ('Structure', 0.2502968)]"
535.0,"Good variable and functions names, missing some comments",20,2,"['good', 'name', 'comment']",Naming and Whitespace,0.74970317,"structure, clear, readable, comment, understand, modifier, whitespace, inconsistent, space, convention","[('Naming and Whitespace', 0.74970317), ('Structure', 0.25029683)]"
388.0,"Good variable and functions names, missing some comments",20,2,"['good', 'name', 'comment']",Naming and Whitespace,0.7497032,"structure, clear, readable, comment, understand, modifier, whitespace, inconsistent, space, convention","[('Naming and Whitespace', 0.7497032), ('Structure', 0.2502968)]"
81.0,"Good variable and functions names, missing some comments",20,2,"['good', 'name', 'comment']",Naming and Whitespace,0.74970317,"structure, clear, readable, comment, understand, modifier, whitespace, inconsistent, space, convention","[('Naming and Whitespace', 0.74970317), ('Structure', 0.2502968)]"
373.0,"Good variable and functions names, missing some comments
what's with the indentation?",20,2,"['good', 'name', 'comment', 'indentation']",Naming and Whitespace,0.59671116,"structure, clear, readable, comment, understand, modifier, whitespace, inconsistent, space, convention","[('Naming and Whitespace', 0.59671116), ('Structure', 0.40328887)]"
652.0,"Good variable and functions names, missing some comments",20,2,"['good', 'name', 'comment']",Naming and Whitespace,0.7497032,"structure, clear, readable, comment, understand, modifier, whitespace, inconsistent, space, convention","[('Naming and Whitespace', 0.7497032), ('Structure', 0.25029677)]"
103.0,"Good function and variable names, well explained code",20,2,"['good', 'name', 'explain', 'code']",Structure,0.5,"naming, improve, indentation, consistent, organise, long, identifier, understandable, demonstrate, inconsistent","[('Structure', 0.5), ('Naming and Whitespace', 0.5)]"
364.0,"Good variable and functions names, missing some comments",20,2,"['good', 'name', 'comment']",Naming and Whitespace,0.7497032,"structure, clear, readable, comment, understand, modifier, whitespace, inconsistent, space, convention","[('Naming and Whitespace', 0.7497032), ('Structure', 0.2502968)]"
430.0,"Good variable and functions names, missing some comments",20,2,"['good', 'name', 'comment']",Naming and Whitespace,0.7497032,"structure, clear, readable, comment, understand, modifier, whitespace, inconsistent, space, convention","[('Naming and Whitespace', 0.7497032), ('Structure', 0.2502968)]"
253.0,"Good variable and functions names, missing some comments",20,2,"['good', 'name', 'comment']",Naming and Whitespace,0.74970317,"structure, clear, readable, comment, understand, modifier, whitespace, inconsistent, space, convention","[('Naming and Whitespace', 0.74970317), ('Structure', 0.2502968)]"
684.0,"Good variable and functions names, missing some comments",20,2,"['good', 'name', 'comment']",Naming and Whitespace,0.74970317,"structure, clear, readable, comment, understand, modifier, whitespace, inconsistent, space, convention","[('Naming and Whitespace', 0.74970317), ('Structure', 0.2502968)]"
456.0,"Good variable and functions names, missing some comments",20,2,"['good', 'name', 'comment']",Naming and Whitespace,0.74970317,"structure, clear, readable, comment, understand, modifier, whitespace, inconsistent, space, convention","[('Naming and Whitespace', 0.74970317), ('Structure', 0.2502968)]"
483.0,"Good variable and functions names, missing some comments",20,2,"['good', 'name', 'comment']",Naming and Whitespace,0.7497032,"structure, clear, readable, comment, understand, modifier, whitespace, inconsistent, space, convention","[('Naming and Whitespace', 0.7497032), ('Structure', 0.2502968)]"
316.0,"Variables names wisely chosen, easy to follow the code.",4,1,"['name', 'choose', 'code']",Structure,0.5,"naming, improve, indentation, consistent, organise, long, identifier, understandable, demonstrate, inconsistent","[('Structure', 0.5), ('Naming and Whitespace', 0.5)]"
554.0,"Variables names clear well chosen, easy to follow",4,1,"['name', 'clear', 'choose']",Naming and Whitespace,0.74962497,"structure, clear, readable, comment, understand, modifier, whitespace, inconsistent, space, convention","[('Naming and Whitespace', 0.74962497), ('Structure', 0.25037503)]"
274.0,"Easy to follow the strucure, variable names wisely chosen",4,1,"['strucure', 'name', 'choose']",Structure,0.5,"naming, improve, indentation, consistent, organise, long, identifier, understandable, demonstrate, inconsistent","[('Structure', 0.5), ('Naming and Whitespace', 0.5)]"
36.0,"Easy to read, well structured, good variable names",4,1,"['structured', 'good', 'name']",Structure,0.5,"naming, improve, indentation, consistent, organise, long, identifier, understandable, demonstrate, inconsistent","[('Structure', 0.5), ('Naming and Whitespace', 0.5)]"
522.0,"Easy to read and understand, variable names clear",4,1,"['understand', 'name', 'clear']",Naming and Whitespace,0.7922367,"structure, clear, readable, comment, understand, modifier, whitespace, inconsistent, space, convention","[('Naming and Whitespace', 0.7922367), ('Structure', 0.20776328)]"
361.0,Easy to follow and understand the code,4,1,"['understand', 'code']",Naming and Whitespace,0.749443,"structure, clear, readable, comment, understand, modifier, whitespace, inconsistent, space, convention","[('Naming and Whitespace', 0.749443), ('Structure', 0.250557)]"
111.0,"Easy to understand, good choice of variable names",4,1,"['understand', 'good', 'choice', 'name']",Naming and Whitespace,0.7494428,"structure, clear, readable, comment, understand, modifier, whitespace, inconsistent, space, convention","[('Naming and Whitespace', 0.7494428), ('Structure', 0.25055715)]"
399.0,No submission,4,1,['submission'],Structure,0.5,"naming, improve, indentation, consistent, organise, long, identifier, understandable, demonstrate, inconsistent","[('Structure', 0.5), ('Naming and Whitespace', 0.5)]"
650.0,Easy to read and well structured,4,1,['structure'],Naming and Whitespace,0.7497173,"structure, clear, readable, comment, understand, modifier, whitespace, inconsistent, space, convention","[('Naming and Whitespace', 0.7497173), ('Structure', 0.25028268)]"
59.0,Easy to read ,4,1,[],Structure,0.5,"naming, improve, indentation, consistent, organise, long, identifier, understandable, demonstrate, inconsistent","[('Structure', 0.5), ('Naming and Whitespace', 0.5)]"
119.0,"Easy to read, good variable names and well structured",4,1,"['good', 'name', 'structure']",Naming and Whitespace,0.74971735,"structure, clear, readable, comment, understand, modifier, whitespace, inconsistent, space, convention","[('Naming and Whitespace', 0.74971735), ('Structure', 0.25028268)]"
427.0,"Very good use of variables, easy to follow",4,1,"['good', 'use']",Structure,0.5,"naming, improve, indentation, consistent, organise, long, identifier, understandable, demonstrate, inconsistent","[('Structure', 0.5), ('Naming and Whitespace', 0.5)]"
588.0,"Good use of variable, easy to understand",4,1,"['good', 'use', 'understand']",Naming and Whitespace,0.749443,"structure, clear, readable, comment, understand, modifier, whitespace, inconsistent, space, convention","[('Naming and Whitespace', 0.749443), ('Structure', 0.25055695)]"
629.0,"Easy to follow, good variables, straightforward",4,1,"['good', 'straightforward']",Structure,0.5,"naming, improve, indentation, consistent, organise, long, identifier, understandable, demonstrate, inconsistent","[('Structure', 0.5), ('Naming and Whitespace', 0.5)]"
601.0,"Easy to understand, some redundant statements",4,1,"['understand', 'redundant', 'statement']",Naming and Whitespace,0.74944305,"structure, clear, readable, comment, understand, modifier, whitespace, inconsistent, space, convention","[('Naming and Whitespace', 0.74944305), ('Structure', 0.25055692)]"
234.0,"Great use of variables, easy to understand",4,1,"['use', 'understand']",Naming and Whitespace,0.74944305,"structure, clear, readable, comment, understand, modifier, whitespace, inconsistent, space, convention","[('Naming and Whitespace', 0.74944305), ('Structure', 0.25055692)]"
29.0,Empty Submission,4,1,"['empty', 'submission']",Structure,0.5,"naming, improve, indentation, consistent, organise, long, identifier, understandable, demonstrate, inconsistent","[('Structure', 0.5), ('Naming and Whitespace', 0.5)]"
565.0,Very easy to read,4,1,[],Structure,0.5,"naming, improve, indentation, consistent, organise, long, identifier, understandable, demonstrate, inconsistent","[('Structure', 0.5), ('Naming and Whitespace', 0.5)]"
612.0,"Good naming of variables, good structure",4,1,"['good', 'naming', 'good', 'structure']",Structure,0.51033735,"naming, improve, indentation, consistent, organise, long, identifier, understandable, demonstrate, inconsistent","[('Structure', 0.51033735), ('Naming and Whitespace', 0.4896627)]"
144.0,"Great choice of variable, very well structured, easy and enjoyable to read",4,1,"['choice', 'structure', 'enjoyable']",Naming and Whitespace,0.7497173,"structure, clear, readable, comment, understand, modifier, whitespace, inconsistent, space, convention","[('Naming and Whitespace', 0.7497173), ('Structure', 0.25028268)]"
583.0,Perfectly indented and readable,11,1,"['indent', 'readable']",Naming and Whitespace,0.7496148,"structure, clear, readable, comment, understand, modifier, whitespace, inconsistent, space, convention","[('Naming and Whitespace', 0.7496148), ('Structure', 0.25038522)]"
211.0,"Code is readable and understandable, they are ordered in a consistent manner.",11,1,"['code', 'readable', 'understandable', 'order', 'consistent', 'manner']",Structure,0.6035538,"naming, improve, indentation, consistent, organise, long, identifier, understandable, demonstrate, inconsistent","[('Structure', 0.6035538), ('Naming and Whitespace', 0.3964462)]"
338.0,"Code is readable and understandable, they are ordered in a consistent manner.",11,1,"['code', 'readable', 'understandable', 'order', 'consistent', 'manner']",Structure,0.60355467,"naming, improve, indentation, consistent, organise, long, identifier, understandable, demonstrate, inconsistent","[('Structure', 0.60355467), ('Naming and Whitespace', 0.39644536)]"
618.0,Code is consistently organised and written well. Very easy to read.,11,1,"['organise', 'write']",Structure,0.7496,"naming, improve, indentation, consistent, organise, long, identifier, understandable, demonstrate, inconsistent","[('Structure', 0.7496), ('Naming and Whitespace', 0.2504)]"
448.0,"very well written, code is simple and well maintained following an organized manner ",11,1,"['write', 'code', 'simple', 'maintain', 'organized', 'manner']",Structure,0.5,"naming, improve, indentation, consistent, organise, long, identifier, understandable, demonstrate, inconsistent","[('Structure', 0.5), ('Naming and Whitespace', 0.5)]"
551.0,Very cleanly organized into folders and code is consistently maintained with white spaces and good identifiers,11,1,"['folder', 'code', 'maintain', 'white', 'space', 'good', 'identifier']",Naming and Whitespace,0.5456435,"structure, clear, readable, comment, understand, modifier, whitespace, inconsistent, space, convention","[('Naming and Whitespace', 0.5456435), ('Structure', 0.45435655)]"
249.0,Code is simple and readable. ,11,1,"['code', 'simple', 'readable']",Naming and Whitespace,0.7496148,"structure, clear, readable, comment, understand, modifier, whitespace, inconsistent, space, convention","[('Naming and Whitespace', 0.7496148), ('Structure', 0.25038522)]"
97.0,code is clean and simple to read,11,1,"['code', 'simple']",Structure,0.5,"naming, improve, indentation, consistent, organise, long, identifier, understandable, demonstrate, inconsistent","[('Structure', 0.5), ('Naming and Whitespace', 0.5)]"
70.0,code is readable and kept consistency throughout the project,11,1,"['code', 'readable', 'keep', 'consistency', 'project']",Naming and Whitespace,0.74961483,"structure, clear, readable, comment, understand, modifier, whitespace, inconsistent, space, convention","[('Naming and Whitespace', 0.74961483), ('Structure', 0.2503852)]"
246.0,"very readable, code is consistently spaced and well organized",11,1,"['readable', 'code', 'space']",Naming and Whitespace,0.7919532,"structure, clear, readable, comment, understand, modifier, whitespace, inconsistent, space, convention","[('Naming and Whitespace', 0.7919532), ('Structure', 0.20804673)]"
49.0,code is organized well and consistently spaced.,11,1,['space'],Naming and Whitespace,0.74925566,"structure, clear, readable, comment, understand, modifier, whitespace, inconsistent, space, convention","[('Naming and Whitespace', 0.74925566), ('Structure', 0.2507443)]"
294.0,code is readable and well organized.,11,1,"['code', 'readable']",Naming and Whitespace,0.7496148,"structure, clear, readable, comment, understand, modifier, whitespace, inconsistent, space, convention","[('Naming and Whitespace', 0.7496148), ('Structure', 0.2503852)]"
478.0,"code is very readable, consistently spaced and good identifier names.",11,1,"['code', 'readable', 'space', 'good', 'identifier', 'name']",Naming and Whitespace,0.63870025,"structure, clear, readable, comment, understand, modifier, whitespace, inconsistent, space, convention","[('Naming and Whitespace', 0.63870025), ('Structure', 0.36129978)]"
615.0,submitted template ,11,1,"['submit', 'template']",Structure,0.5,"naming, improve, indentation, consistent, organise, long, identifier, understandable, demonstrate, inconsistent","[('Structure', 0.5), ('Naming and Whitespace', 0.5)]"
604.0,code is readable and organized well.,11,1,"['code', 'readable']",Naming and Whitespace,0.7496148,"structure, clear, readable, comment, understand, modifier, whitespace, inconsistent, space, convention","[('Naming and Whitespace', 0.7496148), ('Structure', 0.25038522)]"
440.0,Code is readable and consistently spaced.,11,1,"['code', 'readable', 'space']",Naming and Whitespace,0.7919533,"structure, clear, readable, comment, understand, modifier, whitespace, inconsistent, space, convention","[('Naming and Whitespace', 0.7919533), ('Structure', 0.20804672)]"
441.0,"code is readable and consistently spaced,",11,1,"['code', 'readable', 'space']",Naming and Whitespace,0.79195327,"structure, clear, readable, comment, understand, modifier, whitespace, inconsistent, space, convention","[('Naming and Whitespace', 0.79195327), ('Structure', 0.20804676)]"
330.0,code is readable and consistently spaced ,11,1,"['code', 'readable', 'space']",Naming and Whitespace,0.7919532,"structure, clear, readable, comment, understand, modifier, whitespace, inconsistent, space, convention","[('Naming and Whitespace', 0.7919532), ('Structure', 0.2080468)]"
38.0,code is readable and consistently spaced.,11,1,"['code', 'readable', 'space']",Naming and Whitespace,0.79195315,"structure, clear, readable, comment, understand, modifier, whitespace, inconsistent, space, convention","[('Naming and Whitespace', 0.79195315), ('Structure', 0.2080468)]"
