assignment_number,comments,participant_id,batch,processed_text,Dominant_Topic,Perc_Contribution,Topic_Keywords,All_Topics
18.0,The code use meaningful identifier names and are organized in a way that makes the logical flow of operations somewhat easy to follow. ,15,1,"['code', 'use', 'name', 'way', 'flow']",Structure,0.5,"naming, improve, indentation, consistent, organise, long, identifier, understandable, demonstrate, inconsistent","[('Structure', 0.5), ('Naming and Whitespace', 0.5)]"
620.0,Code is well organized into logical classes and methods. Indentation and whitespace is used consistently. Variable and method names are clear and meaningful. Methods are focused on single responsibilities. Access modifiers are appropriately used to encapsulate data.,15,1,"['code', 'indentation', 'whitespace', 'use', 'name', 'clear', 'focus', 'modifier', 'use', 'encapsulate', 'datum']",Naming and Whitespace,0.73304796,"structure, clear, readable, comment, understand, modifier, whitespace, inconsistent, space, convention","[('Naming and Whitespace', 0.73304796), ('Structure', 0.26695204)]"
466.0,"The code is well-organized, consistently indented, and uses meaningful names, whitespace and consistent spacing. Methods are focused and classes encapsulate data and behavior appropriately. This makes the overall program quite easy to read and understand.",15,1,"['code', 'indent', 'use', 'name', 'whitespace', 'consistent', 'spacing', 'focus', 'encapsulate', 'data', 'behavior', 'program', 'understand']",Naming and Whitespace,0.65210956,"structure, clear, readable, comment, understand, modifier, whitespace, inconsistent, space, convention","[('Naming and Whitespace', 0.65210956), ('Structure', 0.34789047)]"
591.0,The code is well organized and readable. Indentation and whitespace are used consistently. Variable and method names are clear and meaningful. ,15,1,"['code', 'readable', 'indentation', 'whitespace', 'use', 'name', 'clear']",Naming and Whitespace,0.72687477,"structure, clear, readable, comment, understand, modifier, whitespace, inconsistent, space, convention","[('Naming and Whitespace', 0.72687477), ('Structure', 0.27312526)]"
587.0,The code is well organized and readable. Indentation and whitespace are used consistently. Variable and method names are clear and meaningful. ,15,1,"['code', 'readable', 'indentation', 'whitespace', 'use', 'name', 'clear']",Naming and Whitespace,0.7268733,"structure, clear, readable, comment, understand, modifier, whitespace, inconsistent, space, convention","[('Naming and Whitespace', 0.7268733), ('Structure', 0.2731267)]"
50.0,"The code is well-organized, consistently indented, and uses meaningful names, whitespace and consistent spacing. Methods are focused and classes encapsulate data and behavior appropriately. This makes the overall program quite easy to read and understand.",15,1,"['code', 'indent', 'use', 'name', 'whitespace', 'consistent', 'spacing', 'focus', 'encapsulate', 'data', 'behavior', 'program', 'understand']",Naming and Whitespace,0.6521094,"structure, clear, readable, comment, understand, modifier, whitespace, inconsistent, space, convention","[('Naming and Whitespace', 0.6521094), ('Structure', 0.3478906)]"
655.0,"The code is well organized and easy to understand. Good use of meaningful class, variable and method names. Indentation and whitespace is used consistently. Some longer methods could potentially be refactored into smaller single-purpose methods to further enhance readability.",15,1,"['code', 'understand', 'good', 'use', 'name', 'indentation', 'whitespace', 'use', 'long', 'refactore', 'small', 'purpose', 'enhance']",Naming and Whitespace,0.50762486,"structure, clear, readable, comment, understand, modifier, whitespace, inconsistent, space, convention","[('Naming and Whitespace', 0.50762486), ('Structure', 0.4923751)]"
47.0,"The code is well-organized, consistently indented, and easy to follow. Class and method names are meaningful. Whitespace is used well to separate logical blocks.",15,1,"['code', 'indent', 'name', 'whitespace', 'use', 'separate']",Naming and Whitespace,0.7490095,"structure, clear, readable, comment, understand, modifier, whitespace, inconsistent, space, convention","[('Naming and Whitespace', 0.7490095), ('Structure', 0.2509905)]"
262.0,"The code is well organized and easy to understand. Good use of meaningful class, variable and method names. Indentation and whitespace is used consistently. Some longer methods could potentially be refactored into smaller single-purpose methods to further enhance readability.",15,1,"['code', 'understand', 'good', 'use', 'name', 'indentation', 'whitespace', 'use', 'long', 'refactore', 'small', 'purpose', 'enhance']",Naming and Whitespace,0.50762945,"structure, clear, readable, comment, understand, modifier, whitespace, inconsistent, space, convention","[('Naming and Whitespace', 0.50762945), ('Structure', 0.49237055)]"
2.0,"The code is exceptionally organized and easy to follow. Your consistent use of indentation, meaningful variable names, and logical structuring of blocks enhances readability significantly.",15,1,"['consistent', 'use', 'indentation', 'name', 'structure', 'enhance']",Structure,0.55693364,"naming, improve, indentation, consistent, organise, long, identifier, understandable, demonstrate, inconsistent","[('Structure', 0.55693364), ('Naming and Whitespace', 0.44306636)]"
400.0,Code is well-formatted with consistent indentation and whitespace usage. Methods are focused and names are meaningful. Public vs private access is used appropriately. The code is easy to follow and self-explanatory.,15,1,"['code', 'consistent', 'indentation', 'whitespace', 'usage', 'focus', 'name', 'use', 'code', 'explanatory']",Structure,0.5372622,"naming, improve, indentation, consistent, organise, long, identifier, understandable, demonstrate, inconsistent","[('Structure', 0.5372622), ('Naming and Whitespace', 0.46273777)]"
525.0,"The code is well organized and easy to follow. Good naming conventions are used for classes, methods and variables. Indentation and whitespace are used consistently. A few very long methods could benefit from being broken up for better readability.",15,1,"['code', 'good', 'naming', 'convention', 'use', 'indentation', 'whitespace', 'use', 'long', 'benefit', 'break']",Structure,0.55801976,"naming, improve, indentation, consistent, organise, long, identifier, understandable, demonstrate, inconsistent","[('Structure', 0.55801976), ('Naming and Whitespace', 0.44198027)]"
358.0,The code is generally clean and organized with consistent indentation and spacing. Meaningful variable and method names are used.,15,1,"['consistent', 'indentation', 'space', 'name', 'use']",Structure,0.516561,"naming, improve, indentation, consistent, organise, long, identifier, understandable, demonstrate, inconsistent","[('Structure', 0.516561), ('Naming and Whitespace', 0.48343903)]"
137.0,"The code is exceptionally well organized and very easy to read. Indentation and whitespace is used consistently and appropriately. Method and variable names are meaningful (e.g. getID(), giveBirth()). Comments are present to explain important sections without being excessive. Overall the code is very clean and easy to follow.",15,1,"['code', 'indentation', 'whitespace', 'use', 'name', 'getid', 'comment', 'explain', 'important', 'section', 'excessive', 'code']",Naming and Whitespace,0.68520784,"structure, clear, readable, comment, understand, modifier, whitespace, inconsistent, space, convention","[('Naming and Whitespace', 0.68520784), ('Structure', 0.31479216)]"
125.0,The code is well organized into logical classes and methods with clear names. Indentation and whitespace are used consistently to separate code blocks. Lines are not excessively long. ,15,1,"['code', 'clear', 'name', 'indentation', 'whitespace', 'use', 'separate', 'code', 'line']",Naming and Whitespace,0.6748535,"structure, clear, readable, comment, understand, modifier, whitespace, inconsistent, space, convention","[('Naming and Whitespace', 0.6748535), ('Structure', 0.32514647)]"
58.0,The code is generally readable and well-organized. Class and variable names are meaningfu. Related code is typically grouped together logically within each class. Indentation and whitespace are used consistently.,15,1,"['code', 'readable', 'name', 'group', 'indentation', 'whitespace', 'use']",Naming and Whitespace,0.67857283,"structure, clear, readable, comment, understand, modifier, whitespace, inconsistent, space, convention","[('Naming and Whitespace', 0.67857283), ('Structure', 0.32142714)]"
353.0,"The code is generally well organized and readable. Class, method, and variable names are descriptive. Indentation and white space are used consistently. A few methods are on the longer side and could potentially be refactored into sub-methods to improve readability.",15,1,"['organized', 'readable', 'name', 'descriptive', 'indentation', 'white', 'space', 'use', 'long', 'side', 'refactore', 'sub', 'improve']",Structure,0.5856164,"naming, improve, indentation, consistent, organise, long, identifier, understandable, demonstrate, inconsistent","[('Structure', 0.5856164), ('Naming and Whitespace', 0.4143836)]"
422.0,The code is well-organized and easy to understand. Classes are separated into logical files. Naming of variables and methods is generally clear and meaningful. Indentation and whitespace usage is mostly consistent. Some longer methods could benefit from more explanatory comments or being broken into smaller sub-methods. ,15,1,"['code', 'understand', 'separate', 'file', 'name', 'clear', 'indentation', 'whitespace', 'usage', 'consistent', 'long', 'benefit', 'explanatory', 'comment', 'break', 'small', 'sub']",Naming and Whitespace,0.5759005,"structure, clear, readable, comment, understand, modifier, whitespace, inconsistent, space, convention","[('Naming and Whitespace', 0.5759005), ('Structure', 0.42409948)]"
480.0,"The code formatting is decent, with consistent indentation and spacing. Meaningful names are used for variables and methods. The code is organized logically and is fairly easy to follow.",15,1,"['code', 'decent', 'consistent', 'indentation', 'space', 'name', 'use']",Structure,0.5165567,"naming, improve, indentation, consistent, organise, long, identifier, understandable, demonstrate, inconsistent","[('Structure', 0.5165567), ('Naming and Whitespace', 0.4834433)]"
334.0,The application is exceptionally well organized and very easy to understand. Indentation and whitespace are used consistently and appropriately. Method and variable names are meaningful. Comments are used effectively to explain less obvious code. The code follows Java conventions and is easily readable.,15,1,"['understand', 'indentation', 'whitespace', 'use', 'name', 'comment', 'use', 'explain', 'less', 'obvious', 'code', 'code', 'java', 'convention', 'readable']",Naming and Whitespace,0.78803885,"structure, clear, readable, comment, understand, modifier, whitespace, inconsistent, space, convention","[('Naming and Whitespace', 0.78803885), ('Structure', 0.21196115)]"
160.0,The student used indentation appropriately and consistently to delineate code blocks,24,1,"['use', 'indentation', 'delineate', 'code']",Structure,0.74942076,"naming, improve, indentation, consistent, organise, long, identifier, understandable, demonstrate, inconsistent","[('Structure', 0.74942076), ('Naming and Whitespace', 0.25057924)]"
473.0,"The code is clean, understandable and organised.",24,1,"['code', 'understandable', 'organise']",Structure,0.79225,"naming, improve, indentation, consistent, organise, long, identifier, understandable, demonstrate, inconsistent","[('Structure', 0.79225), ('Naming and Whitespace', 0.20775002)]"
624.0,The application has one or two issues that make the program difficult to understand such as poorly named identifiers and disorganised code.,24,1,"['program', 'difficult', 'understand', 'name', 'identifier', 'disorganise', 'code']",Naming and Whitespace,0.5297089,"structure, clear, readable, comment, understand, modifier, whitespace, inconsistent, space, convention","[('Naming and Whitespace', 0.5297089), ('Structure', 0.4702911)]"
311.0,The application has one or two issues that makes the program difficult to understand such as disorganised code,24,1,"['program', 'difficult', 'understand', 'disorganise', 'code']",Naming and Whitespace,0.749443,"structure, clear, readable, comment, understand, modifier, whitespace, inconsistent, space, convention","[('Naming and Whitespace', 0.749443), ('Structure', 0.250557)]"
105.0,The application has more than two issues that make the program difficult to understand.,24,1,"['program', 'difficult', 'understand']",Naming and Whitespace,0.74944305,"structure, clear, readable, comment, understand, modifier, whitespace, inconsistent, space, convention","[('Naming and Whitespace', 0.74944305), ('Structure', 0.25055692)]"
654.0,The application is well organised; the student used indentation appropriately and consistently to delineate code blocks.,24,1,"['organise', 'use', 'indentation', 'delineate', 'code']",Structure,0.78604823,"naming, improve, indentation, consistent, organise, long, identifier, understandable, demonstrate, inconsistent","[('Structure', 0.78604823), ('Naming and Whitespace', 0.21395175)]"
79.0,"There are missing method descriptions, plus some descriptions are copy-pasted and the animals are not changed.",24,1,"['description', 'description', 'copy', 'paste', 'animal', 'change']",Structure,0.5,"naming, improve, indentation, consistent, organise, long, identifier, understandable, demonstrate, inconsistent","[('Structure', 0.5), ('Naming and Whitespace', 0.5)]"
45.0,"The simulator contains Weather logic, ideally, Weather should contain its logic and be called by the simulator.",24,1,"['simulator', 'weather', 'logic', 'weather', 'logic', 'call', 'simulator']",Structure,0.5,"naming, improve, indentation, consistent, organise, long, identifier, understandable, demonstrate, inconsistent","[('Structure', 0.5), ('Naming and Whitespace', 0.5)]"
51.0,"the code is clean, understandable and organised, however the code is incomplete",24,1,"['understandable', 'organise', 'code', 'incomplete']",Structure,0.79225,"naming, improve, indentation, consistent, organise, long, identifier, understandable, demonstrate, inconsistent","[('Structure', 0.79225), ('Naming and Whitespace', 0.20775004)]"
523.0,Some variables are not descriptive.,24,1,['descriptive'],Structure,0.5,"naming, improve, indentation, consistent, organise, long, identifier, understandable, demonstrate, inconsistent","[('Structure', 0.5), ('Naming and Whitespace', 0.5)]"
410.0,"The code is clean, understandable and organised; the student used meaningful identifier names.",24,1,"['code', 'understandable', 'organise', 'use', 'identifier', 'name']",Structure,0.8152594,"naming, improve, indentation, consistent, organise, long, identifier, understandable, demonstrate, inconsistent","[('Structure', 0.8152594), ('Naming and Whitespace', 0.18474063)]"
490.0,The application has minor issues such as inconsistent indentation.,24,1,"['minor', 'inconsistent', 'indentation']",Naming and Whitespace,0.60509074,"structure, clear, readable, comment, understand, modifier, whitespace, inconsistent, space, convention","[('Naming and Whitespace', 0.60509074), ('Structure', 0.39490926)]"
124.0,"The code is clean, understandable and organised.",24,1,"['code', 'understandable', 'organise']",Structure,0.79225,"naming, improve, indentation, consistent, organise, long, identifier, understandable, demonstrate, inconsistent","[('Structure', 0.79225), ('Naming and Whitespace', 0.20775007)]"
77.0,"The code is clean, understandable and organised.",24,1,"['code', 'understandable', 'organise']",Structure,0.79225,"naming, improve, indentation, consistent, organise, long, identifier, understandable, demonstrate, inconsistent","[('Structure', 0.79225), ('Naming and Whitespace', 0.20775004)]"
252.0,The application is well organised; the student used indentation appropriately and consistently to delineate code blocks.,24,1,"['organise', 'use', 'indentation', 'delineate', 'code']",Structure,0.7860483,"naming, improve, indentation, consistent, organise, long, identifier, understandable, demonstrate, inconsistent","[('Structure', 0.7860483), ('Naming and Whitespace', 0.2139517)]"
236.0,"The code is clean, understandable and organised; the student used meaningful identifier names.",24,1,"['code', 'understandable', 'organise', 'use', 'identifier', 'name']",Structure,0.8152597,"naming, improve, indentation, consistent, organise, long, identifier, understandable, demonstrate, inconsistent","[('Structure', 0.8152597), ('Naming and Whitespace', 0.18474038)]"
549.0,"The code is clean, understandable and organised",24,1,"['code', 'understandable', 'organise']",Structure,0.79224974,"naming, improve, indentation, consistent, organise, long, identifier, understandable, demonstrate, inconsistent","[('Structure', 0.79224974), ('Naming and Whitespace', 0.20775029)]"
10.0,The application is exceptionally well-organised and very easy to understand;,24,1,"['organise', 'understand']",Structure,0.51251036,"naming, improve, indentation, consistent, organise, long, identifier, understandable, demonstrate, inconsistent","[('Structure', 0.51251036), ('Naming and Whitespace', 0.48748967)]"
292.0,The application is exceptionally well-organised and very easy to understand.,24,1,"['organise', 'understand']",Structure,0.5125251,"naming, improve, indentation, consistent, organise, long, identifier, understandable, demonstrate, inconsistent","[('Structure', 0.5125251), ('Naming and Whitespace', 0.4874749)]"
451.0,"The code is clean, understandable and organised; the student used meaningful identifier names.",24,1,"['code', 'understandable', 'organise', 'use', 'identifier', 'name']",Structure,0.8152596,"naming, improve, indentation, consistent, organise, long, identifier, understandable, demonstrate, inconsistent","[('Structure', 0.8152596), ('Naming and Whitespace', 0.18474045)]"
217.0,The code is presented to a good standard with appropriate naming and use of access modifiers. Some lines of code are too long and there is some inconsistent use of indentation.,28,2,"['code', 'good', 'standard', 'naming', 'use', 'modifier', 'line', 'code', 'long', 'inconsistent', 'use', 'indentation']",Structure,0.53380376,"naming, improve, indentation, consistent, organise, long, identifier, understandable, demonstrate, inconsistent","[('Structure', 0.53380376), ('Naming and Whitespace', 0.46619624)]"
623.0,"The code is presented well with good naming conventions, formatting, and access modifiers.",28,2,"['code', 'good', 'naming', 'convention', 'modifier']",Naming and Whitespace,0.63332075,"structure, clear, readable, comment, understand, modifier, whitespace, inconsistent, space, convention","[('Naming and Whitespace', 0.63332075), ('Structure', 0.36667922)]"
315.0,The code is presented well with good naming conventions and formatting. Unfortunately some access modifiers are not appropriate with many methods being left public,28,2,"['code', 'good', 'naming', 'convention', 'modifier', 'many', 'leave']",Naming and Whitespace,0.63332015,"structure, clear, readable, comment, understand, modifier, whitespace, inconsistent, space, convention","[('Naming and Whitespace', 0.63332015), ('Structure', 0.36667985)]"
21.0,"The code is very well presented with good formatting, naming conventions, and use of access modifiers. Naming the animals as Destiny characters is interesting.",28,2,"['code', 'good', 'naming', 'convention', 'use', 'modifier', 'naming', 'animal', 'destiny', 'character', 'interesting']",Naming and Whitespace,0.52964485,"structure, clear, readable, comment, understand, modifier, whitespace, inconsistent, space, convention","[('Naming and Whitespace', 0.52964485), ('Structure', 0.47035518)]"
212.0,"The code is presented well with good naming conventions and formatting. Access modifiers are used appropriately. However, some spacing and tabbing is used inconsistently",28,2,"['code', 'good', 'naming', 'convention', 'modifier', 'use', 'space', 'tabbing', 'use']",Naming and Whitespace,0.6916643,"structure, clear, readable, comment, understand, modifier, whitespace, inconsistent, space, convention","[('Naming and Whitespace', 0.6916643), ('Structure', 0.3083357)]"
550.0,"The code is formatted very well with good naming conventions and formatting. Access modifiers are used correctly and spacing, tabbing is generally good. Some lines of code are too long. ",28,2,"['code', 'good', 'naming', 'convention', 'modifier', 'use', 'space', 'tab', 'good', 'line', 'code']",Naming and Whitespace,0.691664,"structure, clear, readable, comment, understand, modifier, whitespace, inconsistent, space, convention","[('Naming and Whitespace', 0.691664), ('Structure', 0.308336)]"
407.0,The code readability is very high with good formatting throughout. Good naming conventions and indenting is used and general ,28,2,"['code', 'good', 'good', 'naming', 'convention', 'indent', 'used']",Naming and Whitespace,0.5179421,"structure, clear, readable, comment, understand, modifier, whitespace, inconsistent, space, convention","[('Naming and Whitespace', 0.5179421), ('Structure', 0.48205793)]"
497.0,The code is presented incredibly well with good naming conventions and formatting. Correct access modifiers are used throughout,28,2,"['good', 'naming', 'convention', 'correct', 'modifier', 'use']",Naming and Whitespace,0.63330287,"structure, clear, readable, comment, understand, modifier, whitespace, inconsistent, space, convention","[('Naming and Whitespace', 0.63330287), ('Structure', 0.36669713)]"
271.0,"The code is presented to a high standard. The methods are structured well with good naming conventions, formatting and whitespace. Formatting is consistent throughout",28,2,"['standard', 'structure', 'good', 'naming', 'convention', 'whitespace', 'consistent']",Naming and Whitespace,0.59797716,"structure, clear, readable, comment, understand, modifier, whitespace, inconsistent, space, convention","[('Naming and Whitespace', 0.59797716), ('Structure', 0.4020229)]"
686.0,The code is presented well with good consistent naming conventions and formatting. Appropriate access modifiers are used throughout,28,2,"['code', 'good', 'consistent', 'naming', 'convention', 'modifier', 'use']",Naming and Whitespace,0.55301946,"structure, clear, readable, comment, understand, modifier, whitespace, inconsistent, space, convention","[('Naming and Whitespace', 0.55301946), ('Structure', 0.44698054)]"
539.0,The code is presented cleanly with good naming conventions and formatting. Appropriate access modifiers are used throughout,28,2,"['code', 'good', 'naming', 'convention', 'modifier', 'use']",Naming and Whitespace,0.63332117,"structure, clear, readable, comment, understand, modifier, whitespace, inconsistent, space, convention","[('Naming and Whitespace', 0.63332117), ('Structure', 0.36667883)]"
434.0,The student has submitted the original task code unmodified with no extensions,28,2,"['submit', 'original', 'task', 'code', 'unmodified', 'extension']",Structure,0.5,"naming, improve, indentation, consistent, organise, long, identifier, understandable, demonstrate, inconsistent","[('Structure', 0.5), ('Naming and Whitespace', 0.5)]"
510.0,"The code is presented well overall with good naming conventions, formatting, and use of access modifiers. Some methods are left unimplemented with just signatures remaining which should be avoided.",28,2,"['code', 'good', 'naming', 'convention', 'use', 'modifier', 'leave', 'unimplemented', 'signature', 'remain', 'avoid']",Naming and Whitespace,0.6333209,"structure, clear, readable, comment, understand, modifier, whitespace, inconsistent, space, convention","[('Naming and Whitespace', 0.6333209), ('Structure', 0.36667907)]"
74.0,The code is presented reasonably well overall with good naming conventions. Some of the formatting is inconsistent particularly with new-line and tabbing. Some methods should have a more limited access modifier,28,2,"['good', 'naming', 'convention', 'inconsistent', 'new', 'line', 'tab', 'limit', 'modifier']",Naming and Whitespace,0.69332707,"structure, clear, readable, comment, understand, modifier, whitespace, inconsistent, space, convention","[('Naming and Whitespace', 0.69332707), ('Structure', 0.30667293)]"
183.0,The code is presented well with good naming conventions and formatting. Some lines of code are too long and as such overrun. ,28,2,"['code', 'good', 'naming', 'convention', 'line', 'code', 'long', 'overrun']",Structure,0.6222734,"naming, improve, indentation, consistent, organise, long, identifier, understandable, demonstrate, inconsistent","[('Structure', 0.6222734), ('Naming and Whitespace', 0.37772664)]"
563.0,"The code is presented well with good consistent naming conventions and overall good formatting. Again, lengthy methods makes the readability of the code more challenging than it should be",28,2,"['code', 'good', 'consistent', 'naming', 'convention', 'good', 'lengthy', 'code', 'challenge']",Structure,0.5711929,"naming, improve, indentation, consistent, organise, long, identifier, understandable, demonstrate, inconsistent","[('Structure', 0.5711929), ('Naming and Whitespace', 0.42880708)]"
286.0,"The code is presented well throughout with good naming conventions, formatting, and use of whitespace. Appropriate access modifiers are used throughout. ",28,2,"['code', 'good', 'naming', 'convention', 'use', 'whitespace', 'modifier', 'use']",Naming and Whitespace,0.6869393,"structure, clear, readable, comment, understand, modifier, whitespace, inconsistent, space, convention","[('Naming and Whitespace', 0.6869393), ('Structure', 0.31306073)]"
