assignment_number,comments,participant_id,batch,processed_text,Dominant_Topic,Perc_Contribution,Topic_Keywords,All_Topics
588.0,"Empty class, mistake in the simulation creation ",4,1,"['class', 'mistake', 'simulation', 'creation']",Inheritance,0.33333334,"hierarchy, superclass, reusability, encapsulation, maintainability, functionality, subclass, variable, extensibility, type","[('Inheritance', 0.33333334), ('Design', 0.33333334), ('Abstraction', 0.33333334)]"
629.0,"Good use of the notion in class, sone challenges successfully implemented",4,1,"['notion', 'class', 'sone']",Inheritance,0.33333334,"hierarchy, superclass, reusability, encapsulation, maintainability, functionality, subclass, variable, extensibility, type","[('Inheritance', 0.33333334), ('Design', 0.33333334), ('Abstraction', 0.33333334)]"
601.0,Good use of the noton learnt in class,4,1,['class'],Inheritance,0.33333334,"hierarchy, superclass, reusability, encapsulation, maintainability, functionality, subclass, variable, extensibility, type","[('Inheritance', 0.33333334), ('Design', 0.33333334), ('Abstraction', 0.33333334)]"
234.0,"Great use of all notion of the class, well done",4,1,"['notion', 'class']",Inheritance,0.33333334,"hierarchy, superclass, reusability, encapsulation, maintainability, functionality, subclass, variable, extensibility, type","[('Inheritance', 0.33333334), ('Design', 0.33333334), ('Abstraction', 0.33333334)]"
29.0,No submission,4,1,['submission'],Inheritance,0.33333334,"hierarchy, superclass, reusability, encapsulation, maintainability, functionality, subclass, variable, extensibility, type","[('Inheritance', 0.33333334), ('Design', 0.33333334), ('Abstraction', 0.33333334)]"
565.0,"Good use of the learnt notions, challenges well implemented",4,1,['notion'],Inheritance,0.33333334,"hierarchy, superclass, reusability, encapsulation, maintainability, functionality, subclass, variable, extensibility, type","[('Inheritance', 0.33333334), ('Design', 0.33333334), ('Abstraction', 0.33333334)]"
612.0,"Very good use of the notion of the module, good implementation of the challenge tasks",4,1,"['notion', 'implementation']",Design,0.6665985,"design, variable, implementation, extensibility, core, hierarchy, encapsulation, structure, type, repetition","[('Design', 0.6665985), ('Inheritance', 0.16670199), ('Abstraction', 0.16669953)]"
144.0,Perfect use of the notion of the course and great creativity work to create a unique simulation. Very good job,4,1,"['notion', 'creativity', 'work', 'simulation', 'job']",Inheritance,0.33333334,"hierarchy, superclass, reusability, encapsulation, maintainability, functionality, subclass, variable, extensibility, type","[('Inheritance', 0.33333334), ('Design', 0.33333334), ('Abstraction', 0.33333334)]"
583.0,"Good understanding of the java language utilising abstract classes and having the animal class extend organism. However, no abstraction made for predators and preys, they all fall under the animal class. ",11,1,"['understanding', 'language', 'class', 'class', 'organism', 'abstraction', 'class']",Abstraction,0.6666235,"abstraction, structure, type, feature, repetition, segment, encapsulation, hierarchy, design, variable","[('Abstraction', 0.6666235), ('Inheritance', 0.16669182), ('Design', 0.1666847)]"
211.0,"Usage of interfaces incorrectly, Compilation errors. A lot of code rewritten when it could have been implemented in an abstract class,",11,1,"['usage', 'compilation', 'error', 'class']",Inheritance,0.33333334,"hierarchy, superclass, reusability, encapsulation, maintainability, functionality, subclass, variable, extensibility, type","[('Inheritance', 0.33333334), ('Design', 0.33333334), ('Abstraction', 0.33333334)]"
338.0,No usage of abstract classes or interfaces. A lot of rewritten code. ,11,1,"['usage', 'class', 'code']",Inheritance,0.33333334,"hierarchy, superclass, reusability, encapsulation, maintainability, functionality, subclass, variable, extensibility, type","[('Inheritance', 0.33333334), ('Design', 0.33333334), ('Abstraction', 0.33333334)]"
618.0,The code does not utilise abstract classes and consequently a lot of code is being rewritten. ,11,1,"['code', 'utilise', 'class']",Inheritance,0.33333334,"hierarchy, superclass, reusability, encapsulation, maintainability, functionality, subclass, variable, extensibility, type","[('Inheritance', 0.33333334), ('Design', 0.33333334), ('Abstraction', 0.33333334)]"
448.0,"great use of abstract classes, code is not rewritten",11,1,['class'],Inheritance,0.33333334,"hierarchy, superclass, reusability, encapsulation, maintainability, functionality, subclass, variable, extensibility, type","[('Inheritance', 0.33333334), ('Design', 0.33333334), ('Abstraction', 0.33333334)]"
551.0,Great use of abstraction and interfaces. Code is split nicely into packages.,11,1,"['abstraction', 'code', 'split', 'package']",Abstraction,0.6666235,"abstraction, structure, type, feature, repetition, segment, encapsulation, hierarchy, design, variable","[('Abstraction', 0.6666235), ('Inheritance', 0.16669181), ('Design', 0.16668472)]"
249.0,A lot of rewritten code where it could be abstracted further. ,11,1,[],Inheritance,0.33333334,"hierarchy, superclass, reusability, encapsulation, maintainability, functionality, subclass, variable, extensibility, type","[('Inheritance', 0.33333334), ('Design', 0.33333334), ('Abstraction', 0.33333334)]"
97.0,Good usage of organism abstract class. animals extend prey or predator class which allows for code to not be rewritten,11,1,"['usage', 'organism', 'class', 'class', 'code']",Inheritance,0.33333334,"hierarchy, superclass, reusability, encapsulation, maintainability, functionality, subclass, variable, extensibility, type","[('Inheritance', 0.33333334), ('Design', 0.33333334), ('Abstraction', 0.33333334)]"
70.0,"a lot of rewritten code, could have utilized abstract clsses.",11,1,['clsse'],Inheritance,0.33333334,"hierarchy, superclass, reusability, encapsulation, maintainability, functionality, subclass, variable, extensibility, type","[('Inheritance', 0.33333334), ('Design', 0.33333334), ('Abstraction', 0.33333334)]"
246.0,code has been rewritten where it does not need to be.,11,1,['need'],Inheritance,0.33333334,"hierarchy, superclass, reusability, encapsulation, maintainability, functionality, subclass, variable, extensibility, type","[('Inheritance', 0.33333334), ('Design', 0.33333334), ('Abstraction', 0.33333334)]"
49.0,"some rewritten code, did not utilize abstracted classes and interfaces.",11,1,['class'],Inheritance,0.33333334,"hierarchy, superclass, reusability, encapsulation, maintainability, functionality, subclass, variable, extensibility, type","[('Inheritance', 0.33333334), ('Design', 0.33333334), ('Abstraction', 0.33333334)]"
294.0,a lot of rewritten code not utilizing abstract and  interfaces.,11,1,['code'],Inheritance,0.33333334,"hierarchy, superclass, reusability, encapsulation, maintainability, functionality, subclass, variable, extensibility, type","[('Inheritance', 0.33333334), ('Design', 0.33333334), ('Abstraction', 0.33333334)]"
478.0,good use of abstraction,11,1,['abstraction'],Abstraction,0.66662383,"abstraction, structure, type, feature, repetition, segment, encapsulation, hierarchy, design, variable","[('Abstraction', 0.66662383), ('Inheritance', 0.16669157), ('Design', 0.16668457)]"
615.0,submitted template ,11,1,['template'],Inheritance,0.33333334,"hierarchy, superclass, reusability, encapsulation, maintainability, functionality, subclass, variable, extensibility, type","[('Inheritance', 0.33333334), ('Design', 0.33333334), ('Abstraction', 0.33333334)]"
604.0,"did not utilize abstraction and interfaces, some rewritten code.",11,1,"['abstraction', 'code']",Abstraction,0.66662383,"abstraction, structure, type, feature, repetition, segment, encapsulation, hierarchy, design, variable","[('Abstraction', 0.66662383), ('Inheritance', 0.16669157), ('Design', 0.16668457)]"
440.0,"Great use of abstraction, code is not rewritten for each animal due to predator and prey classes however, canBreed() function could be abstracted even further to animal class.",11,1,"['abstraction', 'code', 'class', 'canbreed', 'class']",Abstraction,0.6666239,"abstraction, structure, type, feature, repetition, segment, encapsulation, hierarchy, design, variable","[('Abstraction', 0.6666239), ('Inheritance', 0.16669157), ('Design', 0.16668457)]"
441.0,"Did not utilize abstraction and interfaces, a lot of rewritten code.",11,1,"['abstraction', 'code']",Abstraction,0.66662353,"abstraction, structure, type, feature, repetition, segment, encapsulation, hierarchy, design, variable","[('Abstraction', 0.66662353), ('Inheritance', 0.16669175), ('Design', 0.16668469)]"
330.0,"no usage of abstraction other than animal class, a lot of rewritten code. ",11,1,"['usage', 'abstraction', 'class', 'code']",Abstraction,0.6666235,"abstraction, structure, type, feature, repetition, segment, encapsulation, hierarchy, design, variable","[('Abstraction', 0.6666235), ('Inheritance', 0.16669181), ('Design', 0.1666847)]"
38.0,"no use of predator and prey classes, a lot of rewritten code",11,1,['class'],Inheritance,0.33333334,"hierarchy, superclass, reusability, encapsulation, maintainability, functionality, subclass, variable, extensibility, type","[('Inheritance', 0.33333334), ('Design', 0.33333334), ('Abstraction', 0.33333334)]"
429.0,"some good use of abstraction however still a lot of rewritten code for example, animals hunting. ",11,1,"['abstraction', 'code']",Abstraction,0.66662383,"abstraction, structure, type, feature, repetition, segment, encapsulation, hierarchy, design, variable","[('Abstraction', 0.66662383), ('Inheritance', 0.16669157), ('Design', 0.16668457)]"
582.0,Many features lack flexibility or are implemented in ways that are repeated in every class. These could be extracted to a more generic class such as Animal.,16,2,"['feature', 'lack', 'flexibility', 'class', 'class']",Abstraction,0.66652584,"abstraction, structure, type, feature, repetition, segment, encapsulation, hierarchy, design, variable","[('Abstraction', 0.66652584), ('Inheritance', 0.16674054), ('Design', 0.16673361)]"
148.0,"Some features are repeated and can be extracted out to a more abstract class. However, some features such as time are extracted out for more cohesion.",16,2,"['feature', 'class', 'cohesion']",Abstraction,0.66652584,"abstraction, structure, type, feature, repetition, segment, encapsulation, hierarchy, design, variable","[('Abstraction', 0.66652584), ('Inheritance', 0.16674055), ('Design', 0.16673362)]"
201.0,"Features are generally implemented in reusable ways using techniques such as polymorphism and inheritance. Furthermore, good class design for cohesive classes.",16,2,"['feature', 'technique', 'polymorphism', 'class', 'design', 'class']",Abstraction,0.49312055,"abstraction, structure, type, feature, repetition, segment, encapsulation, hierarchy, design, variable","[('Abstraction', 0.49312055), ('Design', 0.36687258), ('Inheritance', 0.14000684)]"
229.0,Features are implemented in ways in which it is maximally reusable through the use of inheritance and polymorphism of classes.,16,2,"['feature', 'polymorphism', 'class']",Abstraction,0.66652584,"abstraction, structure, type, feature, repetition, segment, encapsulation, hierarchy, design, variable","[('Abstraction', 0.66652584), ('Inheritance', 0.16674055), ('Design', 0.16673362)]"
544.0,Good attempt at reducing the repeated code through the use of abstract classes. Can be even craftier at producing offspring for each of the animal classes. Also it seems illogical to use class names to provide linkage for predator and prey.,16,2,"['attempt', 'code', 'class', 'offspring', 'class', 'class', 'name', 'linkage']",Inheritance,0.33333334,"hierarchy, superclass, reusability, encapsulation, maintainability, functionality, subclass, variable, extensibility, type","[('Inheritance', 0.33333334), ('Design', 0.33333334), ('Abstraction', 0.33333334)]"
273.0,A lot of code has been repeated through the implementation for each of the animal implementations.  It is more sensible to extract these codes and provide abstract methods to override such behavior..,16,2,"['code', 'implementation', 'implementation', 'extract', 'code']",Design,0.6665985,"design, variable, implementation, extensibility, core, hierarchy, encapsulation, structure, type, repetition","[('Design', 0.6665985), ('Inheritance', 0.16670199), ('Abstraction', 0.16669953)]"
306.0,Sections of code can be reduced by extracting it to a more abstract class and can also be broken down into more abstract methods for more animal-specific behavior. ,16,2,"['section', 'class']",Inheritance,0.33333334,"hierarchy, superclass, reusability, encapsulation, maintainability, functionality, subclass, variable, extensibility, type","[('Inheritance', 0.33333334), ('Design', 0.33333334), ('Abstraction', 0.33333334)]"
92.0,"Generally, this student attempts to reuse code segments through the use of inheritance and polymorphism. Only minor repetitive code segments are created due to class design choice.",16,2,"['reuse', 'code', 'segment', 'polymorphism', 'code', 'segment', 'class', 'design', 'choice']",Abstraction,0.56519246,"abstraction, structure, type, feature, repetition, segment, encapsulation, hierarchy, design, variable","[('Abstraction', 0.56519246), ('Design', 0.28767976), ('Inheritance', 0.14712772)]"
487.0,"Features are generally implemented in reusable ways using techniques such as polymorphism and inheritance. However, it is not easy to add new weather or diseases to the environment.",16,2,"['feature', 'technique', 'polymorphism', 'environment']",Abstraction,0.66652584,"abstraction, structure, type, feature, repetition, segment, encapsulation, hierarchy, design, variable","[('Abstraction', 0.66652584), ('Inheritance', 0.16674054), ('Design', 0.16673361)]"
417.0,A lot of code has been repeated through the implementation for each of the animal implementations.  It is more sensible to extract these codes and provide abstract methods to override such behavior.,16,2,"['code', 'implementation', 'implementation', 'extract', 'code']",Design,0.6665985,"design, variable, implementation, extensibility, core, hierarchy, encapsulation, structure, type, repetition","[('Design', 0.6665985), ('Inheritance', 0.16670199), ('Abstraction', 0.16669953)]"
241.0,A lot of code has been repeated through the implementation for each of the animal implementations.  It is more sensible to extract these codes and provide abstract methods to override such behavior.,16,2,"['code', 'implementation', 'implementation', 'extract', 'code']",Design,0.6665985,"design, variable, implementation, extensibility, core, hierarchy, encapsulation, structure, type, repetition","[('Design', 0.6665985), ('Inheritance', 0.16670197), ('Abstraction', 0.16669951)]"
355.0,"Features are generally implemented in reusable ways using techniques such as polymorphism and inheritance. Extensive knowledge of Java allows this student to reduce repeated code segments. Furthermore, good class design for cohesive classes. ",16,2,"['feature', 'technique', 'polymorphism', 'knowledge', 'code', 'segment', 'class', 'design', 'class']",Abstraction,0.59792566,"abstraction, structure, type, feature, repetition, segment, encapsulation, hierarchy, design, variable","[('Abstraction', 0.59792566), ('Design', 0.278706), ('Inheritance', 0.1233683)]"
254.0,Attempts have been made to reduce repeated code through abstract classes. Not very flexible when it comes to the design of weather and weather-based behavior.,16,2,"['attempt', 'code', 'class']",Inheritance,0.33333334,"hierarchy, superclass, reusability, encapsulation, maintainability, functionality, subclass, variable, extensibility, type","[('Inheritance', 0.33333334), ('Design', 0.33333334), ('Abstraction', 0.33333334)]"
67.0,Some attempt to reduce repeated code segments through abstract classes. However many segments of repeated code still exist.,16,2,"['attempt', 'code', 'segment', 'class', 'segment', 'code']",Abstraction,0.666403,"abstraction, structure, type, feature, repetition, segment, encapsulation, hierarchy, design, variable","[('Abstraction', 0.666403), ('Inheritance', 0.16680421), ('Design', 0.16679278)]"
135.0,Generally little repeated code exists in projects other than the breeding function. Design choices have led to difficulty in extending the function.,16,2,"['code', 'project', 'design', 'choice', 'difficulty']",Design,0.66655916,"design, variable, implementation, extensibility, core, hierarchy, encapsulation, structure, type, repetition","[('Design', 0.66655916), ('Abstraction', 0.16674225), ('Inheritance', 0.16669862)]"
63.0,"A lot of code has been repeated through the implementation for each of the animal implementations.  It is more sensible to extract these codes and provide abstract methods to override such behavior. In addition, some extension features are implemented in ways for which it is hard to extend to add new features.",16,2,"['code', 'implementation', 'implementation', 'extract', 'code', 'addition', 'extension', 'feature', 'extend', 'feature']",Abstraction,0.48034537,"abstraction, structure, type, feature, repetition, segment, encapsulation, hierarchy, design, variable","[('Abstraction', 0.48034537), ('Design', 0.38030306), ('Inheritance', 0.13935158)]"
133.0,"Generally, some repeated code segments exist in projects. Design choices have led to difficulty in extending the function.",16,2,"['code', 'segment', 'project', 'design', 'choice', 'difficulty']",Abstraction,0.48595855,"abstraction, structure, type, feature, repetition, segment, encapsulation, hierarchy, design, variable","[('Abstraction', 0.48595855), ('Design', 0.37435424), ('Inheritance', 0.13968721)]"
11.0,"Features are generally implemented in reusable ways using techniques such as polymorphism and inheritance. Extensive knowledge of Java allows this student to reduce repeated code segments. Furthermore, good class design for cohesive classes. ",16,2,"['feature', 'technique', 'polymorphism', 'knowledge', 'code', 'segment', 'class', 'design', 'class']",Abstraction,0.5979255,"abstraction, structure, type, feature, repetition, segment, encapsulation, hierarchy, design, variable","[('Abstraction', 0.5979255), ('Design', 0.27870625), ('Inheritance', 0.1233683)]"
576.0,Many features lack flexibility or are implemented in ways that are repeated in every class. These could be extracted to a more generic class such as Animal.,16,2,"['feature', 'lack', 'flexibility', 'class', 'class']",Abstraction,0.66652584,"abstraction, structure, type, feature, repetition, segment, encapsulation, hierarchy, design, variable","[('Abstraction', 0.66652584), ('Inheritance', 0.16674054), ('Design', 0.16673361)]"
683.0,A lot of code has been repeated through the implementation for each of the animal implementations.  It is more sensible to extract these codes and provide abstract methods to override such behavior.,16,2,"['code', 'implementation', 'implementation', 'extract', 'code']",Design,0.6665985,"design, variable, implementation, extensibility, core, hierarchy, encapsulation, structure, type, repetition","[('Design', 0.6665985), ('Inheritance', 0.16670199), ('Abstraction', 0.16669953)]"
377.0,"Lots of reusable code, no repetition",20,1,"['code', 'repetition']",Abstraction,0.6664554,"abstraction, structure, type, feature, repetition, segment, encapsulation, hierarchy, design, variable","[('Abstraction', 0.6664554), ('Design', 0.16677354), ('Inheritance', 0.16677111)]"
46.0,"act function is similar for all animals, could of implemented it in the animal class rather than having it as an abstract class for better code reusability.",20,1,"['class', 'class', 'code', 'reusability']",Inheritance,0.6666129,"hierarchy, superclass, reusability, encapsulation, maintainability, functionality, subclass, variable, extensibility, type","[('Inheritance', 0.6666129), ('Abstraction', 0.16669548), ('Design', 0.16669157)]"
365.0,"smart coding, reusable functions. no repeating code",20,1,['code'],Inheritance,0.33333334,"hierarchy, superclass, reusability, encapsulation, maintainability, functionality, subclass, variable, extensibility, type","[('Inheritance', 0.33333334), ('Design', 0.33333334), ('Abstraction', 0.33333334)]"
526.0,"give birth function has similar structure in each animal, should of implemented it in the animal class.",20,1,"['birth', 'structure', 'class']",Abstraction,0.666595,"abstraction, structure, type, feature, repetition, segment, encapsulation, hierarchy, design, variable","[('Abstraction', 0.666595), ('Design', 0.16670391), ('Inheritance', 0.16670115)]"
255.0,"great code reusability, no repeating code. however some functions are long and do more than 1 thing.",20,1,"['code', 'reusability', 'code', 'thing']",Inheritance,0.6666129,"hierarchy, superclass, reusability, encapsulation, maintainability, functionality, subclass, variable, extensibility, type","[('Inheritance', 0.6666129), ('Abstraction', 0.16669548), ('Design', 0.16669157)]"
98.0,"act function is similar for all animals, should of implemented it in the animal class. Why is plant and InfectableAnimal class extending from animal class?",20,1,"['class', 'class', 'class']",Inheritance,0.33333334,"hierarchy, superclass, reusability, encapsulation, maintainability, functionality, subclass, variable, extensibility, type","[('Inheritance', 0.33333334), ('Design', 0.33333334), ('Abstraction', 0.33333334)]"
659.0,"act function does too much, should break it down.",20,1,[],Inheritance,0.33333334,"hierarchy, superclass, reusability, encapsulation, maintainability, functionality, subclass, variable, extensibility, type","[('Inheritance', 0.33333334), ('Design', 0.33333334), ('Abstraction', 0.33333334)]"
387.0,"poor code reusability. Act functions are similar so should of implemented that in the animal class, why do you need a New class for each animal and animal class.",20,1,"['code', 'reusability', 'class', 'class', 'class']",Inheritance,0.666613,"hierarchy, superclass, reusability, encapsulation, maintainability, functionality, subclass, variable, extensibility, type","[('Inheritance', 0.666613), ('Abstraction', 0.16669548), ('Design', 0.16669157)]"
574.0,"day act and night act functions are very similar for all animals, should of implemented it in the animal class for better code reusability.",20,1,"['day', 'night', 'class', 'code', 'reusability']",Inheritance,0.6666129,"hierarchy, superclass, reusability, encapsulation, maintainability, functionality, subclass, variable, extensibility, type","[('Inheritance', 0.6666129), ('Abstraction', 0.16669548), ('Design', 0.16669157)]"
450.0,"act function is similar for all animals, should of implemented it in animal class for better code reusability. Same goes for FindFood function.",20,1,"['class', 'code', 'reusability', 'findfood']",Inheritance,0.6666129,"hierarchy, superclass, reusability, encapsulation, maintainability, functionality, subclass, variable, extensibility, type","[('Inheritance', 0.6666129), ('Abstraction', 0.16669548), ('Design', 0.16669157)]"
221.0,"act function is similar for all animals, should of implemented it in animal class for better code reusability.",20,1,"['class', 'code', 'reusability']",Inheritance,0.666613,"hierarchy, superclass, reusability, encapsulation, maintainability, functionality, subclass, variable, extensibility, type","[('Inheritance', 0.666613), ('Abstraction', 0.16669548), ('Design', 0.16669157)]"
156.0,"act function is similar for all animals, could of implemented it in the animal class for better code reusability.",20,1,"['class', 'code', 'reusability']",Inheritance,0.666613,"hierarchy, superclass, reusability, encapsulation, maintainability, functionality, subclass, variable, extensibility, type","[('Inheritance', 0.666613), ('Abstraction', 0.16669548), ('Design', 0.16669157)]"
516.0,"act function does too much, should break it down. Excellent code reusability, no repeating code.",20,1,"['code', 'reusability', 'code']",Inheritance,0.6666129,"hierarchy, superclass, reusability, encapsulation, maintainability, functionality, subclass, variable, extensibility, type","[('Inheritance', 0.6666129), ('Abstraction', 0.16669548), ('Design', 0.16669157)]"
289.0,"Overall code elegance is good. The readability of the code is high. The modularity of the codebase could be improved: For example, dividing Animal classes into predator/prey sub-types. There are, however, other examples of good extendability in the codebase: such as the FieldStats class.",28,1,"['code', 'elegance', 'codebase', 'class', 'sub', 'type', 'extendability', 'codebase', 'fieldstat', 'class']",Abstraction,0.66656476,"abstraction, structure, type, feature, repetition, segment, encapsulation, hierarchy, design, variable","[('Abstraction', 0.66656476), ('Inheritance', 0.16671798), ('Design', 0.16671723)]"
555.0,The student used abstract classes and interfaces well. The code is modularised well and is open to extension. The classes and methods adhere to the single-responsibility principle. Common functionality is pushed to the superclasses such as 'Animal',28,1,"['class', 'code', 'extension', 'class', 'responsibility', 'functionality', 'superclass']",Inheritance,0.7233054,"hierarchy, superclass, reusability, encapsulation, maintainability, functionality, subclass, variable, extensibility, type","[('Inheritance', 0.7233054), ('Abstraction', 0.13835405), ('Design', 0.1383405)]"
