assignment_number,comments,participant_id,batch,processed_text,Dominant_Topic,Perc_Contribution,Topic_Keywords,All_Topics
18.0,"The code is broken out into many separate classes for each species and simulation component, enabling decent modularity and reuse. The logic could likely be simplified in places, but overall the design and efficiency are reasonable without overly sacrificing readability.",15,1,"['code', 'class', 'component', 'reuse', 'logic', 'place', 'design', 'efficiency']",Design,0.66655916,"design, variable, implementation, extensibility, core, hierarchy, encapsulation, structure, type, repetition","[('Design', 0.66655916), ('Abstraction', 0.16674225), ('Inheritance', 0.16669862)]"
620.0,"The code makes excellent use of inheritance with base Animal, Predator, and Plant classes. Shared constants and methods are defined in parent classes. Each specific animal and plant type extends the base classes with their unique characteristics. This produces very clean, readable and maintainable code.",15,1,"['code', 'class', 'constant', 'parent', 'class', 'type', 'class', 'characteristic', 'code']",Abstraction,0.66656476,"abstraction, structure, type, feature, repetition, segment, encapsulation, hierarchy, design, variable","[('Abstraction', 0.66656476), ('Inheritance', 0.16671798), ('Design', 0.16671723)]"
466.0,"The code is broken out into many separate classes for each species and simulation component, enabling decent modularity and reuse. The logic could likely be simplified in places, but overall the design and efficiency are reasonable without overly sacrificing readability.",15,1,"['code', 'class', 'component', 'reuse', 'logic', 'place', 'design', 'efficiency']",Design,0.66655916,"design, variable, implementation, extensibility, core, hierarchy, encapsulation, structure, type, repetition","[('Design', 0.66655916), ('Abstraction', 0.16674225), ('Inheritance', 0.16669862)]"
591.0,"The code follows good object-oriented design patterns, with a logical separation of concerns between classes. The base Animal class encapsulates shared functionality. The individual creature classes inherit from Animal and define their unique properties and behaviors. Constants are used effectively to avoid magic numbers. There are opportunities to further refactor some of the duplicated logic between creature classes.",15,1,"['design', 'pattern', 'separation', 'concern', 'class', 'class', 'functionality', 'creature', 'class', 'inherit', 'property', 'constant', 'number', 'opportunity', 'refactor', 'creature', 'class']",Inheritance,0.47443423,"hierarchy, superclass, reusability, encapsulation, maintainability, functionality, subclass, variable, extensibility, type","[('Inheritance', 0.47443423), ('Design', 0.38640442), ('Abstraction', 0.13916138)]"
587.0,"The code follows good object-oriented design patterns, with a logical separation of concerns between classes. The base Animal class encapsulates shared functionality. The individual creature classes inherit from Animal and define their unique properties and behaviors. Constants are used effectively to avoid magic numbers. There are opportunities to further refactor some of the duplicated logic between creature classes.",15,1,"['design', 'pattern', 'separation', 'concern', 'class', 'class', 'functionality', 'creature', 'class', 'inherit', 'property', 'constant', 'number', 'opportunity', 'refactor', 'creature', 'class']",Inheritance,0.47443438,"hierarchy, superclass, reusability, encapsulation, maintainability, functionality, subclass, variable, extensibility, type","[('Inheritance', 0.47443438), ('Design', 0.38640428), ('Abstraction', 0.13916136)]"
50.0,"The code follows good object-oriented design patterns, with a logical separation of concerns between classes. The base Animal class encapsulates shared functionality. The individual creature classes inherit from Animal and define their unique properties and behaviors. Constants are used effectively to avoid magic numbers. There are opportunities to further refactor some of the duplicated logic between creature classes.",15,1,"['design', 'pattern', 'separation', 'concern', 'class', 'class', 'functionality', 'creature', 'class', 'inherit', 'property', 'constant', 'number', 'opportunity', 'refactor', 'creature', 'class']",Inheritance,0.47443435,"hierarchy, superclass, reusability, encapsulation, maintainability, functionality, subclass, variable, extensibility, type","[('Inheritance', 0.47443435), ('Design', 0.38640434), ('Abstraction', 0.13916136)]"
655.0,"The code demonstrates very good use of classes and inheritance to produce reusable and maintainable code. Abstract base classes like Animal, Predator and Prey allow for shared functionality. The code appears well organized into logical classes and methods.",15,1,"['code', 'class', 'code', 'class', 'functionality', 'code', 'class']",Inheritance,0.6664716,"hierarchy, superclass, reusability, encapsulation, maintainability, functionality, subclass, variable, extensibility, type","[('Inheritance', 0.6664716), ('Abstraction', 0.16678008), ('Design', 0.16674829)]"
47.0,"The code demonstrates excellent use of classes and inheritance to enable code reuse. For example, the various animal classes extend an abstract Animal class. Functionality is broken out well into different classes and methods. The code looks quite efficient and readable.",15,1,"['code', 'class', 'code', 'class', 'class', 'functionality', 'class', 'code']",Inheritance,0.66647166,"hierarchy, superclass, reusability, encapsulation, maintainability, functionality, subclass, variable, extensibility, type","[('Inheritance', 0.66647166), ('Abstraction', 0.16678007), ('Design', 0.16674829)]"
262.0,Your code structure is commendable. The use of inheritance and abstraction to define common behaviors across different species shows advanced programming skills. This approach not only avoids redundancy but also facilitates code maintenance and future expansions.,15,1,"['code', 'structure', 'abstraction', 'programming', 'skill', 'redundancy', 'code', 'maintenance', 'future', 'expansion']",Abstraction,0.7223865,"abstraction, structure, type, feature, repetition, segment, encapsulation, hierarchy, design, variable","[('Abstraction', 0.7223865), ('Inheritance', 0.13880734), ('Design', 0.13880615)]"
2.0,Your code structure is commendable. The use of inheritance and abstraction to define common behaviors across different species shows advanced programming skills. This approach not only avoids redundancy but also facilitates code maintenance and future expansions.,15,1,"['code', 'structure', 'abstraction', 'programming', 'skill', 'redundancy', 'code', 'maintenance', 'future', 'expansion']",Abstraction,0.72238654,"abstraction, structure, type, feature, repetition, segment, encapsulation, hierarchy, design, variable","[('Abstraction', 0.72238654), ('Inheritance', 0.13880736), ('Design', 0.13880616)]"
400.0,"The code makes excellent use of classes, inheritance, and interfaces to create well-organized, reusable and maintainable code. Class responsibilities are clearly delineated. Abstractions like Animal, Disease, Weather allow shared behavior to be cleanly captured. The code is efficient and readable.",15,1,"['code', 'class', 'code', 'class', 'abstraction', 'code']",Abstraction,0.66662383,"abstraction, structure, type, feature, repetition, segment, encapsulation, hierarchy, design, variable","[('Abstraction', 0.66662383), ('Inheritance', 0.16669157), ('Design', 0.16668457)]"
525.0,"The code follows good object-oriented design principles, with a clean separation of concerns between classes. Inheritance is used effectively for the animal classes. Methods are focused and not overly complex. Some code duplication exists that could potentially be refactored.",15,1,"['design', 'separation', 'concern', 'class', 'class', 'code', 'duplication']",Design,0.66655916,"design, variable, implementation, extensibility, core, hierarchy, encapsulation, structure, type, repetition","[('Design', 0.66655916), ('Abstraction', 0.16674225), ('Inheritance', 0.16669862)]"
358.0,"The code demonstrates good use of classes and functions, producing fairly reusable and maintainable code. Inheritance is used effectively with base Animal class. The code is readable and understandable without being overly complex.",15,1,"['code', 'class', 'code', 'class', 'code']",Inheritance,0.33333334,"hierarchy, superclass, reusability, encapsulation, maintainability, functionality, subclass, variable, extensibility, type","[('Inheritance', 0.33333334), ('Design', 0.33333334), ('Abstraction', 0.33333334)]"
137.0,"The student demonstrates excellent use of classes, inheritance (abstract Animal class extended by Predator and Prey) and polymorphism to create a well-structured, extensible design. The code is broken into logical methods and avoids redundancy. Fields and methods have appropriate access modifiers. The act() methods delegate work to other methods with clear purposes like giveBirth(), findFood() etc. Smart optimizations are made, like caching free adjacent locations. ",15,1,"['class', 'class', 'polymorphism', 'design', 'code', 'redundancy', 'field', 'access', 'modifier', 'work', 'purpose', 'optimization', 'location']",Design,0.66655916,"design, variable, implementation, extensibility, core, hierarchy, encapsulation, structure, type, repetition","[('Design', 0.66655916), ('Abstraction', 0.16674225), ('Inheritance', 0.16669862)]"
125.0,"The code makes good use of inheritance with an abstract Animal class and specific subclasses for each species. Behavior is encapsulated within each class. Fields and methods have clear, descriptive names. The code is efficient, using collections effectively.",15,1,"['code', 'class', 'subclass', 'class', 'field', 'name', 'code', 'collection']",Inheritance,0.66590965,"hierarchy, superclass, reusability, encapsulation, maintainability, functionality, subclass, variable, extensibility, type","[('Inheritance', 0.66590965), ('Abstraction', 0.16710818), ('Design', 0.16698217)]"
58.0,"The code is broken out into separate classes for each animal type, which allows for specialization while inheriting shared behavior from the abstract Animal class. This enables code reuse. The logic for animal behaviors like eating, breeding, and aging is mostly encapsulated within each class.",15,1,"['class', 'type', 'specialization', 'class', 'code', 'breeding', 'aging', 'class']",Abstraction,0.66656476,"abstraction, structure, type, feature, repetition, segment, encapsulation, hierarchy, design, variable","[('Abstraction', 0.66656476), ('Inheritance', 0.16671798), ('Design', 0.16671723)]"
353.0,The code makes good use of inheritance with an abstract Animal class. Behavior is encapsulated within each animal subclass. Fields and methods have clear purposes.,15,1,"['code', 'class', 'subclass', 'field', 'purpose']",Inheritance,0.66590935,"hierarchy, superclass, reusability, encapsulation, maintainability, functionality, subclass, variable, extensibility, type","[('Inheritance', 0.66590935), ('Abstraction', 0.16710828), ('Design', 0.16698237)]"
422.0,"The code demonstrates good use of classes and inheritance to represent the different species and their shared characteristics. The Animal and Plant abstract classes provide a clean separation of common functionality. The code is generally efficient and readable. A few areas could potentially be improved, such as reducing some repetition between similar classes, but overall the code is quite elegant.",15,1,"['code', 'class', 'characteristic', 'class', 'separation', 'functionality', 'code', 'area', 'repetition', 'class', 'code']",Abstraction,0.4309779,"abstraction, structure, type, feature, repetition, segment, encapsulation, hierarchy, design, variable","[('Abstraction', 0.4309779), ('Inheritance', 0.43078968), ('Design', 0.13823238)]"
480.0,"The code is structured reasonably with separate classes for each species inheriting from an Animal superclass. However, there is a lot of duplicated code between species classes that could be refactored into the superclass to improve reusability. The code is readable but some design decisions are questionable, like having so many static constants.",15,1,"['class', 'superclass', 'code', 'class', 'superclass', 'reusability', 'code', 'design', 'decision', 'constant']",Inheritance,0.5969274,"hierarchy, superclass, reusability, encapsulation, maintainability, functionality, subclass, variable, extensibility, type","[('Inheritance', 0.5969274), ('Design', 0.27325365), ('Abstraction', 0.12981889)]"
334.0,"The student demonstrates excellent use of classes and inheritance to produce reusable and maintainable code. The Animal and HabitatFood abstract classes define shared functionality. Each species extends these appropriately (e.g. Mouse, Hyena, Flower). Methods are used effectively to encapsulate behaviors like eating, breeding, aging, and disease transmission. The code is efficient and readable.",15,1,"['class', 'code', 'habitatfood', 'class', 'functionality', 'flower', 'transmission', 'code']",Inheritance,0.6664716,"hierarchy, superclass, reusability, encapsulation, maintainability, functionality, subclass, variable, extensibility, type","[('Inheritance', 0.6664716), ('Abstraction', 0.16678008), ('Design', 0.16674829)]"
160.0,The code is fairly efficient without sacrificing readability and understanding.,24,1,['understanding'],Inheritance,0.33333334,"hierarchy, superclass, reusability, encapsulation, maintainability, functionality, subclass, variable, extensibility, type","[('Inheritance', 0.33333334), ('Design', 0.33333334), ('Abstraction', 0.33333334)]"
473.0,the code is efficient without sacrificing readability and understanding.,24,1,"['code', 'understanding']",Inheritance,0.33333334,"hierarchy, superclass, reusability, encapsulation, maintainability, functionality, subclass, variable, extensibility, type","[('Inheritance', 0.33333334), ('Design', 0.33333334), ('Abstraction', 0.33333334)]"
624.0,some of the code is unnecessarily complex or poorly designed.,24,1,[],Inheritance,0.33333334,"hierarchy, superclass, reusability, encapsulation, maintainability, functionality, subclass, variable, extensibility, type","[('Inheritance', 0.33333334), ('Design', 0.33333334), ('Abstraction', 0.33333334)]"
311.0,The application is unnecessarily complex,24,1,['application'],Inheritance,0.33333334,"hierarchy, superclass, reusability, encapsulation, maintainability, functionality, subclass, variable, extensibility, type","[('Inheritance', 0.33333334), ('Design', 0.33333334), ('Abstraction', 0.33333334)]"
105.0,The application is unnecessarily complex,24,1,['application'],Inheritance,0.33333334,"hierarchy, superclass, reusability, encapsulation, maintainability, functionality, subclass, variable, extensibility, type","[('Inheritance', 0.33333334), ('Design', 0.33333334), ('Abstraction', 0.33333334)]"
654.0,"The student demonstrate excellent use of classes and functions to produce reusable and maintainable code, the only downside would be decoupling the weather functionality from the simulator as a separate class.",24,1,"['class', 'code', 'downside', 'functionality', 'simulator', 'class']",Inheritance,0.66647166,"hierarchy, superclass, reusability, encapsulation, maintainability, functionality, subclass, variable, extensibility, type","[('Inheritance', 0.66647166), ('Abstraction', 0.16678007), ('Design', 0.16674829)]"
79.0,"Some codes are repeated, such as the switch statement, which can nested in a private method in the parent class and inherited by the animals when breeding not to repeat the same code in different classes.",24,1,"['code', 'switch', 'statement', 'parent', 'class', 'repeat', 'code', 'class']",Inheritance,0.33333334,"hierarchy, superclass, reusability, encapsulation, maintainability, functionality, subclass, variable, extensibility, type","[('Inheritance', 0.33333334), ('Design', 0.33333334), ('Abstraction', 0.33333334)]"
45.0,Some if-else statements are redundant and classes such as weather could be uncoupled from the simulator by creating a new Weather class.,24,1,"['statement', 'class', 'simulator', 'class']",Inheritance,0.33333334,"hierarchy, superclass, reusability, encapsulation, maintainability, functionality, subclass, variable, extensibility, type","[('Inheritance', 0.33333334), ('Design', 0.33333334), ('Abstraction', 0.33333334)]"
51.0,excellent use of classes and functions but the code is incomplete,24,1,"['class', 'code']",Inheritance,0.33333334,"hierarchy, superclass, reusability, encapsulation, maintainability, functionality, subclass, variable, extensibility, type","[('Inheritance', 0.33333334), ('Design', 0.33333334), ('Abstraction', 0.33333334)]"
523.0,"Excellent use of classes and functions, code is modular, reusable and maintainable.",24,1,"['class', 'maintainable']",Inheritance,0.33333334,"hierarchy, superclass, reusability, encapsulation, maintainability, functionality, subclass, variable, extensibility, type","[('Inheritance', 0.33333334), ('Design', 0.33333334), ('Abstraction', 0.33333334)]"
410.0,All of the base tasks and some of the challenge tasks are implemented in such a way that code can be reused.,24,1,['code'],Inheritance,0.33333334,"hierarchy, superclass, reusability, encapsulation, maintainability, functionality, subclass, variable, extensibility, type","[('Inheritance', 0.33333334), ('Design', 0.33333334), ('Abstraction', 0.33333334)]"
490.0,The application is implemented in such a way that many code segments could be rewritten and some code is unnecessarily complex and poorly designed.,24,1,"['application', 'code', 'segment']",Abstraction,0.666403,"abstraction, structure, type, feature, repetition, segment, encapsulation, hierarchy, design, variable","[('Abstraction', 0.666403), ('Inheritance', 0.1668042), ('Design', 0.16679277)]"
124.0,The application is implemented in such a way that only a few code segments could be rewritten to increase re-usability. Design concepts such as interface are not clear.,24,1,"['application', 'code', 'segment', 'usability', 'design']",Abstraction,0.48595876,"abstraction, structure, type, feature, repetition, segment, encapsulation, hierarchy, design, variable","[('Abstraction', 0.48595876), ('Design', 0.37435406), ('Inheritance', 0.13968721)]"
77.0,The application is implemented in such a way that only a few code segments can be rewritten to increase code re-usability.,24,1,"['application', 'code', 'segment', 'code', 'usability']",Abstraction,0.666403,"abstraction, structure, type, feature, repetition, segment, encapsulation, hierarchy, design, variable","[('Abstraction', 0.666403), ('Inheritance', 0.16680422), ('Design', 0.16679281)]"
252.0,the student demonstrates excellent use of classes and functions.,24,1,['class'],Inheritance,0.33333334,"hierarchy, superclass, reusability, encapsulation, maintainability, functionality, subclass, variable, extensibility, type","[('Inheritance', 0.33333334), ('Design', 0.33333334), ('Abstraction', 0.33333334)]"
236.0,The application is implemented in such a way that many code segments can be rewritten to increase code re-usability.,24,1,"['application', 'code', 'segment', 'code', 'usability']",Abstraction,0.666403,"abstraction, structure, type, feature, repetition, segment, encapsulation, hierarchy, design, variable","[('Abstraction', 0.666403), ('Inheritance', 0.1668042), ('Design', 0.16679277)]"
549.0,"All the base tasks and some of the challenge tasks are implemented in such a way that code can be reused, where possible",24,1,['code'],Inheritance,0.33333334,"hierarchy, superclass, reusability, encapsulation, maintainability, functionality, subclass, variable, extensibility, type","[('Inheritance', 0.33333334), ('Design', 0.33333334), ('Abstraction', 0.33333334)]"
10.0,The student demonstrates excellent use of classes and functions to produce reusable and maintainable code; the code is efficient without sacrificing readability and understanding.,24,1,"['class', 'code', 'code', 'understanding']",Inheritance,0.33333334,"hierarchy, superclass, reusability, encapsulation, maintainability, functionality, subclass, variable, extensibility, type","[('Inheritance', 0.33333334), ('Design', 0.33333334), ('Abstraction', 0.33333334)]"
292.0,"The student demonstrate excellent use of classes and functions to produce reusable and maintainable code, the only downside would be decoupling the weather functionality from the simulator as a separate class.",24,1,"['class', 'code', 'downside', 'functionality', 'simulator', 'class']",Inheritance,0.66647166,"hierarchy, superclass, reusability, encapsulation, maintainability, functionality, subclass, variable, extensibility, type","[('Inheritance', 0.66647166), ('Abstraction', 0.16678007), ('Design', 0.16674829)]"
451.0,All of the base tasks and some of the challenge tasks are implemented in such a way that code can be reused.,24,1,['code'],Inheritance,0.33333334,"hierarchy, superclass, reusability, encapsulation, maintainability, functionality, subclass, variable, extensibility, type","[('Inheritance', 0.33333334), ('Design', 0.33333334), ('Abstraction', 0.33333334)]"
217.0,The code is structured well with good use of classes to modularise code. The codebase would benefit from the addition of predator and prey classes for improved extensibility,28,2,"['code', 'class', 'code', 'codebase', 'addition', 'class', 'extensibility']",Design,0.6665572,"design, variable, implementation, extensibility, core, hierarchy, encapsulation, structure, type, repetition","[('Design', 0.6665572), ('Inheritance', 0.16672574), ('Abstraction', 0.16671713)]"
623.0,"The code is structured well with a good use of classes and methods. The student added an 'organism' class as a common superclass of the plants and animals, however, the animal class should extend the organism class and further encapsulate the animal types. ",28,2,"['code', 'class', 'organism', 'class', 'superclass', 'class', 'extend', 'organism', 'class', 'encapsulate', 'type']",Abstraction,0.45997512,"abstraction, structure, type, feature, repetition, segment, encapsulation, hierarchy, design, variable","[('Abstraction', 0.45997512), ('Inheritance', 0.40147367), ('Design', 0.1385512)]"
315.0,The code is structured very well with good use of additional superclasses and extensions. The addition of ENUMS improves the code maintainability. ,28,2,"['code', 'superclass', 'extension', 'addition', 'enum', 'code', 'maintainability']",Inheritance,0.72373223,"hierarchy, superclass, reusability, encapsulation, maintainability, functionality, subclass, variable, extensibility, type","[('Inheritance', 0.72373223), ('Abstraction', 0.13813394), ('Design', 0.13813382)]"
21.0,The code is structured very well with good use of classes and modularisation. The addition of predator and prey classes is good and pushing common methods to superclasses makes for clean and extensible code.,28,2,"['code', 'class', 'modularisation', 'addition', 'class', 'superclass', 'code']",Inheritance,0.6665927,"hierarchy, superclass, reusability, encapsulation, maintainability, functionality, subclass, variable, extensibility, type","[('Inheritance', 0.6665927), ('Design', 0.1667039), ('Abstraction', 0.1667034)]"
212.0,The code is reasonably well structured with good use of encapsulation and modularity. The code would benefit from adding Predator and Prey subclasses. The use of the Location class is elegant and improves scalability,28,2,"['code', 'encapsulation', 'code', 'subclass', 'location', 'class', 'elegant', 'scalability']",Inheritance,0.7229405,"hierarchy, superclass, reusability, encapsulation, maintainability, functionality, subclass, variable, extensibility, type","[('Inheritance', 0.7229405), ('Abstraction', 0.13875555), ('Design', 0.1383039)]"
550.0,The code is well structured and shows a good understanding of classes and inheritance. The Time class is an elegant addition. The code would benefit with a Predator and Prey class to help with encapsulating common code across animals. ,28,2,"['code', 'understanding', 'class', 'class', 'addition', 'code', 'class', 'help', 'code']",Inheritance,0.33333334,"hierarchy, superclass, reusability, encapsulation, maintainability, functionality, subclass, variable, extensibility, type","[('Inheritance', 0.33333334), ('Design', 0.33333334), ('Abstraction', 0.33333334)]"
407.0,"The code is structured very well with good use of encapsulation and inheritance. The use of enums for Gender, etc. is ",28,2,"['code', 'encapsulation', 'enum', 'gender']",Inheritance,0.66546184,"hierarchy, superclass, reusability, encapsulation, maintainability, functionality, subclass, variable, extensibility, type","[('Inheritance', 0.66546184), ('Abstraction', 0.16775452), ('Design', 0.16678365)]"
497.0,The code is structured very well with a good display of knowledge on encapsulation and inheritance. The student uses abstract classes effectively to further enforce extensibility. ,28,2,"['code', 'display', 'encapsulation', 'class', 'extensibility']",Design,0.43160865,"design, variable, implementation, extensibility, core, hierarchy, encapsulation, structure, type, repetition","[('Design', 0.43160865), ('Inheritance', 0.42934352), ('Abstraction', 0.13904782)]"
271.0,The student shows a good understanding of code structuring with good use of inheritance and abstraction. The inclusion of predator and prey classes is clean and appropriate for encapsulation. The time and weather classes also improve dependency management. ,28,2,"['understanding', 'code', 'abstraction', 'inclusion', 'class', 'encapsulation', 'class', 'dependency', 'management']",Inheritance,0.48887405,"hierarchy, superclass, reusability, encapsulation, maintainability, functionality, subclass, variable, extensibility, type","[('Inheritance', 0.48887405), ('Abstraction', 0.37075695), ('Design', 0.14036904)]"
