assignment_number,comments,participant_id,batch,processed_text,Dominant_Topic,Perc_Contribution,Topic_Keywords,All_Topics
18.0,"The core requirements like having 5+ species with predators, prey, plants, gender, and day/night behavior seem met based on the code. The challenge mission was completed well.",15,1,"['core', 'species', 'code', 'challenge', 'mission']",Code/Compilation,0.467242,"code, program, compile, error, standard, function, submission, implementation, extension, core","[('Code/Compilation', 0.467242), ('Core Tasks', 0.39400938), ('Extension Tasks', 0.13874862)]"
620.0,"Excellent work on completing all core and challenge tasks. The simulation includes at least 5 acting species (Jaguar, Lion, Cheetah, Gazelle, Zebra), with at least 2 predators (Jaguar, Lion, Cheetah) and 2 non-predators (Gazelle, Zebra). The Lion and Cheetah compete for Gazelles as a shared food source. The species distinguish males and females, requiring them to meet to propagate. Time of day is tracked, with some behaviors differing between day and night. The graphical interface  is impressive! I like the useful buttons provided, especially the ""Reset"" button to easily restart the simulation.",15,1,"['core', 'challenge', 'task', 'gazelle', 'interface', 'button', 'button']",Core Tasks,0.6666237,"core, standard, implementation, program, compile, submission, code, extension, function, error","[('Core Tasks', 0.6666237), ('Extension Tasks', 0.16669631), ('Code/Compilation', 0.16667996)]"
466.0,"The core requirements like having 5+ species with predators, prey, plants, gender, and day/night behavior seem met based on the code. The challenge mission was completed well.",15,1,"['core', 'species', 'code', 'challenge', 'mission']",Code/Compilation,0.46724135,"code, program, compile, error, standard, function, submission, implementation, extension, core","[('Code/Compilation', 0.46724135), ('Core Tasks', 0.39400932), ('Extension Tasks', 0.13874932)]"
591.0,"The core requirements appear to be mostly implemented based on the code. The simulation includes at least 5 acting species (Wolf, Hawk, Squirrel, Chicken, Frog), with 2 predators (Wolf, Hawk) and 3 non-predators (Squirrel, Chicken, Frog). The Wolf and Hawk compete for Squirrels and Chickens as shared food sources. The species distinguish males and females, requiring them to meet to propagate. Time of day is tracked in hours. The requirements also mention creatures exhibiting different behavior depending on time of day, such as sleeping at night. The time tracking logic is there, but it isn't being used to modify behavior yet.",15,1,"['core', 'code', 'squirrel', 'chicken', 'frog', 'squirrel', 'chicken', 'hour', 'creature', 'logic', 'modify']",Code/Compilation,0.467242,"code, program, compile, error, standard, function, submission, implementation, extension, core","[('Code/Compilation', 0.467242), ('Core Tasks', 0.39400938), ('Extension Tasks', 0.13874862)]"
587.0,"Excellent work on completing all core and challenge tasks. Your implementation of the simulation, including at least five different kinds of acting species, competition for food sources, and the distinction of gender for breeding purposes, demonstrates a deep understanding of the project requirements. The addition of day/night cycles and weather effects further enriches the simulation's complexity and realism.",15,1,"['core', 'challenge', 'task', 'implementation', 'kind', 'competition', 'distinction', 'purpose', 'understanding', 'project', 'cycle', 'complexity', 'realism']",Core Tasks,0.7195887,"core, standard, implementation, program, compile, submission, code, extension, function, error","[('Core Tasks', 0.7195887), ('Extension Tasks', 0.14021331), ('Code/Compilation', 0.14019798)]"
50.0,"Excellent work on completing all the core tasks and implementing several challenge tasks! The simulation includes at least 5 acting species (Bird, Grass, Frog, GrassHopper, Snake, Hawk, Caterpillar) with multiple predators (Bird, Frog, Snake, Hawk) and non-predators (GrassHopper, Caterpillar). Birds and Frogs compete for GrassHoppers and Caterpillars as shared food sources. The species distinguish males and females, requiring them to meet to propagate. Time of day is tracked, with sleeping behavior differing based on time. Weather effects are impressively modeled - ponds can dynamically generate and evaporate based on rainy or sunny conditions. Plant growth is also tied to weather.",15,1,"['core', 'task', 'challenge', 'task', 'bird', 'frog', 'snake', 'bird', 'frog', 'grasshopper', 'pond', 'evaporate', 'condition']",Core Tasks,0.66662335,"core, standard, implementation, program, compile, submission, code, extension, function, error","[('Core Tasks', 0.66662335), ('Extension Tasks', 0.16669662), ('Code/Compilation', 0.16668005)]"
655.0,"All base tasks are completed, with at least five different acting species (Zebra, Giraffe, Lemur, Lion, Cheetah), including two predators (Lion, Cheetah) and non-predators. The Lion and Cheetah compete for the same food sources. Genders are distinguished and creatures can only propagate when a male and female meet. Time of day is tracked and some creatures exhibit different behaviors at night. The student also implemented weather as a challenge task which influences animal behavior.",15,1,"['task', 'acting', 'creature', 'creature', 'challenge', 'task', 'influence']",Core Tasks,0.33333334,"core, standard, implementation, program, compile, submission, code, extension, function, error","[('Core Tasks', 0.33333334), ('Extension Tasks', 0.33333334), ('Code/Compilation', 0.33333334)]"
47.0,"The simulation appears to be working as described in the assignment. All base tasks are completed, including at least 5 acting species (Tiger, Lion, Hyena, Antelope, Zebra), with at least 2 predators (Tiger, Lion, Hyena) and 2 non-predators (Antelope, Zebra). Tigers and Lions compete for Antelopes as a shared food source. The species distinguish males and females, requiring them to meet to propagate. Time of day is tracked, with some behaviors differing between day and night (e.g. some animals sleep at night). Multiple challenging extension tasks were implemented as well, including plants that grow and can be eaten by some animals, weather that changes and impacts animal behavior and plant growth, and disease that can spread between animals. The graphical simulation interface looks great and provides useful stats.",15,1,"['task', 'tiger', 'zebra', 'tiger', 'zebra', 'lion', 'antelope', 'extension', 'task', 'impact', 'interface', 'stat']",Extension Tasks,0.66664845,"extension, submission, function, program, standard, code, implementation, error, core, compile","[('Extension Tasks', 0.66664845), ('Core Tasks', 0.16667682), ('Code/Compilation', 0.16667472)]"
262.0,"The core requirements like having 5+ species with predators, prey, plants, gender, and day/night behavior seem met based on the code. The challenge mission was completed well.",15,1,"['core', 'species', 'code', 'challenge', 'mission']",Code/Compilation,0.46724105,"code, program, compile, error, standard, function, submission, implementation, extension, core","[('Code/Compilation', 0.46724105), ('Core Tasks', 0.39400974), ('Extension Tasks', 0.13874914)]"
2.0,"Excellent work on completing all core and challenge tasks. Your implementation of the simulation, including at least five different kinds of acting species, competition for food sources, and the distinction of gender for breeding purposes, demonstrates a deep understanding of the project requirements. But the Fox and Rabbit was not replaced with different kinds of predators and prey in the basic mission. The addition of day/night cycles and weather effects further enriches the simulation's complexity and realism.",15,1,"['core', 'challenge', 'task', 'implementation', 'kind', 'competition', 'distinction', 'purpose', 'understanding', 'project', 'fox', 'kind', 'mission', 'cycle', 'complexity', 'realism']",Core Tasks,0.7195887,"core, standard, implementation, program, compile, submission, code, extension, function, error","[('Core Tasks', 0.7195887), ('Extension Tasks', 0.14021331), ('Code/Compilation', 0.14019798)]"
400.0,"The simulation meets all the core requirements as outlined in the assignment. It includes at least 5 acting species (Lynx, Wolf, Deer, Hamster, Plant), with Lynx and Wolf as predators and Deer and Hamster as non-predators. The Lynx and Wolf compete for Deer as a shared food source. The species distinguish males and females which must meet to propagate. Time of day is tracked, with nocturnal vs diurnal behavior for different species.

In addition, several challenge tasks were implemented to a high standard, demonstrating originality and technical excellence. Weather effects impact animal breeding and plant growth. Diseases like WolfFlu and AnimalFlu can infect animals and spread between them.",15,1,"['core', 'lynx', 'wolf', 'wolf', 'challenge', 'task', 'demonstrating', 'originality']",Core Tasks,0.6666237,"core, standard, implementation, program, compile, submission, code, extension, function, error","[('Core Tasks', 0.6666237), ('Extension Tasks', 0.16669631), ('Code/Compilation', 0.16667996)]"
525.0,"The core simulation tasks appear to be completed. There are at least 5 acting species (Shark, Piranha, Salmon, Sardine, Seaweed, Shivamfish) with predators and non-predators. Sharks and Piranhas compete for some shared prey. The species distinguish male and female individuals for breeding. Time of day is tracked and influences behaviors. However, the weather and disease extension tasks do not appear to be fully implemented. The GUI displays the simulation but does not visually distinguish between animal types.",15,1,"['core', 'task', 'shark', 'salmon', 'sardine', 'individual', 'influence', 'extension', 'task', 'gui', 'display', 'type']",Extension Tasks,0.4658247,"extension, submission, function, program, standard, code, implementation, error, core, compile","[('Extension Tasks', 0.4658247), ('Core Tasks', 0.39551315), ('Code/Compilation', 0.13866216)]"
358.0,"All of the base tasks are completed - the simulation has at least 5 species (rabbits, foxes, plants, squirrels, nuts, vultures, mice). Males and females are distinguished, requiring them to meet to propagate. Time of day is tracked, with some creatures like rabbits and squirrels unable to move at night. However, a few details are missing - the original Fox and Rabbit classes were used rather than being replaced by different predator/prey species as specified. No challenge tasks like weather or disease simulation were attempted.",15,1,"['task', 'species', 'fox', 'vulture', 'mice', 'creature', 'move', 'detail', 'fox', 'challenge', 'task']",Core Tasks,0.33333334,"core, standard, implementation, program, compile, submission, code, extension, function, error","[('Core Tasks', 0.33333334), ('Extension Tasks', 0.33333334), ('Code/Compilation', 0.33333334)]"
137.0,"All core tasks are completed - there are at least 5 acting species (Lion, Leopard, Zebra, Camel, Antelope), with Lions and Leopards as predators competing for the same prey. The species distinguish males and females and require them to meet to propagate. Time of day is tracked, with some creatures exhibiting different behavior at night (Lions and Leopards sleep from 10pm-10am).

Multiple challenge tasks are also implemented, including disease spread, weather that impacts behavior, and a nicely formatted graphical view showing key stats. ",15,1,"['core', 'task', 'camel', 'lion', 'leopard', 'creature', 'lion', 'leopard', 'pm', 'challenge', 'task', 'spread', 'impact', 'view', 'stat']",Core Tasks,0.66662335,"core, standard, implementation, program, compile, submission, code, extension, function, error","[('Core Tasks', 0.66662335), ('Extension Tasks', 0.16669664), ('Code/Compilation', 0.16668004)]"
125.0,"The simulation appears to be working correctly based on the requirements. It includes at least 5 acting species (Lion, Hyena, Zebra, Hippo, Antelope), with Lions and Hyenas as predators competing for Zebras, and Zebras, Hippos, and Antelopes as non-predator species. The species distinguish males and females and can only breed when they meet. The time of day is tracked and impacts breeding behavior. Plants (grass) are also simulated and grow at different rates based on weather. Earthquakes and disease spread are implemented as challenge tasks. ",15,1,"['lion', 'hyena', 'zebra', 'impact', 'rate', 'earthquake', 'challenge', 'task']",Core Tasks,0.33333334,"core, standard, implementation, program, compile, submission, code, extension, function, error","[('Core Tasks', 0.33333334), ('Extension Tasks', 0.33333334), ('Code/Compilation', 0.33333334)]"
58.0,"It has at least 5 species (Zebra, Antelope, WildDog, Lion, Tiger), with predators like Lions and Tigers competing for prey like Antelopes. The species seem to distinguish males and females for breeding. Time of day is tracked to influence behaviors. However, Only some challenge tasks like adding plants is finished.",15,1,"['wilddog', 'lion', 'tiger', 'lion', 'tiger', 'antelope', 'influence', 'task']",Core Tasks,0.33333334,"core, standard, implementation, program, compile, submission, code, extension, function, error","[('Core Tasks', 0.33333334), ('Extension Tasks', 0.33333334), ('Code/Compilation', 0.33333334)]"
353.0,"The simulation includes at least 5 acting species (Hare, Wolf, Cow, Bear, Deer), with wolves and bears as predators and hares, cows, and deer as non-predators. Wolves and bears compete for some of the same food sources. The species distinguish males and females, requiring them to meet to propagate. Time of day is tracked, with hares moving and feeding during the day but only giving birth at night.",15,1,"['bear', 'deer', 'wolf', 'bear', 'hare', 'wolf', 'bear', 'hare', 'feeding', 'birth']",Core Tasks,0.33333334,"core, standard, implementation, program, compile, submission, code, extension, function, error","[('Core Tasks', 0.33333334), ('Extension Tasks', 0.33333334), ('Code/Compilation', 0.33333334)]"
422.0,"All core tasks are completed, with at least 5 acting species (Wolf, Sheep, Snake, Rhizomys, Elephant), including predators (Wolf, Snake) and non-predators (Sheep, Rhizomys, Elephant). The Wolf and Snake compete for Sheep and Rhizomys as shared food sources. The species distinguish males and females, requiring them to meet to propagate. Time of day is tracked, with some behaviors likely differing between day and night. Challenge tasks like adding plants (Bamboo, Grass), weather, and disease are also implemented. ",15,1,"['core', 'task', 'snake', 'rhizomys', 'elephant', 'rhizomys', 'elephant', 'sheep', 'rhizomys', 'challenge', 'task', 'bamboo']",Core Tasks,0.6666238,"core, standard, implementation, program, compile, submission, code, extension, function, error","[('Core Tasks', 0.6666238), ('Extension Tasks', 0.16669631), ('Code/Compilation', 0.16667996)]"
480.0,"The core requirements are mostly implemented, with at least 5 species (Wolf, Rabbit, Bear, Tiger, Deer) including predators and non-predators. The provided rabbit was not replaced with other animals. Wolves and tigers compete for rabbits. The species distinguish males and females that must meet to breed. Time of day is tracked and influences animal behavior. None of the challenge tasks like adding plants, weather or disease appear to be attempted. ",15,1,"['core', 'tiger', 'deer', 'wolf', 'tiger', 'influence', 'none', 'challenge', 'task']",Core Tasks,0.6666237,"core, standard, implementation, program, compile, submission, code, extension, function, error","[('Core Tasks', 0.6666237), ('Extension Tasks', 0.16669631), ('Code/Compilation', 0.16667996)]"
334.0,"The application works as described in the assignment and all base and challenge tasks are completed. The simulation includes at least 5 acting species (Hyena, Mouse, Snake, Bat, Falcon), with at least 2 predators (Hyena, Snake, Falcon) and 2 non-predators (Mouse, Bat). The Hyena and Snake compete for Mice as a shared food source. The species distinguish males and females, requiring them to meet to propagate. Time of day is tracked, with some behaviors differing between day and night (e.g. sleeping at night). Plants (Flower, Grass) are simulated and grow at a given rate. Weather (Rain, Snow, Sun) changes and influences behaviors. Disease can spread between animals. ",15,1,"['challenge', 'task', 'falcon', 'mouse', 'flower', 'rate', 'rain', 'snow', 'sun', 'change', 'influence']",Core Tasks,0.33333334,"core, standard, implementation, program, compile, submission, code, extension, function, error","[('Core Tasks', 0.33333334), ('Extension Tasks', 0.33333334), ('Code/Compilation', 0.33333334)]"
160.0,"The application works as described in the assignment, although some minor issues have been encountered in the application.",24,1,[],Core Tasks,0.33333334,"core, standard, implementation, program, compile, submission, code, extension, function, error","[('Core Tasks', 0.33333334), ('Extension Tasks', 0.33333334), ('Code/Compilation', 0.33333334)]"
473.0,The application works as described in the assignment; all submission instructions were followed correctly.,24,1,"['submission', 'instruction']",Extension Tasks,0.66661036,"extension, submission, function, program, standard, code, implementation, error, core, compile","[('Extension Tasks', 0.66661036), ('Core Tasks', 0.16669756), ('Code/Compilation', 0.16669205)]"
624.0,Minor details of a rask are violated; the application functions correctly on the majority of actions.,24,1,"['detail', 'function', 'majority', 'action']",Extension Tasks,0.6665767,"extension, submission, function, program, standard, code, implementation, error, core, compile","[('Extension Tasks', 0.6665767), ('Core Tasks', 0.16671428), ('Code/Compilation', 0.166709)]"
311.0,The application functions incorrectly on some inputs/actions.,24,1,"['function', 'action']",Extension Tasks,0.66657674,"extension, submission, function, program, standard, code, implementation, error, core, compile","[('Extension Tasks', 0.66657674), ('Core Tasks', 0.16671428), ('Code/Compilation', 0.166709)]"
105.0,The application functions incorrectly on some inputs/actions.,24,1,"['function', 'action']",Extension Tasks,0.6665767,"extension, submission, function, program, standard, code, implementation, error, core, compile","[('Extension Tasks', 0.6665767), ('Core Tasks', 0.1667143), ('Code/Compilation', 0.166709)]"
654.0,The application functions incorrectly on some inputs/actions.,24,1,"['function', 'action']",Extension Tasks,0.66657674,"extension, submission, function, program, standard, code, implementation, error, core, compile","[('Extension Tasks', 0.66657674), ('Core Tasks', 0.1667143), ('Code/Compilation', 0.166709)]"
79.0,"All tasks completed, however, weather could have been implemented using the enum class. ",24,1,"['task', 'enum']",Core Tasks,0.33333334,"core, standard, implementation, program, compile, submission, code, extension, function, error","[('Core Tasks', 0.33333334), ('Extension Tasks', 0.33333334), ('Code/Compilation', 0.33333334)]"
45.0,"Challenge tasks are implemented, however basic tasks such as having plants are not implemented",24,1,"['challenge', 'task', 'task']",Core Tasks,0.33333334,"core, standard, implementation, program, compile, submission, code, extension, function, error","[('Core Tasks', 0.33333334), ('Extension Tasks', 0.33333334), ('Code/Compilation', 0.33333334)]"
51.0,Significant details of task are violated,24,1,"['detail', 'task']",Core Tasks,0.33333334,"core, standard, implementation, program, compile, submission, code, extension, function, error","[('Core Tasks', 0.33333334), ('Extension Tasks', 0.33333334), ('Code/Compilation', 0.33333334)]"
523.0,"The application works as described, all tasks are completed and technical excellence. ",24,1,"['task', 'excellence']",Core Tasks,0.33333334,"core, standard, implementation, program, compile, submission, code, extension, function, error","[('Core Tasks', 0.33333334), ('Extension Tasks', 0.33333334), ('Code/Compilation', 0.33333334)]"
410.0,"All base tasks are completed and some of the challenging tasks are done, however, the simulator doesn't run correctly.",24,1,"['task', 'task', 'simulator']",Core Tasks,0.33333334,"core, standard, implementation, program, compile, submission, code, extension, function, error","[('Core Tasks', 0.33333334), ('Extension Tasks', 0.33333334), ('Code/Compilation', 0.33333334)]"
490.0,"There are minor errors in the code, and no challenge task was attempted.",24,1,"['error', 'code', 'challenge', 'task']",Code/Compilation,0.7185459,"code, program, compile, error, standard, function, submission, implementation, extension, core","[('Code/Compilation', 0.7185459), ('Extension Tasks', 0.14075603), ('Core Tasks', 0.14069808)]"
124.0,There are minor errors in the application; all base tasks are completed; and challenges tasks are also completed.,24,1,"['error', 'task', 'challenge', 'task']",Code/Compilation,0.6662771,"code, program, compile, error, standard, function, submission, implementation, extension, core","[('Code/Compilation', 0.6662771), ('Extension Tasks', 0.1669146), ('Core Tasks', 0.1668083)]"
77.0,"The application crashes until a certain point. All the base tasks were completed, challenge task was attempted.",24,1,"['point', 'task', 'challenge', 'task']",Core Tasks,0.33333334,"core, standard, implementation, program, compile, submission, code, extension, function, error","[('Core Tasks', 0.33333334), ('Extension Tasks', 0.33333334), ('Code/Compilation', 0.33333334)]"
252.0,The application works as described in the assignment; all base tasks are completed;,24,1,['task'],Core Tasks,0.33333334,"core, standard, implementation, program, compile, submission, code, extension, function, error","[('Core Tasks', 0.33333334), ('Extension Tasks', 0.33333334), ('Code/Compilation', 0.33333334)]"
236.0,The file StatisticsView does not compile,24,1,"['file', 'compile']",Code/Compilation,0.6665548,"code, program, compile, error, standard, function, submission, implementation, extension, core","[('Code/Compilation', 0.6665548), ('Extension Tasks', 0.16673598), ('Core Tasks', 0.16670917)]"
549.0,The application works as described in the assignment; all base tasks are completed; the student has completed some of the challenge tasks.,24,1,"['task', 'challenge', 'task']",Core Tasks,0.33333334,"core, standard, implementation, program, compile, submission, code, extension, function, error","[('Core Tasks', 0.33333334), ('Extension Tasks', 0.33333334), ('Code/Compilation', 0.33333334)]"
10.0,"The application compiles, but when running the simulator it doesn't work, looks like it crashes.",24,1,"['compile', 'simulator', 'crash']",Code/Compilation,0.6665548,"code, program, compile, error, standard, function, submission, implementation, extension, core","[('Code/Compilation', 0.6665548), ('Extension Tasks', 0.16673599), ('Core Tasks', 0.16670918)]"
292.0,The application works as described in the assignment; all base tasks are completed; all submission instructions were followed correctly.,24,1,"['task', 'submission', 'instruction']",Extension Tasks,0.6666104,"extension, submission, function, program, standard, code, implementation, error, core, compile","[('Extension Tasks', 0.6666104), ('Core Tasks', 0.16669756), ('Code/Compilation', 0.16669205)]"
451.0,Cannot open the project in BlueJ. Error: No Java source files were found in this directory,24,1,"['project', 'error', 'file', 'directory']",Code/Compilation,0.66627705,"code, program, compile, error, standard, function, submission, implementation, extension, core","[('Code/Compilation', 0.66627705), ('Extension Tasks', 0.16691458), ('Core Tasks', 0.1668083)]"
217.0,The student has completed all baseline tasks to a good level. Some challenges have been implemented with plants and weather effects on agents. The challenge additions are relatively simple but are implemented competently,28,2,"['task', 'challenge', 'agent']",Core Tasks,0.33333334,"core, standard, implementation, program, compile, submission, code, extension, function, error","[('Core Tasks', 0.33333334), ('Extension Tasks', 0.33333334), ('Code/Compilation', 0.33333334)]"
623.0,"All baseline requirements have been met to a good standard with appropriate predators and prey, breeding and time of day behaviours. The student has implemented plants as a challenge extension ",28,2,"['challenge', 'extension']",Extension Tasks,0.66664845,"extension, submission, function, program, standard, code, implementation, error, core, compile","[('Extension Tasks', 0.66664845), ('Core Tasks', 0.16667682), ('Code/Compilation', 0.16667473)]"
315.0,The student has met all baseline requirements to a high standard. The student also implemented challenge additions such as plants and weather. The additions have been implemented well with good encapsulation and extensibility,28,2,"['standard', 'challenge', 'encapsulation', 'extensibility']",Core Tasks,0.6666097,"core, standard, implementation, program, compile, submission, code, extension, function, error","[('Core Tasks', 0.6666097), ('Extension Tasks', 0.16670488), ('Code/Compilation', 0.16668539)]"
21.0,The student has implemented all baseline tasks to a good standard and have also implemented extensions such as weather and plants. The simulations once instantiated unfortunately terminate very quickly which some parameter tweaking  would fix,28,2,"['task', 'standard', 'extension', 'parameter', 'tweaking']",Core Tasks,0.48943332,"core, standard, implementation, program, compile, submission, code, extension, function, error","[('Core Tasks', 0.48943332), ('Extension Tasks', 0.37080565), ('Code/Compilation', 0.13976103)]"
