skill,comments,count
Correctness,"the application works. base tasks completed. 2 challenge tasks attempted (plants, weather). plants implemented as an animal.",1
Correctness,"the application works. base tasks completed. 2 challenge tasks attempted (plants, weather). some gui work: repositioning, dark bg for night",1
Correctness,"the application works. base tasks completed. 2 challenge tasks attempted (plants, weather). weather only partially implemented as rain. potentially a 3rd attempted as hunger levels.",1
Correctness,"the application works. base tasks completed. 2 challenge tasks attempted (weather, disease). ",1
Correctness,"the application works. base tasks completed. 3 challenge tasks attempted (plants, disease, weather). however, plant implemented as an animal. ",1
Correctness,"the application works. base tasks completed. 3 challenge tasks attempted (plants, weather, disease). ",1
Correctness,"the application works. base tasks completed. 3 challenge tasks attempted (plants, weather, disease). (submission folder was made incorrectly)",1
Correctness,"the application works. base tasks completed. 3 challenge tasks attempted (plants, weather, disease). disease has been done for a plant rather than animals.",1
Correctness,"the application works. base tasks completed. 3 challenge tasks attempted (plants, weather, disease). some extra work done on gui.",1
Correctness,"the application works. base tasks completed. 3 challenge tasks attempted (plants, weather, disease). some extra work done with gui menu bar.",1
Correctness,"the application works. base tasks completed. 3 challenge tasks attempted (plants, weather, disease). some gui buttons added.",1
Correctness,"the application works. base tasks completed. 3 challenge tasks attempted (plants, weather, disease). very creative with the buttons on the gui and checkboxes for environment factors. (although some buttons don't seem to work and no disease is spread).",1
Correctness,"the application works. base tasks completed. 3 challenge tasks attempted (plants, weather, disease, temperature). excellent creative work on gui and ability to customise the environment. some errors appearing.",1
Correctness,"the application works. base tasks completed. 3 challenge tasks attempted (plants, weather, hunger level). ",1
Correctness,"the application works. base tasks completed. 3 challenge tasks attempted (plants, weather, seasons). creativity and technical excellence in graph.",1
Correctness,"the application works. base tasks completed. 3 challenge tasks attempted (plants, weather, water). graph does not appear to work.",1
Correctness,"the application works. base tasks completed. 4 challenge tasks attempted (plants, disease, weather, defence). ",1
Correctness,"the application works. base tasks completed. 4 challenge tasks attempted (plants, disease, weather, types of animals). ",1
Correctness,"the application works. base tasks completed. 4 challenge tasks attempted (plants, disease, weather, water). ",1
Correctness,"the application works. base tasks completed. 4 challenge tasks attempted (plants, weather, temperature, earthquake). ",1
Correctness,the base task where new animals are created based on whether they are male or female is not met. only the weather additional feature is added.,1
Correctness,the baseline requirements are implemented to a good standard. extensions such as weather and plants are also included. the student shows creativity by influencing plant growth rate by weather behaviours.  ,1
Correctness,"the baseline requirements have been implemented to a competent level. some challenge extensions are implemented including disease spread, weather, and plants. the disease spread is very basic and the agents are very homogenous. however, the weather system is implemented well. the simulator only runs for 24 ticks on the majority of occasions",1
Correctness,"the baseline tasks are completed to an acceptable level. however, although some code is implemented for disease spread and propagation, this code is never called during program execution and is therefore not implemented correctly. ",1
Correctness,the baseline tasks are implemented to a very high standard. plants are implemented as a challenge task. no other extensions were attempted.,1
Correctness,the baseline tasks are implemented to an acceptable level however som bugs remain. the simulation consistently reaches a steady state where only plants survive. this appears to be related to an error in the propagation method of the animal classes. see bread() for the lion class where there is an instance check for whether the mating organism is a jay. challenge extensions have been implemented well with dynamic weather and disease influencing agent behaviours,1
Correctness,the basic function is fine. the challenges implemented have some bugs.,1
Correctness,the bluej package would not load,1
Correctness,"the code add the conception of  organism and corpse. it creates a new corpse at a location in field, after an organism has died, which decomposes over time. however, after 600 steps, only seagrass is left, which indicates the code may have logical or parameter setting problems. ",1
Correctness,"the code appears to implement the core requirements including at least 5 species (hyena, warthog, lion, meerkat, insect), with predators (hyena, lion) and non-predators (warthog, meerkat). lions and hyenas compete for warthogs as prey. animals have genders and can only breed when male and female meet. time of day is tracked and some creatures like lions have different sleeping behaviors. however, i was unable to fully verify the program's execution as no window appeared when running the simulation.",1
Correctness,"the code completes all base tasks correctly and add weather, grass, hunter task, which are also finished well.",1
Correctness,"the code contains at least 5 animal classes. at least 2 of them do not fight for any resource, while at least 2 of them fight for the same resource. when animals give birth, they need to be a combination between a male and a female. however, the code does not keep track of the time of the day for the animals to react differently. challenges added: disease.",1
Correctness,"the code contains at least 5 animals. at least 2 of them fight for the same resource, while at least 2 of them eat only plants. some of the animals act differently between day and night, while breeding depends on different genders. challenges added: plants + different weather behaviour + disease. the fourth additional aspect does not work properly on bluej.",1
Correctness,"the code did not run in bluej. 

the following error is generated

java.lang.assertionerror: null location passed to adjacentlocations
	at field.adjacentlocations(field.java:162)
	at simulator.simulateonestep(simulator.java:145)
	at simulator.simulate(simulator.java:118)",1
Correctness,the code ends up with the death of all animals and only the plant is still left.,1
Correctness,"the code finishes the base task and add weather as the challenge task. however, after running the simulation for 650 steps, it is counter-intuitive that it only left porcupine and all other animals are all dead.",1
Correctness,"the code introduces 5 animals - hawk, chicken, squirrel, wolf and frog and add season factor as the challenge task. however, only squirrel left at the end of simulation.",1
Correctness,the code runs perfectly but in the end although the grass count is zero some grass can be seen in the simulator screen,1
Correctness,"the core requirements appear to be mostly implemented based on the code. the simulation includes at least 5 acting species (wolf, hawk, squirrel, chicken, frog), with 2 predators (wolf, hawk) and 3 non-predators (squirrel, chicken, frog). the wolf and hawk compete for squirrels and chickens as shared food sources. the species distinguish males and females, requiring them to meet to propagate. time of day is tracked in hours. the requirements also mention creatures exhibiting different behavior depending on time of day, such as sleeping at night. the time tracking logic is there, but it isn't being used to modify behavior yet.",1
Correctness,"the core requirements are mostly implemented, with at least 5 species (wolf, rabbit, bear, tiger, deer) including predators and non-predators. the provided rabbit was not replaced with other animals. wolves and tigers compete for rabbits. the species distinguish males and females that must meet to breed. time of day is tracked and influences animal behavior. none of the challenge tasks like adding plants, weather or disease appear to be attempted. ",1
Correctness,"the core simulation tasks appear to be completed. there are at least 5 acting species (shark, piranha, salmon, sardine, seaweed, shivamfish) with predators and non-predators. sharks and piranhas compete for some shared prey. the species distinguish male and female individuals for breeding. time of day is tracked and influences behaviors. however, the weather and disease extension tasks do not appear to be fully implemented. the gui displays the simulation but does not visually distinguish between animal types.",1
Correctness,the file statisticsview does not compile,1
Correctness,the implementation is good but not distinguishable. different animals/fishes do not have different color so difficult to comprehend.,1
Correctness,"the provided code does not compile successfully due to a missing rabbit class. the code references a rabbit class, but only a rat class is present in the provided files. this is a significant correctness issue that prevents the program from running.",1
Correctness,"the simulation appears to be working as described in the assignment. all base tasks are completed, including at least 5 acting species (tiger, lion, hyena, antelope, zebra), with at least 2 predators (tiger, lion, hyena) and 2 non-predators (antelope, zebra). tigers and lions compete for antelopes as a shared food source. the species distinguish males and females, requiring them to meet to propagate. time of day is tracked, with some behaviors differing between day and night (e.g. some animals sleep at night). multiple challenging extension tasks were implemented as well, including plants that grow and can be eaten by some animals, weather that changes and impacts animal behavior and plant growth, and disease that can spread between animals. the graphical simulation interface looks great and provides useful stats.",1
Correctness,"the simulation appears to be working as described in the assignment. all core tasks are completed - there are 5 acting species (wolf, lion, leopard, sheep, horse), with wolves, lions and leopards as predators and sheep and horses as non-predators. wolves and leopards compete for sheep and horses as shared food sources. males and females are distinguished and must meet to breed. time of day is tracked and affects behavior. some challenge tasks like weather and plants are also implemented. however, it seems the disease challenge task was not attempted.",1
Correctness,"the simulation appears to be working as described in the assignment. all core tasks are completed - there are 5 different acting species (antelope, crocodile, elephant, lion, giraffe), with lions and crocodiles as predators competing for antelopes, and elephants, giraffes and antelopes as non-predators. males and females are distinguished and creatures only propagate when a male and female meet. time of day is tracked and some creatures exhibit different behavior at certain times, like sleeping at night.

in addition, several impressive challenge tasks have been implemented, demonstrating technical excellence and creativity. this includes simulating plants that grow and are eaten, changing weather that influences behavior, and diseases that can infect and spread between animals. ",1
Correctness,"the simulation appears to be working as described in the assignment. all core tasks are completed, including at least 5 acting species (shark, sealion, penguin, salmon, krill), with at least 2 predators (shark, sealion) and 2 non-predators (penguin, salmon). the shark and sealion compete for penguins as a shared food source. the species distinguish males and females, requiring them to meet to propagate. time of day is tracked, with animal behavior differing between day (active) and night (sleeping). several challenge tasks are also implemented, such as plants, weather affecting temperature and animal behavior, and disease transmission between animals of the same species. ",1
Correctness,"the simulation appears to be working as described in the assignment. all core tasks have been completed, including at least 5 acting species (tiger, zebra, mouse, lion, hare), with at least 2 predators (tiger, lion) and 2 non-predators (zebra, mouse, hare). the lion and tiger compete for zebras as a shared food source. males and females are distinguished and must meet to propagate. time of day is tracked and impacts behaviors. several challenge tasks were also implemented, like adding plants (grass), weather that impacts grass growth, and disease that can spread between animals. ",1
Correctness,"the simulation appears to be working as intended based on the description in the assignment. all core tasks have been completed - there are at least 5 acting species (rat, fox, rabbit, human, cat), with rats and foxes as predators and rabbits as non-predators. the fox and cat compete for rabbits as a shared food source. the species distinguish males and females that need to meet to propagate. time of day is tracked, with some creatures like cats and foxes only acting at night.

several challenge tasks have also been implemented, demonstrating originality and technical excellence. this includes the addition of plants (grass, bushes, trees), weather that influences grass growth, and diseases like cold, cat flu and black death that spread between animals.",1
Correctness,"the simulation appears to be working correctly based on the requirements. it includes at least 5 acting species (lion, hyena, zebra, hippo, antelope), with lions and hyenas as predators competing for zebras, and zebras, hippos, and antelopes as non-predator species. the species distinguish males and females and can only breed when they meet. the time of day is tracked and impacts breeding behavior. plants (grass) are also simulated and grow at different rates based on weather. earthquakes and disease spread are implemented as challenge tasks. ",1
Correctness,the simulation finished the core and challenge task well.,1
Correctness,the simulation has 4 kinds of species but the core tasks need at least 5 species. and it finished the challenge task by adding plants and virus.,1
Correctness,"the simulation has 4 kinds of species, which did not satisfy the 5 species requirement of core tasks. the good side is that it introduces grass as challenge task.",1
Correctness,"the simulation has 5 kinds of species and it finished the challenge task by adding grass, weather and disease",1
Correctness,the simulation has 5 kinds of species and it finished the challenge task by adding human factor,1
Correctness,the simulation has 5 kinds of species and it finished the challenge task by adding weather.,1
Correctness,"the simulation has 5 kinds of species: cheeta, lion, giraffe, gazelle and zebra. it introduces grass as challenge task.",1
Correctness,the simulation has 6 kinds of species and it finished the challenge task by adding plants.,1
Correctness,"the simulation has 7 kinds of species but after simulating 700 steps, it only ends up with lake and grass. the other animals are all dead, which is a issue.",1
Correctness,the simulation has 8 kinds of species to finish the core tasks.  it finished the challenge work by adding disease.,1
Correctness,"the simulation includes at least 5 acting species (fox, rabbit, plants, vulture, nuts, squirrel, mouse), with foxes and vultures as predators, and rabbits, squirrels and mice as non-predators that eat plants/nuts. foxes and vultures compete for rabbits and squirrels as shared food sources. the species distinguish males and females which must meet to propagate. time of day is tracked, with some creatures like rabbits and squirrels not moving at night. one of the challenge tasks, adding plants, was also implemented successfully. however, one flaw is that the fox and rabbit classes from the original template were retained instead of being fully replaced by new species.",1
Correctness,"the simulation includes at least 5 acting species (hare, wolf, cow, bear, deer), with wolves and bears as predators and hares, cows, and deer as non-predators. wolves and bears compete for some of the same food sources. the species distinguish males and females, requiring them to meet to propagate. time of day is tracked, with hares moving and feeding during the day but only giving birth at night.",1
Correctness,"the simulation is working as described in the assignment, with all core tasks completed. the challenge tasks of adding plants and weather have been implemented successfully. plants grow and are eaten by some animals, and weather changes over time, influencing animal behavior and plant growth.",1
Correctness,"the simulation meets all the core requirements as outlined in the assignment. it includes at least 5 acting species (lynx, wolf, deer, hamster, plant), with lynx and wolf as predators and deer and hamster as non-predators. the lynx and wolf compete for deer as a shared food source. the species distinguish males and females which must meet to propagate. time of day is tracked, with nocturnal vs diurnal behavior for different species.

in addition, several challenge tasks were implemented to a high standard, demonstrating originality and technical excellence. weather effects impact animal breeding and plant growth. diseases like wolfflu and animalflu can infect animals and spread between them.",1
Correctness,"the simulation models 5 species and introduced the weather and grass, weather and disease for the challenge task; this work finished the core work and the challenge task.",1
Correctness,"the simulation models 6 species but all of them are shown by black squares, which is hard to distinguish them. the good side is that it introduces the weather and disease as challenge tasks. what is more, it designs a nice gui to make it user-friendly.
",1
Correctness,"the simulation models multiple species: dory, bluewhale, dophin, shark, nemo and orca. this work introduced the plants for the challenge works.",1
Correctness,"the simulation models multiple species: leopard, cheetah, impala, plant, rhino and boar but it ends up with plants after 800 steps. this work introduced the time and weather for the challenge works.",1
Correctness,"the simulation models several acting species and added the weather, plnt for the challenge task. this work finished the core work and the challenge task successfully.",1
Correctness,"the simulation models several species: antelope, cheetah, fox, hyena, lion, rabbit, zebra, which are represented by different color squares. this work finished the core work but it skipped the challenge task.",1
Correctness,"the simulation models several species: wolf, fox, rat, goat and rabbit and added the weather, plague for the challenge task. this work finished the core work and the challenge task successfully.",1
Correctness,"the simulation models several species: wolf, horse, plant, sheep, leopard and lion. the issue is that the simulation did not work well. this work finished the core work unsuccessfully and it added the plant and weather for the challenge task.",1
Correctness,the simulation runs but slows down to a snail's pace after 90 steps. after crossing a 100 it barely runs. not a useful implementation. ,1
Correctness,"the simulation should have at least five different kinds of acting species but this submission only has 4 species. after simulating 200 steps, it only ends up with hamster and the other animals are all dead, which is a issue.",1
Correctness,"the simulation works as described in the assignment and all core and challenge tasks are completed. there are at least 5 acting species including cheeta, lion, giraffe, gazelle and zebra. the cheeta and lion are predators that compete for the same food source of gazelles and zebras. genders are distinguished for the species and they can only breed when a male and female meet. the time of day is tracked, likely influencing some creature behaviors. plants are simulated and eaten by the prey animals. weather effects like rain and storms impact plant growth. disease can infect and spread between animals. ",1
Correctness,"the spawngrass() method in the grass class allows grass to grow in any adjacent gap, even if there is already grass there. this causes the grass to grow indefinitely. completed all basic requirements and some challenge tasks. however, due to parameter settings and some logical problems, the system was unable to maintain balance for a long time and eventually evolved into a single species ecosystem.",1
Correctness,the student has completed all baseline tasks to a good level. some challenges have been implemented with plants and weather effects on agents. the challenge additions are relatively simple but are implemented competently,1
Correctness,the student has gone above and beyond with implementing all requirements to an exceptional standard and adding their own unique additions such as the simulation initialiser. ,1
Correctness,the student has implemented all baseline requirements to a good standard and has added challenge tasks such as weather and plant life. including multiple types of plants shows some uniqueness.,1
Correctness,the student has implemented all baseline requirements to a high standard and has added some challenge additions such as plant life and weather based behaviours. the weather based behaviours are simple ,1
Correctness,the student has implemented all baseline requirements to a high standard. challenge extensions have been implemented including weather effects and plants (bamboo). weather affecting plant growth is a nice addition,1
Correctness,the student has implemented all baseline requirements to a high standard. challenges extensions such as plants and disease are also implemented well. predators catching diseases from prey and snakes propagating asexually shows creativity ,1
Correctness,the student has implemented all baseline tasks to a good standard and have also implemented extensions such as weather and plants. the simulations once instantiated unfortunately terminate very quickly which some parameter tweaking  would fix,1
Correctness,the student has implemented all baseline tasks to a high standard and has had fun implementing challenge additions such as adding dragons. the inclusion of time and weather based behaviours is effective (such as plants growing at different rates depending on the weather and nocturnal animals). the ui is also implemented well with colours changing based on the current weather time,1
Correctness,the student has implemented both the baseline and challenge features to a very high level. the student has shown creativity by implementing vector-borne diseases. the inclusion of weather and plants as additional extensions shows a comprehensive range of skills. ,1
Correctness,the student has implemented the baseline requirements to a good standard and has implemented challenge extensions such as weather and disease spread. the coursework instructions have been followed closely.,1
Correctness,"the student has implemented the baseline requirements to a high standard and has added challenge tasks such as infection spread, weather, and plant life. the student has shown innovation through the ui for changing model parameters ",1
Correctness,"the student has implemented the baseline tasks to a high standard and have added additional challenge tasks such as weather, plants, and disease spread. a basic ui has also been implemented with start and stop buttons which is an innovative addition",1
Correctness,the student has met all baseline requirements and has implemented some of the challenge extensions including weather-based behaviours and plants. ,1
Correctness,the student has met all baseline requirements to a high standard. the student also implemented challenge additions such as plants and weather. the additions have been implemented well with good encapsulation and extensibility,1
Correctness,the student has met all baseline tasks and has tackled challenge additions with innovation. the plantlife is interesting and the weather effects are concise but effective,1
Correctness,"the student has met all the baseline requirements and has implemented them well. the student has also implemented all challenge tasks including plants, weather, and infection spread.",1
Correctness,the student has met all the baseline requirements to a good degree. plants and weather have been added as challenge extensions. the simulation runs well and produces interesting patterns of behaviour,1
Correctness,the student has submitted the original task code unmodified with no extensions,1
Correctness,"the student implemented a creative and highly competent model fulfilling all baseline requirements and challenge tasks. the extensions made to the model are impressive and implemented well. the time-of-day implementation is somewhat basic, using a day/night system, however, the impact of this on agent behaviour is impactful.",1
Correctness,the student implemented all baseline requirements to a good standard. one challenge extensions was added in the form of basic infection spread. ,1
Correctness,the submission does not cover any of the requirements in the coursework.,1
Correctness,"the submission finishes all base and challenge tasks correctly. what is more, it designs a simple gui for an enhanced user experience.",1
