skill,comments,count
Code Elegance,"effective use of object-oriented principles, easy maintainability and reusability.",38
Code Elegance,"methods are reusable and readable, but some code repetition",13
Code Elegance,the design could have been better.,13
Code Elegance,"it is good, though there are little problems here and there.",11
Code Elegance,solid implementation of both core and challenge classes. very appropriate approaches taken.,11
Code Elegance,the code is well written but could provide better reusability by moving more shared variables and functions up the inheritance tree.,11
Code Elegance,the code have a good use of classed and functions and nicely laid out.,10
Code Elegance,appropriate approaches taken for the implementation of the tasks.,9
Code Elegance,"code could be re-used, but more could be done to make it re-usable. code is maintainable.",9
Code Elegance,all the base tasks and some of the challenge tasks are implemented in such a way that code can be reused where possible;,7
Code Elegance,the majority of the code is written in such a way that code can be reused,6
Code Elegance,appropriate approaches taken to implementation of both core and challenge classes. very readable.,5
Code Elegance,code can be re-used. code is maintainable.,5
Code Elegance,better than others.,4
Code Elegance,code is written in a reusable manner by utilising abstract classes and loosely coupling components,4
Code Elegance,combines functionality with simplicity,4
Code Elegance,excellent use of classes and functions. efficient code.,4
Code Elegance,"good use of abstraction, and appropriate class hierarchy. could avoid lots of repetition by using private variables in superclasses and implementing getters within them. decent application of qualifiers to class fields and methods.",4
Code Elegance,"high clarity, simplicity, and efficiency.",4
Code Elegance,making it highly readable and understandable,4
Code Elegance,some efforts have been put into this project.,4
Code Elegance,"student demonstrates excellent use of classes and functions to produce reusable and maintainable code, where possible, in the base and all of the challenge tasks",4
Code Elegance,the code can be made more extensible by employing abstraction and increasing its modularity.,4
Code Elegance,a lot of code has been repeated through the implementation for each of the animal implementations.  it is more sensible to extract these codes and provide abstract methods to override such behavior.,3
Code Elegance,base and challenge tasks are efficiently implemented and remain perfectly readable and maintanable.,3
Code Elegance,code can be re-used. code is maintainable. excellent use of abstract classes.,3
Code Elegance,code can be re-used. code is maintainable. good use of abstract classes.,3
Code Elegance,"code could make use of abstract classes to improve extensibility and breakdown longer functions into smaller, modular functions",3
Code Elegance,"code is well written. abstractions are appropriately used to make code neat and well structured, and functions are appropriately broke down into well sized units. ",3
Code Elegance,"lots of repeated code, could have implemented the act functions in the animal class, same goes for givebirth and findfood. some functions are very long and should break them down.",3
Code Elegance,"the code follows good object-oriented design patterns, with a logical separation of concerns between classes. the base animal class encapsulates shared functionality. the individual creature classes inherit from animal and define their unique properties and behaviors. constants are used effectively to avoid magic numbers. there are opportunities to further refactor some of the duplicated logic between creature classes.",3
Code Elegance," good modularity, reusability, and encapsulation ",2
Code Elegance, it demonstrates a mastery of coding with clarity and precision.,2
Code Elegance,a good use of classed and functions and nicely laid out.,2
Code Elegance,"abstraction could go further, e.g. some methods within the animal classes could be within the class animal",2
Code Elegance,abstraction present in class structure however this is poorly utilised.,2
Code Elegance,advanced class structure implemented. there are one or two methods which could be-rewritten for generality in higher classes.,2
Code Elegance,all of the base tasks and some of the challenge tasks are implemented in such a way that code can be reused.,2
Code Elegance,basic abstraction class structure however this is well utilised with lots of methods residing in the animal class.,2
Code Elegance,clean separation of concerns across classes.,2
Code Elegance,code is resuseable,2
Code Elegance,concepts of the module well utilised,2
Code Elegance,easy to follow and maintain.,2
Code Elegance,"features are generally implemented in reusable ways using techniques such as polymorphism and inheritance. extensive knowledge of java allows this student to reduce repeated code segments. furthermore, good class design for cohesive classes. ",2
Code Elegance,"good code reusability, some functions are very long; should break them down. ",2
Code Elegance,good level of abstraction,2
Code Elegance,"inheritance is not fully made use of, with a lot of code duplication where not necessary.",2
Code Elegance,"inheritance was used well, but instances of code duplication in the same file could've been reduced.",2
Code Elegance,"lots of repeated code, could have implemented the act functions in the animal class, same goes for givebirth and findfood. some functions are very long; should break them down. ",2
Code Elegance,many features lack flexibility or are implemented in ways that are repeated in every class. these could be extracted to a more generic class such as animal.,2
Code Elegance,many segments could be rewritten to improve re-usability,2
Code Elegance,may be useful to have superclass for preys and predators to better differentiate between them,2
Code Elegance,"methods are reusable and readable, but some code repetition  and class redundancy",2
Code Elegance,"most methods in animal classes are repeatedly defined, so perhaps some sort of inheritance can be included in. there is some misuse of the visibility of methods. also would be quite hard to extend features for different diseases.",2
Code Elegance,no attempt made,2
Code Elegance,not bad for a student. terrible for a professional.,2
Code Elegance,"refreshingly simple and concise, yet effective code. good use of class structures and qualifications. abstractions are clear where they are used and are justified.",2
Code Elegance,"some abstraction present but there remains much more that could be achieved, e.g. more common methods in the animal class.",2
Code Elegance,some levels of abstraction ,2
Code Elegance,the application is implemented in such a way that only a few code segments can be rewritten to increase code re-usability,2
Code Elegance,the application is unnecessarily complex,2
Code Elegance,"the code is broken out into many separate classes for each species and simulation component, enabling decent modularity and reuse. the logic could likely be simplified in places, but overall the design and efficiency are reasonable without overly sacrificing readability.",2
Code Elegance,the code is well written.,2
Code Elegance,"the student demonstrate excellent use of classes and functions to produce reusable and maintainable code, the only downside would be decoupling the weather functionality from the simulator as a separate class.",2
Code Elegance,the submission is the same as the original ,2
Code Elegance,"this code demonstrates a deep understanding of programming principles, with each function perfectly aligned with its purpose.",2
Code Elegance,worse than the example.,2
Code Elegance,your code structure is commendable. the use of inheritance and abstraction to define common behaviors across different species shows advanced programming skills. this approach not only avoids redundancy but also facilitates code maintenance and future expansions.,2
Code Elegance,"a lot of code has been repeated through the implementation for each of the animal implementations.  it is more sensible to extract these codes and provide abstract methods to override such behavior. in addition, some extension features are implemented in ways for which it is hard to extend to add new features.",1
Code Elegance,a lot of code has been repeated through the implementation for each of the animal implementations.  it is more sensible to extract these codes and provide abstract methods to override such behavior..,1
Code Elegance,a lot of rewritten code,1
Code Elegance,a lot of rewritten code not utilizing abstract and  interfaces.,1
Code Elegance,a lot of rewritten code where it could be abstracted further. ,1
Code Elegance,a lot of rewritten code where it could have been generalized in an abstract class,1
Code Elegance,"a lot of rewritten code, could have utilized abstract clsses.",1
Code Elegance,abstract classes could be used to improve extensibility,1
Code Elegance,"abstract classes make code reusable and maintainable. to improve the extensibility of your code, it would be better to implement time in a separate class.",1
Code Elegance,"abstraction could go further, e.g. some methods within the animal classes (e.g. wolf) could be within the class animal",1
Code Elegance,abstraction level could be more advanced,1
Code Elegance,abstraction shown from predator and prey classes generalizes the find food method,1
Code Elegance,"abstraction shown in animal class, find food method is generalized and depends on the specific animal diet.",1
Code Elegance,"abstraction shown with actor class and animal class. however, could have implemented prey and predators to further generalize. a lot of rewritten code, act and find food methods.",1
Code Elegance,"abstraction shown with animal and actor class, animal classes do not use rewritten code and are generalized. created a new class to improve coupling",1
Code Elegance,"abstraction shown with predator and prey classes however, rewritten code with the hunt method in each animal",1
Code Elegance,"act function does too much, should break it down.",1
Code Elegance,"act function does too much, should break it down. excellent code reusability, no repeating code.",1
Code Elegance,"act function is similar for all animals, could of implemented it in the animal class for better code reusability.",1
Code Elegance,"act function is similar for all animals, could of implemented it in the animal class rather than having it as an abstract class for better code reusability.",1
Code Elegance,"act function is similar for all animals, should of implemented it in animal class for better code reusability.",1
Code Elegance,"act function is similar for all animals, should of implemented it in animal class for better code reusability. same goes for findfood function.",1
Code Elegance,"act function is similar for all animals, should of implemented it in the animal class. why is plant and infectableanimal class extending from animal class?",1
Code Elegance,advanced abstraction structure in classes however this could still be better utilised with more methods moved up to animal or organism.,1
Code Elegance,all features are implemented to an excellent standard. the student shows good understanding of encapsulation and inheritance. the addition of an actor class type makes for clean code and the sub-division into predator and prey improves modularity. methods are implemented with good use of single-responsibility. ,1
Code Elegance,"all the base tasks and some of the challenge tasks are implemented in such a way that code can be reused, where possible",1
Code Elegance,"all the common variables of the animals should be enclosed in a superclass, rather than defined individually for every class. 'female' class should be a characteristic of an animal, not a separate class. inside many classes, there are other class instances created that are not required. some methods are empty, this is not a good practice.",1
Code Elegance,all the values that are common for many classes could have been initialised in the superclass and then just assigned. the 'givebirth' method is repeated many times in each class.,1
Code Elegance,"all the values that are common to an animal should have been defined in a superclass rather than instantiated in each class. the code is quite easy to read, but a bit too simplistic.",1
Code Elegance,all the variables that are common to animals should have been enclosed in the superclass and defined through the constructor.,1
Code Elegance,animals and plants extend entity. animals may be abstracted further into 'predator' and 'prey' classes for better extendability.,1
Code Elegance,appropriate approaches taken for the implementation of the tasks however inefficient implementation of the environment interactions causes the simulation to execute very slowly.,1
Code Elegance,appropriate approaches taken for the implementation of the tasks however some methods like the canbreed() function  could benefit from further simplification.,1
Code Elegance,appropriate approaches taken to implementation of both core and challenge classes. classes could be better encapsulated however.,1
Code Elegance,appropriate approaches taken to implementation of both core and challenge classes. quite readable although hard to judge effectiveness of implementation with no simulation.,1
Code Elegance,appropriate approaches taken to implementation of both core and challenge classes. would've been more desirable to give each animal their own file to make it easier to discrimnate between each of their expected behaviours. this would've also allowed for better maintainability.,1
Code Elegance,"attempt to use difficult concepts, but the implementation does not run as required...",1
Code Elegance,attempts have been made to reduce repeated code through abstract classes. not very flexible when it comes to the design of weather and weather-based behavior.,1
Code Elegance,base and challenge tasks are very efficiently implemented and remain perfectly readable and maintanable.,1
Code Elegance,basic abstraction class structure however this is excellently utilised with lots of methods residing in the animal class.,1
Code Elegance,class design and hierarchy is sensical.,1
Code Elegance,class design and hierarchy is sensical. smart choice on making manager classes.,1
Code Elegance,class design and hierarchy is sensical. some shared variables can be put into the superclass.,1
Code Elegance,class design is sensical. a lot of copied and pasted code.,1
Code Elegance,class hierarchy allows addition of more organisms. food chain class does not seem the best approach. the food chain should be able to be implied from the class hierarchy.,1
Code Elegance,class hierarchy and design is sensical.,1
Code Elegance,class hierarchy is good and supports extension. non final variables should not be capitalised.,1
Code Elegance,class hierarchy is logical. some seemingly copied and pasted code. logic for each animal type should not be programmed in its superclass.,1
Code Elegance,class hierarchy is sensible. minimal code redundancy.,1
Code Elegance,class hierarchy is sensical and allows for extension. images could be stored in a separate folder to clean folder structure.,1
Code Elegance,class hierarchy is sensical and designed well.,1
Code Elegance,class hierarchy is sensical and uses it well.,1
Code Elegance,"class hierarchy is sensical, but does not use inheritance features to its fullest extent. a lot of copied and pasted code.",1
Code Elegance,class hierarchy is sensical. some copied and pasted code. some questionable code design (why is foodsource instantiated each time getfoodsource is called?).,1
Code Elegance,class hierarchy logic is questionable. why does plant extend animal? findfood method can be generalised better.,1
Code Elegance,class hierarchy makes sense. final variables that require adjustment should not be kept in a class. they should be kept in the relevant method.,1
Code Elegance,class hierarchy works well. a lot of variables are not clear for what they are used for. animal stats are an enum in animal. reason for this is unclear.,1
Code Elegance,class structure and design generally good. some shared variables could be moved to the super class. some further abstractions can be made to move even more shared variables (e.g. distinction between predator and prey.),1
Code Elegance,class structure and design is well-meaning. ,1
Code Elegance,class structure is basic and poorly utilised. much of the code could be written for the animal class instead of being duplicated for each animal.,1
Code Elegance,classes and functions are reusable and maintainable,1
Code Elegance,classes are cohesive and loosely coupled and code makes use of abstraction,1
Code Elegance,classes structure lacks abstraction.,1
Code Elegance,classes were created in different increments and there is a difference of design between them.,1
Code Elegance,clean code standards could be followed. ,1
Code Elegance,clever use of the concepts used during the course,1
Code Elegance,code can be re-used. code is maintainable. excellent use of abstract classes and use of csv for animals. gui elements built in modular manner onto of simulator.,1
Code Elegance,code can be re-used. code is maintainable. excellent use of abstract classes for predators/prey.,1
Code Elegance,code can be re-used. code is maintainable. excellent use of abstract classes. good use of enum for weather.,1
Code Elegance,code can be re-used. code is maintainable. good use of abstract classes and enums.,1
Code Elegance,code can be re-used. code is maintainable. good use of abstract classes for predators/prey but plant implemented as animal.,1
Code Elegance,code can be re-used. code is maintainable. good use of abstract classes for predators/prey.,1
Code Elegance,code can be re-used. code is maintainable. good use of abstract classes. some improvements could be made to make code more re-usable (such as disease in plant class rather then grass.),1
Code Elegance,code can be re-used. code is maintainable. good use of abstract classes. weather implementation is inefficient.,1
Code Elegance,"code can be re-used. code is maintainable. plant not implemented separately, inhibits re-use.",1
Code Elegance,code can be re-used. code is semi-maintainable. abstract classes used but pointless. separate class for each weather inefficient.,1
Code Elegance,code could make use of abstract classes to improve extensibility,1
Code Elegance,code generally well implemented. some design decisions should be reconsidered. some methods show low cohesion.,1
Code Elegance,code has been rewritten where it does not need to be.,1
Code Elegance,code is elegant but seems to be the same as the default submission.,1
Code Elegance,code is generally implemented well. some inconsistent design decisions. some methods have low cohesion (e.g. incrementage also determines if an animal dies),1
Code Elegance,"code is generally quite clean. certain aspects of the program may be over-abstracted; for example, the existence of the simulatable class isn't entirely justified, nor does it make complete sense - everything in your simulation is inherently simulatable. that class seems to be better fitted to describing an organism rather than any simulatable object. similarly, locatable (which is semantically better defined with an interface rather than a class, if it should even exist) doesn't entirely make sense either. it seems every animal should be locatable anyway, so perhaps animals and other non-animal yet locatable objects should inherit a base class providing these aspects. you have some dead code included also.",1
Code Elegance,code is maintainable and extendable with good use of abstract classes,1
Code Elegance,code is maintainable with good use of abstract classes,1
Code Elegance,"code is relatively clean, but there is some disorienting logic, particularly how you are deciding what animals to simulate. is the generation probability being 0 not enough to not simulate an being?",1
Code Elegance,"code is semi-re-usable/maintainable. however, plants implementation as an animal causes problems.",1
Code Elegance,code is well structured and allows for easy extension. animal food values are better stored in the animal themself.,1
Code Elegance,code is written in a reusable manner,1
Code Elegance,code is written in a reusable manner by using abstract classes,1
Code Elegance,code is written in a reusable manner by using abstract classes and loosely coupling components,1
Code Elegance,code is written in a way that is readable and extensible with the use of abstract classes,1
Code Elegance,code is written is a way that is readable and extensible.,1
Code Elegance,code reusability can be improved,1
Code Elegance,code segments could be extracted to a parent class. it is hard to extend for other diseases and weather-based behavior ,1
Code Elegance,"code well structured and well designed. concepts of the class used correctly, some challenges implemented",1
Code Elegance,comcpets of the course well utilised. good structure,1
Code Elegance,concepts f the course used wisely,1
Code Elegance,concepts learnt in class well utilised,1
Code Elegance,concepts of the class well utilised,1
Code Elegance,concepts of the course are used wisely.,1
Code Elegance,concepts of the course very well utilised to serve a clean and clever implementation. weel done,1
Code Elegance,concepts of the course well used,1
Code Elegance,concepts of the course well utilised,1
Code Elegance,"contains couple of formatting, naming issues, some methods can be extracted to abstract class or interface, code reusability sacrificed",1
Code Elegance,contains some small format and naming glitches,1
Code Elegance,could be better.,1
Code Elegance,could make use of additional classes for more abstraction - e.g. predator/prey.,1
Code Elegance,"could of created a separate class for disease. repeating code for finding food, could of implemented this in the animal class.",1
Code Elegance,could of implemented the act and give birth functions in animal class rather than each individual animal for better code reusability.,1
Code Elegance,"could utilise additional classes, e.g. predator/prey to provide additional elegance.",1
Code Elegance,"day act and night act functions are very similar for all animals, should of implemented it in the animal class for better code reusability.",1
Code Elegance,"did not utilize abstraction and interfaces, a lot of rewritten code.",1
Code Elegance,"did not utilize abstraction and interfaces, some rewritten code.",1
Code Elegance,each function is perfectly aligned with its purpose.,1
Code Elegance,easy to read but mistake in localisation,1
Code Elegance,effective use of functional programming concepts.,1
Code Elegance,efficient and clever use of the concepts taught in class to create an original answer to the problem. well done.,1
Code Elegance,"empty class, mistake in the simulation creation ",1
Code Elegance,"examples of abstraction shown, animals implement entities class. eagle extends avian animal showing even further abstraction and less rewritten code",1
Code Elegance,"excellent structure, however there is scope to further utilise this by moving common features to more asbtract classes.",1
Code Elegance,excellent use of abstract classes and i like the use of enums. the code is implemented with good maintainability and modularity. good effort has been made to appropriately hide complexity. ,1
Code Elegance,"excellent use of abstraction with predator type classes, consumable class, etc.",1
Code Elegance,excellent use of classes,1
Code Elegance,excellent use of classes and functions but the code is incomplete,1
Code Elegance,excellent use of classes and functions to make re-usable and maintainable code.,1
Code Elegance,"excellent use of classes and functions, code is modular, reusable and maintainable.",1
Code Elegance,excellent use of classes and functions. efficient code. good use of abstraction.,1
Code Elegance,excellent use of classes and inheritance to organize the code in a maintainable way. species-specific logic is encapsulated in subclasses that inherit shared behavior from abstract base classes. methods are focused and cohesive. the genetic algorithm in the builder class is a creative approach to tuning the simulation parameters.,1
Code Elegance,"features are generally implemented in reusable ways using techniques such as polymorphism and inheritance. furthermore, good class design for cohesive classes.",1
Code Elegance,"features are generally implemented in reusable ways using techniques such as polymorphism and inheritance. however, it is not easy to add new weather or diseases to the environment.",1
Code Elegance,features are implemented in ways in which it is maximally reusable through the use of inheritance and polymorphism of classes.,1
Code Elegance,"format, naming issues + does not satisfy clean code principles ",1
Code Elegance,"generally correct organisation of code but there is a lot of repetition, for example, you have implemented identical getters and setters for identical variables in the class. you can use a private (but not final) variable for the breeding_age, max_age, etc, variables in its superclass with no setter such that it is only defined in the constructor, and you don't need to reimplement getters every time.",1
Code Elegance,generally good and sensical class design. ,1
Code Elegance,generally good class design and hierarchy.,1
Code Elegance,generally good class design and hierarchy. further abstractions can be made between prey and predator.,1
Code Elegance,generally good class design and hierarchy. some child variables can be moved to the superclass.,1
Code Elegance,generally good class design and sensical hierarchy. some child class methods can be moved to the super class.,1
