skill,comments,count
Code Elegance,"the code is generally well-structured and modular, with appropriate use of classes, inheritance, and interfaces. the responsibilities are separated among different classes, promoting code reusability. ",1
Code Elegance,"the code is implemented competently however further effort should be made on improving the modularity and extensibility of the code. for example, including a predator/prey sub-type would be a nice addition, and moving common code to animal super-types would improve the code elegance. some classes are too tightly-coupled. for example, the agent classes should control their own behaviours under different time and weather conditions, rather than this being governed by the simulator class",1
Code Elegance,the code is organised very well. the addition of the predator and prey classes improves the encapuslation of common functionality. the specific animal subtypes are simple and clear as a result,1
Code Elegance,"the code is organized into classes representing different entities in a reasonable way. there is some good separation of common behaviors into abstract base classes like actor, animal, predator and prey. constants are used for configuration. but overall the code is fairly readable and understandable.",1
Code Elegance,the code is reasonably well structured with good use of encapsulation and modularity. the code would benefit from adding predator and prey subclasses. the use of the location class is elegant and improves scalability,1
Code Elegance,the code is reasonably well structured with simple use of subtyping and inheritance (for example with the plant subtypes). the animals would benefit with further sub-division such as with a predator and prey subclass. some methods such as the findfood() methods are too large and encapsulate too many functions. these should be divided further. ,1
Code Elegance,the code is structured competently with use of enums and inheritance between classes. introducing a prey and predator subtype could be a good idea for encapsulating common behaviours. ,1
Code Elegance,the code is structured exceptionally with good use of inheritance and encapsulation. abstract classes and methods have been used appropriately and the predator and prey classes help to keep animal sub-types clean and concise,1
Code Elegance,"the code is structured reasonably well, however, some improvements could be made. for example, the weather types should be an enum rather than an int assigned by methods. the common methods for animals should be placed in superclasses such as predator, prey. the plant class should have its own subtype and specific plant instances.",1
Code Elegance,"the code is structured reasonably with separate classes for each species inheriting from an animal superclass. however, there is a lot of duplicated code between species classes that could be refactored into the superclass to improve reusability. the code is readable but some design decisions are questionable, like having so many static constants.",1
Code Elegance,the code is structured very well with a good display of knowledge on encapsulation and inheritance. the student uses abstract classes effectively to further enforce extensibility. ,1
Code Elegance,"the code is structured very well with good consideration for encapsulation and inheritance. the actor and animal classes hold common functionality. the foodchain helper class helps with keeping the code clean and concise. the weather classes are probably unnecessary for this task, however, are not inherently a bad design decision.",1
Code Elegance,the code is structured very well with good demonstration of knowledge on encapsulation and inheritance. the carnivore and herbivore subclasses effectively encapsulate common methods. the specific animal instances are therefore clear and concise.,1
Code Elegance,the code is structured very well with good use of additional superclasses and extensions. the addition of enums improves the code maintainability. ,1
Code Elegance,the code is structured very well with good use of classes and modularisation. the addition of predator and prey classes is good and pushing common methods to superclasses makes for clean and extensible code.,1
Code Elegance,"the code is structured very well with good use of encapsulation and inheritance. the use of enums for gender, etc. is ",1
Code Elegance,the code is structured very well with good use of subtyping and inheritance. the use of a predator and prey subtype helps to keep the code clean.,1
Code Elegance,the code is structured well throughout and shows good understanding of inheritance. the structure of the abstract animal and plant classes is a nice addition. the weather type could use an enum rather than being a string.,1
Code Elegance,"the code is structured well with a good use of classes and methods. the student added an 'organism' class as a common superclass of the plants and animals, however, the animal class should extend the organism class and further encapsulate the animal types. ",1
Code Elegance,the code is structured well with good use of classes to modularise code. the codebase would benefit from the addition of predator and prey classes for improved extensibility,1
Code Elegance,the code is very well organised with good use of abstract classes. common functionality is suitably encapsulated inside super-classes. there are some instances of inappropriate close-coupling of classes including the wolf and zebra classes,1
Code Elegance,"the code is well implemented and the student demonstrates good practise of using encapsulation and inheritance. the code structure would benefit from introducing a predator and prey class, however, the common methods of animals have been moved to the animal class. the field class contains helpful methods for identifying the contents of neighbouring cells which makes for clean and extensible code.",1
Code Elegance,"the code is well organised and for the most part, classes are well modularised and contained. i like the animal class exposing the cold, hot, etc. behaviours. however, there is a considerable amount of repeated code which could be delegated to a common super-type for predator/prey, etc. ",1
Code Elegance,"the code is well presented and is sufficiently maintainable. however, more effort should be made on the use of inheritance and sub-typing. for example, a predator or prey class should be implemented to hold repeated code. the methods inside classes are sufficiently self-contained however, and exhibit the single-responsibility principle. ",1
Code Elegance,the code is well structured and shows a good understanding of classes and inheritance. the time class is an elegant addition. the code would benefit with a predator and prey class to help with encapsulating common code across animals. ,1
Code Elegance,"the code is well structured overall, however, some design decisions are questionnable. the introduction of predator and prey sub-types is nice, but plants extending animals makes the code more difficult to parse at a glance. the weather types should be an enum rather than just a string, but the probabilities of selecting between weather are articulated well with final static variables. ",1
Code Elegance,"the code makes excellent use of classes and inheritance to create a well-structured simulation. the organism abstract class defines shared functionality, with specific animal and plant classes extending it. methods are used effectively to encapsulate behaviors.",1
Code Elegance,"the code makes excellent use of classes, inheritance (abstract base classes animal, plants, microorganisms), and functions to enable code reuse across the different species classes. the logic is broken out well, like having an act() method for each species. fields and methods have clear access control. the code looks efficient and readable.",1
Code Elegance,"the code makes excellent use of classes, inheritance and polymorphism to enable reusability and maintainability. the core animal class is cleanly extended by predator and the specific animal classes. behavior is abstracted well, like with the act(), breed() and eat() methods.",1
Code Elegance,"the code makes excellent use of classes, inheritance and polymorphism to enable reusable and maintainable code. the base animal and prey/predator classes factor out common functionality. each specific animal subclass encapsulates its unique attributes and behaviors. classes are used for key concepts like location, field, clock, weather, disease etc. enabling modularity. overall the code is efficient and very readable.",1
Code Elegance,"the code makes excellent use of classes, inheritance, and interfaces to create well-organized, reusable and maintainable code. class responsibilities are clearly delineated. abstractions like animal, disease, weather allow shared behavior to be cleanly captured. the code is efficient and readable.",1
Code Elegance,"the code makes excellent use of classes, interfaces and inheritance to enable code reuse and extensibility across the various animal and plant types. behavior is elegantly captured in base classes and interfaces. the code is well organized into different files and uses appropriate access modifiers. while there is a lot of code, it does not sacrifice readability and the logic is clear.",1
Code Elegance,"the code makes excellent use of inheritance with base animal, plant and species classes. behavior is customized through polymorphism and constants defined in species-specific data classes. this allows new species to be added easily. the simulator is well structured, encapsulating field and simulation state. ",1
Code Elegance,"the code makes excellent use of inheritance with base animal, predator, and plant classes. shared constants and methods are defined in parent classes. each specific animal and plant type extends the base classes with their unique characteristics. this produces very clean, readable and maintainable code.",1
Code Elegance,"the code makes good use of classes, inheritance (e.g. all animals extend the animal abstract class) and instance variables to enable code reuse.",1
Code Elegance,"the code makes good use of inheritance with an abstract animal class and specific subclasses for each species. behavior is encapsulated within each class. fields and methods have clear, descriptive names. the code is efficient, using collections effectively.",1
Code Elegance,the code makes good use of inheritance with an abstract animal class. behavior is encapsulated within each animal subclass. fields and methods have clear purposes.,1
Code Elegance,"the code makes good use of inheritance with an abstract animal class. code that can be shared between species, like movement, is in the base class. species-specific behavior is neatly encapsulated in each subclass. fields and methods have clear purposes. the time and weather classes add useful functionality without cluttering the main classes. ",1
Code Elegance,the code makes good use of inheritance with an abstract organism superclass. classes and methods are used effectively to organize the code and enable reuse. the logic is clean and efficient. ,1
Code Elegance,"the code makes good use of inheritance, with an abstract animal class that the concrete species classes extend. this allows for code reuse. the logic for animal behaviors like moving, eating, and breeding is encapsulated within each class. ",1
Code Elegance,"the code makes great use of inheritance, with a base food class that plant and animal extend from. this allows shared functionality to be reused. there are also abstract act() methods that get implemented in each subclass. the logic for each animal species is broken out into its own class which encapsulates the species-specific properties and behavior. constants are used effectively for things like breeding age, food value, etc. the code is efficient, readable and well-structured.",1
Code Elegance,"the code presented has some elements of elegance. however, it  is too simplistic to be considered as complex enough.",1
Code Elegance,"the design is questionable. there is a cyclical relationship with organism, animal, and the various types of animals. it makes extending the program a more arduous process. behaviour of each animal would be better specified on a class-by-class basis.",1
Code Elegance,the enum are defined in a different way. some of the characteristics of the animals should have been shared by the superclass.,1
Code Elegance,the food chain class is an elegant way to represent the predator/prey relations.,1
Code Elegance,the genderequals method should have been defined in the superclass rather than exploited in each of the subclasses. this also applies to the common attributes between many different animals. the same happens also with the different kind of plants.,1
Code Elegance,"the methods 'createweatherlist' is redundant and it complicates the code. similar characteristics of different species are defines repeatedly in each subclass, rather than in their superclass.",1
Code Elegance,"the refactored class, even though it contains attributes that are common for all the animals, some of them define them again in their class. the weather class is not correctly defined as it is empty - not good practice.",1
Code Elegance,the spacing is not correct in some areas of the program. some of the attributes that are common for each species are not determined in the superclass. abstract methods inside classes that are not abstract. methods are not either private/protected/public.,1
Code Elegance,"the student demonstrates a sound understanding of encapsulation and inheritance. the introduction of a plant superclass is a nice touch. the animal classes could be divided into subtypes of predator, prey supertypes for improved modularity. the creatures class contains too many disparate parts of model logic that should be distributed elsewhere. for example, mixing weather with time, location, and life is not ideal. ",1
Code Elegance,the student demonstrates excellent use of classes and functions to produce reusable and maintainable code; the code is efficient without sacrificing readability and understanding.,1
Code Elegance,the student demonstrates excellent use of classes and functions.,1
Code Elegance,"the student demonstrates excellent use of classes and inheritance to produce reusable and maintainable code. the animal and habitatfood abstract classes define shared functionality. each species extends these appropriately (e.g. mouse, hyena, flower). methods are used effectively to encapsulate behaviors like eating, breeding, aging, and disease transmission. the code is efficient and readable.",1
Code Elegance,"the student demonstrates excellent use of classes, inheritance (abstract animal class extended by predator and prey) and polymorphism to create a well-structured, extensible design. the code is broken into logical methods and avoids redundancy. fields and methods have appropriate access modifiers. the act() methods delegate work to other methods with clear purposes like givebirth(), findfood() etc. smart optimizations are made, like caching free adjacent locations. ",1
Code Elegance,"the student exhibits an adept knowledge of encapsulation and modular code design. abstract classes, enums, and inheritance are used appropriately. the general code structure is well-organised and open to extension. ",1
Code Elegance,"the student has shown a good understanding of code modularity, inheritance and use of abstract classes. the use of predator/prey sub-types is good, and the encapsulation of common behaviours in the animal class is clean.",1
Code Elegance,the student has submitted the original task code unmodified with no extensions,1
Code Elegance,the student shows a good understanding of code structuring with good use of inheritance and abstraction. the inclusion of predator and prey classes is clean and appropriate for encapsulation. the time and weather classes also improve dependency management. ,1
Code Elegance,"the student shows a good understanding of encapsulation and inheritance: for example, introducing the organism class to contain common methods and properties of agents. however, the plants and animals should be divided into their own subtypes and a predator / prey class would improve modularity. ",1
Code Elegance,the student used abstract classes and interfaces well. the code is modularised well and is open to extension. the classes and methods adhere to the single-responsibility principle. common functionality is pushed to the superclasses such as 'animal',1
Code Elegance,"the student uses abstract classes and inheritance appropriately, however, some design decisions negatively impact the elegance of the codebase. for example, the act() method of agents is much too large and is difficult to maintain- mixing logic for many disparate concerns such as breeding and movement. the submission includes what appear to be previous versions of the code in the form of [1].java files (however i have not marked the student lower for these)",1
Code Elegance,the student uses encapsulation and inheritance well. the inclusion of nature as a class type is effective for implementing the tree and weed. there are some methods such as act() which are too large and would benefit from being divided further. the passing of 'frogpresent' etc. in these classes should be avoided to reduce tight-coupling of classes,1
Code Elegance,the student uses encapsulation and inheritance well. the use of interfaces for 'eatable by' is clever and effective. the inclusion of carnivore and herbivore subtypes makes for easily-maintanable code,1
Code Elegance,the submission is merely the handout code.,1
Code Elegance,"the use of the 'actor' interface seems redundant. the variables are repeatedly initialised in the child, but a better option would be to initialise them in the superclass. the colour method is not correctly placed.",1
Code Elegance,"there are many characteristics common to multiple animals, but they are all defined in the subclass, rather than in the superclass. the 'animal' class contains abstract methods, even though it is not abstract.",1
Code Elegance,"there are many variables defines inside the subclass rather than the superclass, even though many subclasses share the same characteristics. the 'prey' class presents only a constructor - this is not considered good practice.",1
Code Elegance,"there are many variables that should be specific to a superclass that are defined in a subclass. 'disease' class has an empty constructor - so does 'winter'. the difference between a male and a female should not be made by a different class. fox acts as a superclass for foxes, instead of an animal class that is a superclass for all of them, and without a fox class.",1
Code Elegance,"there are some clear remnants of copy pasting/chatgpt usage. class structure is unintuitive, particularly how elements are structured. ",1
Code Elegance,there are some constructors that are empty - this is not considered good practice.,1
Code Elegance,"there are some variables that are shared by all superclasses, but they are defined in all the subclasses.",1
Code Elegance,"there is a redundant class just for making use of the arraylist, this is not desirable.",1
Code Elegance,"though i see the effort, i do not think they know what inheritance really means, which results in a worse design compared to the example.",1
Code Elegance,time and weather could be implemented in separate class to improve extensibility,1
Code Elegance,"to better differentiate between preys and predators, it may be helpful to have a super class for preys and another super class for predators.",1
Code Elegance,"to improve extensibility of code, it would be useful to add superclass for predators and preys",1
Code Elegance,"to improve extensibility, it would be better to implement plant as a abstract class",1
Code Elegance,"to improve the extensibility of your code, it would be better to implement time in a separate class.",1
Code Elegance,"usage of interfaces incorrectly, compilation errors. a lot of code rewritten when it could have been implemented in an abstract class,",1
Code Elegance,"use of actor interface, predator and prey classes helps keep the code elegant.",1
Code Elegance,use of classes and functions improves code extensibility ,1
Code Elegance,very good application of the notions of the module,1
Code Elegance,"very good use of the notion of the module, good implementation of the challenge tasks",1
Code Elegance,"very good, great options and challenges, good use of notion in class and a lot a creativity ",1
Code Elegance,very well done ! all the concepts learnt during the module are wisely used to serve your project,1
Code Elegance,very well structured code,1
Code Elegance,"very well written, many challenges very well implemented, good balance in parameters",1
Code Elegance,"well strucutred, notion learnt in class properly utilised, some challenges tried",1
Code Elegance,"whilst code is generally well written, some aspects of what class/entity should be responsible for what task remain a little unintuitive. for example, it doesn't seem semantically intact for the simulator to decide what animals (predators in this case) should act or not when there is fog. it would make more sense for an animal to ingest this information and decide what it will do.",1
Code Elegance,"whilst most abstractions and oop principles are applied sensibly, there are some fundamental misrepresentations of entities and their position in the class hierarchy. take, for example, disease - it shouldn't stand that a disease should keep track of every animal it infects, but rather an animal contracts a disease and this affects its behaviour/internal parameters.",1
Correctness,"core tasks: all listed core tasks have been completed, indicating a comprehensive approach to the simulation's basic requirements.

challenge tasks:  three challenge tasks are completed (plants, weather, disease), demonstrating exceptional technical aptitude and creativity in extending the simulation beyond the basic requirements.

bluej: run's in bluej without any issues.",27
Correctness,it is basically correct.,12
Correctness,all base tasks and extension tasks have been completed. documentation is provided for how each of the tasks is completed.,6
Correctness,core and challenging tasks completed,6
Correctness,seems unoriginal and lacks interesting thoughts.,6
Correctness,the application works as described in the assignment; all base tasks are completed; the student has completed all of the challenge tasks;,6
Correctness,does not compile,5
Correctness,it is good.,5
Correctness,some efforts have been put into this project.,5
Correctness,all base tasks and extension tasks are completed. some documentation on how these tasks are implemented.,4
Correctness,all core and challenge tasks completed. no additional extension work.,4
Correctness,the application functions incorrectly on some inputs/actions.,4
Correctness,the application works as described in the assignment; all base tasks are completed; the student has completed some of the challenge tasks;,4
Correctness,"the application works. base tasks completed. 3 challenge tasks attempted (plants, disease, weather). ",4
Correctness,"the application works. base tasks completed. 3 challenge tasks attempted (plants, weather, disease).",4
Correctness,all base and challenge tasks completed to a high standard. ,3
Correctness,all base and challenge tasks completed. no self-defined extension implemented. ,3
Correctness,all base tasks and extension tasks have been completed. some documentation is provided for how each of the tasks is completed.,3
Correctness,all challenge and base classes are implemented correctly to a high standard.,3
Correctness,all core and challenge tasks are completed,3
Correctness,all core tasks completed. extension tasks completed except for disease implenetation.,3
Correctness,minor details of tasks are violated; the application functions correctly; the student has completed some of the challenge tasks.,3
Correctness,much effort has been put into this project.,3
Correctness,no disease,3
Correctness,program runs well. some challenge tasks were attempted.,3
Correctness,the application works as described in the assignment; all base tasks are completed; the implementation demonstrates originality and creativity. and technical excellence in the completion of all challenging tasks,3
Correctness,"the application works. base tasks completed. 2 challenge tasks attempted (plants, disease). ",3
Correctness,"the application works. base tasks completed. 2 challenge tasks attempted (plants, weather).",3
Correctness,"the core requirements like having 5+ species with predators, prey, plants, gender, and day/night behavior seem met based on the code. the challenge mission was completed well.",3
Correctness,very great in terms of correctness. this does a better job than the example code.,3
Correctness,"added a graph view, core and challenging tasks completed",2
Correctness,all base and challenge tasks are completed,2
Correctness,all base and challenge tasks completed,2
Correctness,all base tasks and extension tasks are completed. some documentation on how these tasks are implemented,2
Correctness,"all base tasks and extension tasks have been completed. generally, class design is quite crafty. documentation has been provided for how each tasks are completed.",2
Correctness,all base tasks and some extension tasks have been completed. documentation is provided for how each of the tasks is completed.,2
Correctness,"all base tasks and some extension tasks have been completed. generally, there are indications/documentation on what has been completed and they were completed reasonably.",2
Correctness,all base tasks completed to a high standard. no challenge tasks completed. ,2
